corpus	sentence
itwac	Altre attività Ha partecipato e sta partecipando alle seguenti ricerche del Dipartimento di Sociologia dell' Università Cattolica : L' incidente di Trecate attraverso la stampa quotidiana , ( marzo 1995 ) , Ambiente e opinione pubblica ( marzo 1994 ) , La classe dirigente lombarda di fronte alla globalizzazione ( 1998/99 ) , L' educazione ambientale nei centri parco in Lombardia ( 1996 ) , Atteggiamenti delle popolazioni coinvolte dalla reintroduzione dell' [SEP] orso [SEP] nel parco dell' Adamello-Brenta ( 1999 ) ; Problemi sociali inerenti all' attuazione della normativa agroambientale in Lombardia ( 2000 ) .
itwac	18/01/2005 E' USCITO IL NUOVO NUMERO DE " LA GRAMIGNA " , IL BOLLETTINO DELLA SEZIONE PROVINCIALE DI TERAMO DEL WWF 11/12/2004 IL WWF RICERCA COLLABORATORE CON MANSIONI DI SUPPORTO TECNICO  ORGANIZZATIVO PRESSO LA SEZIONE REGIONALE ABRUZZO 13/11/2004 CAMPO INVERNALE WWF PER L' ORSO BRUNO 3 - 8 dicembre 2004 - Villavallelonga ( AQ ) 23/10/2004 LE 15 PROPOSTE DEL WWF PER UN BILANCIO REGIONALE SOSTENIBILE 30/09/2004 Dalla parte dell' [SEP] Orso [SEP] : il programma " 17/09/2004 " Vogliamo esprimere il nostro più profondo dissenso e sconcerto rispetto ad un progetto che non si può non definire come devastante per una delle più importanti montagne dell' intero Appennino ...
itwac	Mano a mano che procede il viaggio a lui si aggiungono altri personaggi : miss Piggy , porcellina che ha vinto un concorso di bellezza , l' [SEP] orso [SEP] Fozzie , il grande Gonzo .
itwac	La tristezza non è nella pianura padana e l' allegria non è nei sassi del Foro : allegria e tristezza sono cose che abbiamo dentro di noi , infatti io nella pianura padana , avvolto nella nebbia lattiginosa , mi sento felice come l' [SEP] orso [SEP] che ha cuccato una foca .
itwac	Cemento , piloni e sbancamenti sono incompatibili con la vita di lupi , [SEP] orsi [SEP] , aquile reali e di centinaia di specie di piante rarissime che solo nel Parco trovano rifugio .
itwac	Anche se ora ne approfittiamo per puntualizzare che da Aldo non è come molti credono una trattoria per [SEP] orsi [SEP] ; da lui si fanno analisi di calcio con il giradischi rotto della moviola in campo e con la tranquilla motosega di Franco Melli .
itwac	Dietro i compagni di Davide in testa - i militanti del centro sociale [SEP] Orso [SEP] - ha sfilato il movimento antagonista , il sindacalismo di base al gran completo , i disobbedienti , e anche tanta gente affacciata alle finestre , passanti e persone che pur non frequentando i centri sociali ieri hanno colto tutta l' importanza di essere con loro .
itwac	CAIMANO - C' è anche [SEP] Orso [SEP] CROTALO - Mi porto dietro un deficiente ?
itwac	Nel senso che proprio come ha fatto l' inventore di Topolino e Paperino , ma soprattutto dell' elefantino Dumbo , dell' orso Baloo o del capriolo Bambi - oltre al Re Leone e ad un' infinità di altri cartoon ricalcati su altrettanti animali - il regista francese , oggi autore del toccante « Due fratelli » , è il solo cineasta che tenta con i suoi film ( « L' [SEP] orso [SEP] » è del 1988 ) di rappresentare gli animali con i loro sentimenti .
itwac	Non a caso vanta ben 500 primavere il Tiglio di Sant' [SEP] Orso [SEP] , nel centro storico di Aosta , presso il complesso medievale dei SS .
itwac	Tra gli imputati anche un gasdotto Snam , che passerebbe nel parco regionale Sirente-Velino , ritenuto una pericolosa alterazione dell' habitat dell' [SEP] orso [SEP] bruno .
itwac	Gus , invece , l' orso del Central Park è un [SEP] orso [SEP] polare costretto a vivere a New York , nello zoo , dal 1988 .
itwac	Un passante , interrogato , dichiara di aver visto l' [SEP] orso [SEP] seguire una ragazza in una casa .
itwac	L' [SEP] Orso [SEP] dapprima ha ringhiato un paio di volte poi , preso da un accesso di entusiasmo , mi ha colpito con un amorevole pacca sulla schiena che mi ha spedito direttamente dal corridoio in cucina , passando attraverso la parete di mattoni .
itwac	aggiungere invece un occhiogramma un ditogramma un tuttogramma abbracciati alla pelle sarebbe come stare in un [SEP] orso [SEP] : caldi non dentro un osso schiacciati guardare con le palle piccole degli occhi se il resto si gonfia mezz ' ora un' ora due ore con Carrie sullo schermo o persino chi lo sa un qualsiasi straccio : periferia degli imperi autunno così se lo guarda nudo sotto l' ombra del pergolo che invece è una platea l' azzurro del fumo fa una carta geografica che andremo torneremo tra i turchi col cavallo delle nostre stranezze baceremo i cani circoncisi sulle palpebre staremo ancora a dita giunte sui gradini di Efeso non so di Didyma con la Medusa oppure niente : guarderemo l' ombra del telegrafo baceremo il palmo di una mano di plastica per grattare una stadera di passi nelle calze bucate di lana le tarme degli imperi l' atto d' amore del resto è zafferano sulla neve arriva certe ore in primavera poi guarda con le dita alla fronte il mondo è curvo che veste le zampe alle farfalle di grigio anche senza le calze il sanculotto che si potrebbe osservare dentro noi non sono proprio l' ultimo momento ma al decidere di morire saranno certo più vivaci senz' altro cercheranno di contare tra le unghie i giri della pendola gialla che dice un po' sì un po' no lungo poema poema delle calze lungo fiume le rose hanno piegato il mento non possono annuire nemmeno le calze sono adesso il problema che la storia infila ai polpacci degli imperi e le rose che dire ?
itwac	Il secondo premio , [SEP] Orso [SEP] d' Argento - Gran Premio della giuria , è stato attribuito al fantasioso Adaptation di Spike Jonze , in odore di Oscar per il suo protagonista Nicolas Cage e nominato anche per la sceneggiatura .
itwac	Berlinale 2002 , Orso d' oro ex aequo per " Bloody Sunday " e " Spirited away " 17 febbraio 2002 - Berlino - " Bloody Sunday " di Paul Greengrass e " Spirited Away " di Hayao Miyazaki hanno vinto ex aequo l' [SEP] Orso [SEP] ...
itwac	Lo ha detto l' assessore all' ambiente della Regione Liguria Franco [SEP] Orsi [SEP] , coordinatore delle Regioni Italiane in materia , dopo che nel corso della Conferenza Unificata Stato-Regioni , i l Ministero dell' Economia ha confermato la necessità per l' Erario di disporre delle entrate previste con gli aumenti .
itwac	Noi camminiamo veloci intabarrati come [SEP] orsi [SEP] , con sciarpe , guanti e cappello .
itwac	18/01/2005 E' USCITO IL NUOVO NUMERO DE " LA GRAMIGNA " , IL BOLLETTINO DELLA SEZIONE PROVINCIALE DI TERAMO DEL WWF 11/12/2004 IL WWF RICERCA COLLABORATORE CON MANSIONI DI SUPPORTO TECNICO  ORGANIZZATIVO PRESSO LA SEZIONE REGIONALE ABRUZZO 13/11/2004 CAMPO INVERNALE WWF PER L' ORSO BRUNO 3 - 8 dicembre 2004 - Villavallelonga ( AQ ) 23/10/2004 LE 15 PROPOSTE DEL WWF PER UN BILANCIO REGIONALE SOSTENIBILE 30/09/2004 Dalla parte dell' [SEP] Orso [SEP] : il programma " 17/09/2004 " Vogliamo esprimere il nostro più profondo dissenso e sconcerto rispetto ad un progetto che non si può non definire come devastante per una delle più importanti montagne dell' intero Appennino ...
itwac	Il numero di segnalazioni è decisamente aumentato rispetto al mese precedente ed ha interessato gran parte del territorio costantemente frequentato dall' [SEP] orso [SEP] ( Gruppo di Brenta ) e , marginalmente le aree del Lomaso-Bleggio e della Valle di Ledro .
itwac	io il suo vocione da [SEP] orso [SEP] @ @ MADAME @ @ a tutte le ore : mi sopporta da secoli senza lanciarmi i portacenere .
itwac	un critico di cosa ?? ma perfavore !! la sua recensione e' davvero fasulla e alla fine si permette anche di consigliarci " arrivano gli [SEP] orsi [SEP] " ...
itwac	Vi auguro sole e scoiattoli E vi ringrazio perché avete voluto assomigliarmi Fred stanotte è venuto a tenermi compagnia Mi leggeva Melville e le sue poesie di guerra Poesia e diarrea mi accompagnano spesso la notte E ho imparato che nessuna può niente contro l' altra Se la poesia mi incanta , la diarrea grida : basta E chiede giustamente un attimo di attenzione Ma all' uscita del bagno la poesia aspetta E dice : ora ascolta anche la tua anima Ho letto un fascicolo di Wildlife sugli orsi Di come è dura la loro vita , al polo Bianchi e terribili ma anche loro si ammalano E muoiono e spesso non hanno da mangiare E mi sono sentito come un vecchio orso Sperduto nel polo di questi bianchi corridoi E se un giorno arriverò a vedere il disgelo Mi metterò in cammino verso nord Andrò a pescare col mio amico Fred l' orso bruno Da due mesi sto in ospedale , non so se ne uscirò Ma forse quando uscirò non ci sarà più la neve Saluterò gli alberi e dirò : tenete duro ragazzi Anch' io tengo duro e Fred , e gli orsi Lontano da qui , dove non arriva la metropolitana E il vento gelido urla e non c' è riparo Un po' come andar contro ai dati delle analisi Ma l' [SEP] orso [SEP] si alza scrolla la neve e riparte Verso qualche miraggio o tana o nuova avventura Perché vedete , se la vita diventa più corta C' entra più vita dentro , ed è come se un ramo Si riempisse di linfa , o un torrente si gonfiasse d' acqua Non puoi dirgli che l' inverno incombe o il mare è vicino Scorrerà forte , in un incredibile infanzia Così siamo per metà decrepiti e per metà bambini E un po' poesia e un po' diarrea Un po' vecchi alberi , e orsi , e numeri in una corsia In un punto del Polo nord chiamato Montreal E a te , proprio a te che affretti il passo Davanti alla bianca scogliera dell' ospedale Quasi temessi l' onda o il vento della malattia Vorrei dirti : fermati , non aver paura Bevi un caffè alla mia salute , compra un rivista di orsi E non preoccuparti della piccole vendette e dei privilegi Un giorno sarai davanti al bianco della tua anima Davanti al ghiaccio e alla solitudine Sii pronto a ridere , almeno una volta GUALTIERO BERTELLI - Vustu Metter Vustu metter i fiori co ' i nasce in avril i xe bei , i xe grandi e i colori xe tanti i te siga in tel muso de ' ndar , de scoprir de cavarse de dosso i pensieri più strani .
itwac	In fondo il pozzolano e tonino sono un punto di riferimento per le zone di Ischa , procida , pozzuoli ; io ho la barca ad Amalfi e pesco da capo d' [SEP] orso [SEP] a Massalubrense , zone pressocchè sconosciute ai Pozzolani ed anche a molti " napoletani " , ma ben note a Giacomo , che spesso pesca la' con altri " mostri sacri " sorrentini .
itwac	Rimanendo comunque in territorio partenopeo , necessitava di una panoramica anche di un contributo made in Italy , focalizzando il lavoro di 24 giovani artisti , una generazione nata dopo il 1960 , dedita alla colta e apparentemente obsoleta pittura , disciplina oramai in via di estinzione come l' [SEP] orso [SEP] marsicano .
itwac	Riqualificazione / aggiornamento del personale si 49.520.000 276 SACCI spa Sicurezza nell' ambiente di lavoro si 42.645.600 279 OCEM srl OFFICINA COSTRUZIONI ELETTROMECCANICHE Qualificazione addetti commerciali / tecnici e sicurezza ( Dec.Leg. 626/94 ) si 12.453.600 285 TNT AUTOMOTIVI LOGISTICS spa UNITA' LOGISTICA DI PISA Processi di innovazione tecnologico-gestionale applicati alla logistica integrata si 24.080.000 289 ASSO SERVIZI srl La qualità , ambiente e sicurezza come processo di competitività nelle aziende edili e cave si 200.000.000 290 ASSO SERVIZI srl La qualità , ambiente e sicurezza come processo di competitività nelle aziende edili e cave si 200.000.000 291 ASSO SERVIZI srl La qualità , ambiente e sicurezza come processo di competitività nelle aziende edili e cave si 200.000.000 292 ASSO SERVIZI srl La qualità , ambiente e sicurezza come processo di competitività nelle aziende edili e cave si 200.000.000 293 ASSO SERVIZI srl La qualità , la sicurezza e l' ambiente nel processo lavorativo aziendale si 150.310.000 295 ASSO SERVIZI Siena Qualificazione del personale poligrafico si 30.400.000 299 CIARDELLA srl Innovazione tecnologica nel processo produttivo si 38.460.000 300 COOPERATIVA SOCIALE LA LUCE arl Corso per addetto all' assistenza di base si 48.900.000 301 PASTIFICIO MENNUCCI spa Sicurezza sui luoghi di lavoro si 15.440.000 302 CISPEL TOSCANA FORMAZIONE scrl La formazione , risorsa strategica per lo sviluppo del servizio pubblico si 29.215.000 303 CISPEL TOSCANA FORMAZIONE scrl La formazione , risorsa strategica per lo sviluppo del servizio pubblico si 49.994.000 304 DAVINI PREFABBRICATI srl Strumenti per l' organizzazione della qualità si 43.700.000 305 ELETTROMAR srl Strumenti per l' organizzazione della qualità si 49.100.000 306 SISTEM srl Strumenti per l' organizzazione della qualità si 47.000.000 307 GIFAS ELECTRIC srl Strumenti per l' organizzazione della qualità si 22.000.000 308 MOLINO PARDINI Strumenti per l' organizzazione della qualità si 22.000.000 310 COOPERATIVA SOCIALE IINSIEME Corso per operatore addetto all' assistenza di base alla persona si 49.200.000 311 ME.RO srl Sicurezza sui luoghi di lavoro si 4.410.000 317 CONFESERCENTI Aggiornamento e qualificazione del personale dipendente del sistema Confesercenti di Firenze si 125.714.000 318 IMPRESA EDILE ILIO [SEP] ORSI [SEP] & C. sas Applicazione del sistema qualità secondo la norma UNI and ISO 9200 e addestramento specifico degli addetti nel settore edilizio si 17.240.000 319 ING.L.MACCIO sas di M .
itwac	AA.VV. ( a cura di Angelo d' Orsi ) - Cenni Biografici AA.VV. ( a cura di Angelo d' [SEP] Orsi [SEP] ) Gli storici si raccontano Tre generazioni tra revisioni e revisionismi 2005 pp. 392 30,00 E Indice Brano Autore Acquista Ciò che accomuna i contributi raccolti in questo volume è la convinzione che la revisione sia strumento essenziale del lavoro dello storico .
itwac	E neppure quell' [SEP] orso [SEP] gentile di Stefano Rocco .
itwac	Ecco , soprattutto la gente che è molto ospitale e socievole ( a meno che non siate degli [SEP] orsi [SEP] , qui è facilissimo farsi un sacco di amici ) .
itwac	il muso da pantera , lupo , [SEP] orso [SEP] ...
itwac	Ma il sangue rimase tra le mura della fortezza : Eleonora Atti , il 14 ottobre 1575 , fu uccisa a pugnalate dal marito [SEP] Orso [SEP] II Orsini .
itwac	L' [SEP] orso [SEP] era onorato come un fratello della foresta , un guaritore , e cacciato unicamente per il calore che forniva la sua pelliccia contro i rigori dei lunghi inverni del nord .
itwac	L' anno delle montagne Friday , August 30 , 2002 Statistica della caccia 2001 : migliorata la gestione degli ungulati Monday , August 26 , 2002 L' [SEP] Orso [SEP] delle caverne del Monte Generoso Aperta al pubblico la Grotta dai ricchi ritrovamenti La Grotta " dell' Orso " Wednesday , July 03 , 2002 Il gipeto torna a popolare le Alpi Sunday , June 30 , 2002 Fidasc , federazione del Coni a cura di Athos Fasani Sunday , June 30 , 2002 Game Fair - XII ° Edizione Collesalvetti ( I-LI ) , Tenuta Bellavista Insuese da giovedì , 20 a domenica , 23 giugno 2002 Saturday , June 15 , 2002 Presentazione libro di Veljko Varicak a cura di Athos Fasani Thursday , May 16 , 2002 Museo svizzero della fauna selvatica e della caccia ( Castello di Landshut ) Monday , May 06 , 2002 EXA 2002 MOSTRA INTERNAZIONALE ARMI SPORTIVE ED ACCESSORI Tuesday , April 09 , 2002 Habitat migliori per le lepri comuni Le lepri stanno un po' meglio Wednesday , March 27 , 2002 Lo svernamento degli uccelli acquatici : nuova indagine dell' OMPO Sunday , March 24 , 2002 Dal Notiziario AIW - supplemento ordinario a Wilderness documenti Sunday , March 24 , 2002 Procedura di consultazione relativa al Progetto Lupo Svizzera Ampio consenso , molte proposte di modifica Wednesday , March 13 , 2002 Convegno  Il lupo in Piemonte " Tuesday , February 12 , 2002 PESCA CACCIA TIRO 5 .
itwac	glauco ha scritto ( 20 luglio 2005 , ore 14:14 ) caro napo [SEP] orso [SEP] capo , ridicolo e stupido è il fatto che ci sia gente come te che non capisce nulla di politica internazionale .
itwac	[SEP] Orsi [SEP] " ) , pp. 322 - 323 .
itwac	L' ' ' inseguimento ' ' e' proseguito a lungo , con l' [SEP] orso [SEP] quasi infastidito da questa violazione della sua privacy : ' ' Non ha mai mostrato segni di aggressivita' - prosegue Zambanini - Ogni tanto si fermava , guardava nella nostra direzione e poi andava avanti mantenendosi a distanza di sicurezza , fino a superare la cresta del monte e scomparire verso la Val Gelada ' ' .
itwac	Dà il titolo al cartone una landa desolata tra i ghiacci dove scorrazzano i protagonisti della storia : Pack , un [SEP] orso [SEP] polare goffo e insicuro , e Flake una piccola foca sempre attenta a non farsi acciuffare dall' orso che è alla continua ricerca di cibo .
itwac	Nel Parco nazionale d' Abruzzo per la tutela dell' orso marsicano Decine di volontari sono in azione nel Parco nazionale d' Abruzzo , Lazio e Molise nell' ambito del " Progetto [SEP] orso [SEP] " del WWF , impegnati nel recupero dei frutteti abbandonati e nella sensibilizzazione di residenti e turisti " Foto in alto : orso bruno marsicano ( Panda Photo ) Una vera e propria campagna di sostegno alimentare è stata lanciata dal WWF per fornire adeguate fonti di cibo agli orsi che si preparano a tornare in attività dopo il letargo invernale .
itwac	In questa conflittualità generica , il fatto originale è che è una conflittualità senza nemico , nel senso che noi non possiamo prevedere nel futuro quali saranno i nostri nemici : non abbiamo più un nemico preciso , chiaro , con una identità precisa , con stivaloni , baffoni , colbacco , l' [SEP] orso [SEP] .
itwac	La regia è infatti di Gabriele Salvatores , chiamato ad ambientare nel Rinascimento una nuova puntata della saga storica , che ha per protagonista Baffo Moretti , fin dal dopoguerra icona del marchio , da tempo interpretato da [SEP] Orso [SEP] Maria Guerrini dopo la scomparsa di Marcello Tusco .
itwac	Sociali " Fuori Margine " Domenicucci Massimo - Presidente ANMIC di Pesaro [SEP] Orsi [SEP] Giorgio - Componente Comitato nazionale ANMIL Giampaoli Giuliano - OO.SS. " CGIL CISL  UIL " 3 ) TERZA INIZIATIVA : Incontri fra imprenditori e persone disabili in formazione Primo incontro : DATA : giovedì 4 marzo 1999 LUOGO : Orienta formazione ed orientamento s.a.s. c / o Pesaro sede di Via Mameli , 44 ORARIO : 15.00 - 19.00 PROJECT WORK con Imprenditori e persone disabili nell' ambito del Progetto " Horizon " , corso di formazione per disabili fisici per la qualifica di " videoterminalista " .
itwac	4 ) IN ABRUZZO E' ALLARME [SEP] ORSI [SEP] ( Dire ) - Roma - Una pattuglia del corpo forestale ha rinvenuto , nella mattinata del 2 novembre , la carcassa di un orso marsicano nel parco nazionale d' Abruzzo .
itwac	Essa ha un ruolo strategicamente rilevante nel consentire gli spostamenti e la dispersione della popolazione di [SEP] orsi [SEP] ( figura 1 ) .
itwac	" Da quando il ghiaccio del mare si sta riducendo nell' Artico , le condizioni per la sopravvivenza dell' [SEP] orso [SEP] bianco sono minacciate .
itwac	" Gli studi condotti sugli [SEP] orsi [SEP] polari negli ultimi anni - spiega Andrew Derocher , che da tempo si occupa dell' argomento - rivelano che questi animali sono influenzati negativamente dall' inquinamento chimico .
itwac	Tra le specie più a rischio [SEP] orsi [SEP] polari e pinguini , salmoni e trichechi , foche e tigri , e poi ambienti già oggi fortemente minacciati come le barriere coralline .
itwac	Credi che davvero finiremo come gli [SEP] orsi [SEP] polari ?
itwac	Proseguire in direzione sud sul ghiacciaio su percorso pianeggiante in direzione del Colle degli [SEP] Orsi [SEP] .
itwac	Sul ritmo del bongo , l' [SEP] orso [SEP] canterino canterà la più bella delle canzoni , portandosi nel cuore la voce di tutto il coro .
itwac	Primo Amore di Matteo Garrone , unico italiano in concorso al Festival , ha conquistato l' [SEP] Orso [SEP] d' argento per la migliore musica , firmata dalla Banda Osiris .
itwac	Un convegno atteso da anni e un fantasma mai nominato che aleggiava in sala ( anche se il suo nome , Franco Tassi , è comparso per un attimo accanto a un grafico proiettato a parete con l' incremento degli [SEP] orsi [SEP] stimato " dal parco " fino all' altro ieri , 200 animali nel 2000 ) .
itwac	In un paio di occasioni lo avrei meritato ma non faccio film per la statuetta ' ' Berlino , parata di stelle : da Keanu Reeves a Susan Sarandon Accorsi : ' Quasi pronto ad essere papà ' Accorsi e Cervi , sposi-contro a Berlino Berlino , ' Goldene Camera ' a Jerry Lewis Berlino , Orso d' Oro alla carriera allo spagnolo Fernando Gomez ' Provincia meccanica ' con Cervi e Accorsi unico italiano a Berlino Berlino , Giorgio Pasotti è la ' Shooting star ' italiana Oscar , Scorsese e Di Caprio a cena con i 3 candidati italiani Berlino , [SEP] orso [SEP] d' oro alla Carmen nera Oscar , anche gli stuntmen vogliono una statuetta George Michael , un porno-musical e un tuffo nel blu Festival di Berlino , Roland Emmerich presidente di giuria : ecco i primi titoli Link : Il sito del festival di Berlino
itwac	è per questo che sono venuto alla ricerca di quest' uomo - disse il messaggero rivolgendosi all' [SEP] orso [SEP] - mi dispiace di avervi mentito Kain ma ...
itwac	La Repubblica 24.3.2001 CRONACA - USA Addio signor Ranger signore Morto a 90 anni William Hanna , creatore con Joseph Barbera di Tom e Jerry , gli Antenati , l' [SEP] Orso [SEP] Yoghi e Braccobaldo .
itwac	In un paio di occasioni lo avrei meritato ma non faccio film per la statuetta ' ' Berlino , parata di stelle : da Keanu Reeves a Susan Sarandon Accorsi : ' Quasi pronto ad essere papà ' Accorsi e Cervi , sposi-contro a Berlino Berlino , ' Goldene Camera ' a Jerry Lewis Berlino , [SEP] Orso [SEP] d' Oro alla carriera allo spagnolo Fernando Gomez ' Provincia meccanica ' con Cervi e Accorsi unico italiano a Berlino Berlino , Giorgio Pasotti è la ' Shooting star ' italiana Oscar , Scorsese e Di Caprio a cena con i 3 candidati italiani Berlino , orso d' oro alla Carmen nera Oscar , anche gli stuntmen vogliono una statuetta George Michael , un porno-musical e un tuffo nel blu Festival di Berlino , Roland Emmerich presidente di giuria : ecco i primi titoli Link : Il sito del festival di Berlino
itwac	Vai da un [SEP] orso [SEP] e gli rifili un calcio nei testicoli .
itwac	L' [SEP] orso [SEP] , arma dei Cazzanemici grandi , detti appunto dell' orso .
itwac	[SEP] Orsi [SEP] , 1912 - 1934 ) .
itwac	Quando tornò in s  disse : - Con ciò non mi hai ancora conquistata ; devi fare un' altra cosa : giù nella stalla c' è un [SEP] orso [SEP] e tu devi trascorrere la notte con lui .
itwac	All' improvviso , scorse l' [SEP] Orso [SEP] Arancione .
itwac	di volpi , tassi , cervi , cerbiatti , [SEP] orsi [SEP] , interessino animali vivi o mere ricostruzioni , peraltro molto realistiche , fatte al computer .
itwac	La 55 esima edizione del Festival Internazionale del Cinema di Berlino apre i battenti il 10 febbraio nella sede del Postdamer Paltz , e decreta i suoi vincitori il 20 febbraio assegando ai vincitori l' ambito [SEP] Orso [SEP] ( d' oro e d' argento ) .
itwac	L' Informagiovani , negli ex locali dei Vigili urbani , proporrà musica dal vivo , ballo latino-americano , laboratorio dj , giocoleria , aperitivi informativi e tanto altro a cura del Comune di Carmagnola e della cooperativa [SEP] Orso [SEP] .
itwac	iViaggi di Repubblica Sulle piste degli [SEP] orsi [SEP] È il centro più importante del Parco Nazionale d' Abruzzo , Lazio e Molise .
itwac	Come le altre specie di volpe , le volpi artiche non vanno in letargo , ma rimangono attive anche d' inverno , nutrendosi di carogne di cetacei , avanzi di prede uccise dagli [SEP] orsi [SEP] polari e forse anche di giovani foche .
itwac	00 Feral Claws - Artigli Ferali ( tradotto erroneamente con Artigli della Bestia ) Questo potere ti permette di avere artigli potenti come quelli di un lupo o di un [SEP] orso [SEP] , capaci di lacerare la carne .
itwac	e se [SEP] orso [SEP] vuole ci si può vedere appena prima all' autogrill subito dopo Stradella , io entro lì ...
itwac	Due anni dopo aver acquistato la Maserati fu così che Adolfo [SEP] Orsi [SEP] la trasferì a Modena , nello stabilimento di viale Ciro Menotti dove si trova tuttora , inserita però adesso nel gruppo Fiat insieme alla Ferrari , della quale fu invece acerrima rivale .
itwac	L' [SEP] orso [SEP] bianco rischia nuovamente l' estinzione .
itwac	mi trovai a riflettere sul fatto che poi non c' era motivo di stupirsi se una voce dentro di me ( che doveva necessariamente essere , pensai , la voce del mio immaginario compagno di giochi ) parlava di orsi ; perché la mia vita , come quella di tutti , era stata intessuta da una serie interminabile di [SEP] orsi [SEP] di peluche ; se socchiudevo gli occhi mi tornava alla memoria , come in un vecchissimo video dei Visage che avevo visto da ragazzo , una specie di armata di orsi di peluche che si muovevano , spalla contro spalla ...
itwac	Ermete Realacci ha subito precisato : « [SEP] Orsi [SEP] ha posto la questione del perimetro : quando parlavamo di confini entro sei mesi non si intendeva un vincolo stringente , l' importante è avviare un percorso di dialogo , ora anche altri comuni come Chiavari pare vogliano entrare nel parco , visto che hanno firmato il documento dei comuni presentato dalla Regione Liguria e penso che questa proposta potrebbe diventare legge entro fine legislatura » .
itwac	[SEP] Orso [SEP] , S .
itwac	Se i periti riusciranno ad estrarlo , entro la fine del mese sarà terminata la lunga caccia all' uomo che negli ultimi tre anni ha avvelenato tre [SEP] orsi [SEP] marsicani e dieci lupi nel versante ciociaro del parco nazionale d' Abruzzo .
itwac	Doveva proprio essere l' [SEP] orso [SEP] !
itwac	PASTORE UNGHERESEQuesto è una cane da addestrare con pazienza e calma : in migliaia di anni ha dovuto vedersela con [SEP] orsi [SEP] e lupi .
