corpus	sentence
itwac	Va anche lei dall' orso e gli chiede : " [SEP] Orso [SEP] , e' vero che hai fatto una lista degli animali che intendi mangiare nei prossimi mesi ?
itwac	È chiaro che alcuni [SEP] orsi [SEP] giovani non hanno paura dell ´ uomo e questo è un problema .
itwac	La copertina del dvd in edicola , [SEP] Orso [SEP] d' oro a Berlino nel 2000 .
itwac	Più in particolare , sono state rilevare le seguenti informazioni : - consapevolezza della presenza attuale in Trentino dell' orso e di altri animali ; - giudizi sulla numerosità di alcuni animali - livello d' informazione sulle abitudini dell' [SEP] orso [SEP] ( cosa mangia ?
itwac	[SEP] ORSO [SEP] era stato assassinato nel 737 e per cinque anni , fino al 741 , aveva governato un maestro dei militi che risiedeva ad Eraclea e durava in carica un anno .
itwac	Sul fianco sinistro del Duomo sorge il Battistero degli Ortodossi , terminato sotto il Vescovo Neone ma fondato probabilmente nel V secolo , ai tempi del Vescovo [SEP] orso [SEP] .
itwac	Servizi per i visitatori : Itinerari : Cartografia : carta turistica del Parco Nazionale d' Abruzzo Lazio e Molise ( scala 1 : 50.000 ) Itinerario 1 : Imposto Chiarano  Lago Pantaniello Dislivello : 400 m Difficoltà : E ( escursionistico ) Tempo di percorrenza : 5 - 6 ore Itinerario 2 : Diga di Barrea  La Capriola  Valle Ianara  Pantaniello Dislivello : 900 Difficoltà : E ( escursionistico ) Tempo di percorrenza : 6 - 7 ore Area di sosta : In località Montagna Spaccata si trova un' ampia area picnic attrezzata Ricerca scientifica : analisi delle relazioni tra la struttura forestale e la produzione trofica per l' orso bruno ; analisi delle relazioni tra l' avifauna e le tipologie ambientali ; analisi Habitat Suitability Index per l' orso bruno ; analisi alimentazione orso bruno ; analisi DNA Fingerprinting [SEP] orso [SEP] bruno ; analisi densità ungulati e struttura forestale ; analisi Habitat Relationship Model orso bruno , cervo , cinghiale e capriolo ; monitoraggio fauna particolarmente protetta e di interesse naturalistico .
itwac	E' grande come un [SEP] orso [SEP] e luccica come cuoio umido ...
itwac	Prelievi idrici I Consiglieri Matteo Marcenaro , Giovanni Macchiavello ( Per la Liguria ) e Gino Garibaldi e Franco [SEP] Orsi [SEP] ( F.I. ) hanno presentato un' intepellanza avente per oggetto l' esenzione del pagamento dei canoni nei casi di prelievi idrici non superiori a 0,7 litri / secondo per usi domestici da parte di utenza non servita da pubblici acquedotti e per uso irriguo .
itwac	" Aosta , chiostro della Collegiata di S. [SEP] Orso [SEP] .
itwac	Tanto tempo fa , quando ancora nel mondo non c  erano gli uomini , c  erano tanti animali : lupi più grandi di quelli che conosciamo oggi e più spietati ; [SEP] orsi [SEP] temuti da tutti gli altri animali per la loro forza e tanti altri .
itwac	In mostra solo l' [SEP] orso [SEP] bianco dello zoo di Central Park , regolarmente aperto .
itwac	Il fruscio delle foglie ed un rumore strano che sembra lo sbuffo di un [SEP] orso [SEP] lo riporta alla realtà e gli fa imbracciare il fucile automaticamente .
itwac	E dormono due o tre [SEP] orsi [SEP] bruni , nessuno che ne sappia la famiglia con esattezza .
itwac	LUNGHE GIORNATE - Picchio MATURAZIONE - Salmone RACCOLTO - [SEP] Orso [SEP] bruno ...
itwac	" " Anche io parlo solo due volte all' ora " , conferma Sabrina D' [SEP] Orsi [SEP] , la piu' giovane del gruppo ( e l' ultima arrivata in Rai : Il Cammello e' il suo primo programma da conduttrice , prima si occupava della grafica del sito Internet di Hit Parade ) , che conduce lo spazio pomeridiano insieme a Cervelli e Gentile , oltre ai miniservizi sulle nuove tecnologie .
itwac	Così ieri sera ha deciso il tribunale di Milano al termine di una lunga camera di consiglio per Mattia Morbi , il minorenne simpatizzante di estrema destra accusato di aver accoltellato e ucciso Davide Cesare , un militante del centro sociale [SEP] Orso [SEP] , dopo averlo aggredito il 16 marzo scorso insieme al padre e al fratello .
itwac	L' [SEP] Orso [SEP] ci ha liquidati sostenendo che lui aveva da fare due o trecento chilometri sulla cyclette e non aveva tempo da gettare .
itwac	pey at libero.it ) per averci messo a disposizione la relazione tenuta il 10 febbraio 2005 al seminario " Historia magistra " diretto dal professor Angelo D' [SEP] Orsi [SEP] presso il Dipartimento di studi politici dell' Universita' di Torino .
itwac	Si dice che I due [SEP] orsi [SEP] fu scritta in 15 giorni : aveva fretta di incassare dall' impresario , e compose la musica sul pianoforte in giro da vari amici , in quanto il suo era stato ritirato , non avendo pagato il nolo .
itwac	Lui è forte e coraggioso come un [SEP] orso [SEP] e le deboli pecore se le mangerà tutte !
itwac	Avevamo lasciato Aira e Kairi dispersi nella neve in una caverna , con un [SEP] orso [SEP] lì vicino ...
itwac	All' interno dei preparati , corna di saiga , ossa di cervo ( che sono state ritrovate nei magazzini delle ditte coinvolte in grande quantità ) e di rinoceronte , oltre a grasso , sangue , ghiandole e pelli di tigre , leopardo , [SEP] orsi [SEP] e cavallucci marini .
itwac	: faccio collezione di orsi di peluche artigianali e non , e un [SEP] orso [SEP] è il mio compagno abituale di letto ...
itwac	Rózsa doveva aver ben capito la natura infantile dei progetti e il loro target fruitivo d' eccezione , quando nella stesura delle pagine a commento di The Jungle Book si applicò in un' orchestrazione semplice e schematica , attribuendo ad ogni animale in scena un preciso corrispondente sonoro : un contrabbasso per l' [SEP] orso [SEP] Baloo , sassofoni per le iene e altisonanti tromboni per gli elefanti .
itwac	Per patron in cerca di risultati " buoni e subito " , vedere un tecnico del genere a spasso è stato come il miele per gli [SEP] orsi [SEP] , ed ecco che allora il telefono di casa Simoni ha preso a fare gli straordinari .
itwac	Facchetti Il " malore " di Ronaldo Di Biagio trascinatore della Roma Atleti in crisi affetti da " slump " GIROMONDO Otto [SEP] orsi [SEP] parlanti a Berna per tenere la città più pulita A Parigi è tornato in scena il circo delle pulci acrobate Parcheggio gratis a Savona : colpa dei parchimetri francesi Superclick In Francia stanno costruendo a mano un grande castello del 1200 Fax Il gioco degli scultori Salviamo i boschi con l' " Operazione Beniamino " Dalla parte dei ragazzi La scuola è una scatola magica piena di sorprese
itwac	È morta nel primo pomeriggio , a Milano , all' Istituto neurologico « Carlo Besta » , dov' era seguita da mesi dall' équipe del professor [SEP] Orso [SEP] Bugiani .
itwac	Sicurezza e igiene sul lavoro : prevedibilità e prevenibilità di un infortunio da un punto di vista dello psicologo ergonomo Autore : Mario Galliano , Enrico Pastore , Marco Italo D' [SEP] Orso [SEP] .
itwac	4 luglio 2005 - Ogni anno tra dieci e 60 uccelli e da 30 a 100 chirotteri muoiono tra le pale di ciascuno degli aerogeneratori che producono energia nelle centrali eoliche : un numero che - secondo il Wwf - potrebbe moltiplicarsi in Abruzzo , dove e' in discussione la realizzazione di 230 nuovi aerogeneratori , molti dei quali in aree di pregio paesaggistico , rifugio essenziale per uccelli e mammiferi come l' [SEP] orso [SEP] .
itwac	Fra le sue pubblicazioni più recenti ricordiamo The English Language and Power ( a cura di ) Edizioni dell ¹ [SEP] Orso [SEP] , Alessandria 2002 .
itwac	Nel dicembre precedente era stato lo stesso direttore del parco , Fulvio Pratesi , a lanciare l' allarme : negli ultimi due anni sono stati trovati morti 26 animali , tra lupi e [SEP] orsi [SEP] .
itwac	Il mio telefilm preferito comunque rimane " Un medico tra gli [SEP] orsi [SEP] " , un autentico capolavoro .
itwac	] uscire di qualsiasi cosa o entrare in qualsiasi cosa , anche se essa compatta e persino fusa con fuoco , cioè saldata ( 47 ) Constatato che la figura del Conte Dracula sembra essere modellata su quella del supremo dio nordico Odino - signore dei berserkir - passiamo ad inquadrare meglio la figura del guerriero-belva con le parole di Jan De Vries , tradotte e citate da Gianna Chiesa Isnardi : " Questi portatori di pelli d' [SEP] orso [SEP] formano un gruppo scelto di guerrieri alla corte del re ; si distinguono per una grande insensibilità alle armi e al fuoco .
itwac	14 agosto 36 ° Foire d' été , ad Aosta La Foire d' été , edizione estiva della millenaria Fiera di Sant' [SEP] Orso [SEP] e promossa dall' Assessorato delle Attività produttive e Politiche del Lavoro , ha avuto il consueto successo di pubblico , con momenti di folklore e di gastronomia locale .
itwac	Ciò non ha impedito la realizzazione di ben 4 prestazioni over 200 km tra gli uomini , anzi potremmo dire 5 visto che il quinto classificato , il ligure Massimo Petruzzelli , ha percorso 199,671 km Grande e meritata vittoria per il toscano Sergio [SEP] Orsi [SEP] , che ha consolidato la sua posizione di numero 1 della specialità in Italia , ottenendo un probante conforto metrico ( 241,378 km ) , che rapportato alle difficoltà meteorologiche di cui abbiamo parlato , la dice lunga sulle sue possibilità e potenzialità .
itwac	Nella famiglia Togliatti è entrata , da pochi mesi , una bambina : Marisa Malagoli , undicesima figlia di una famiglia di contadini , sorella di un operaio comunista delle Fonderie [SEP] Orsi [SEP] , ucciso dalla polizia che nel gennaio di quell' anno aveva aperto il fuoco contro i lavoratori in sciopero , a Modena .
itwac	Koda , fratello [SEP] orso [SEP] , storia di un ragazzino trasformato in bestia dagli spiriti degli antenati , è un film pieno zeppo di magia e fantasmi ; molto più enigmatico di quanto sembri , quest' ultima fatica Disney mette in gioco la fede e la speranza , la solidarietà e l' alterità .
itwac	Quando D' [SEP] Orsi [SEP] , documenti alla mano , affaccia l' ipotesi di un' acquiescenza della cultura antifascista torinese al regime , viene a rompere una codificata visione di un antifascismo torinese senza alcuna compromissione , neanche quella assolutamente necessaria per esercitare una funzione intellettuale in un regime dittatoriale .
itwac	Ma prima che il cassiere delle poste di via Ferrari [SEP] Orsi [SEP] potesse rispondergli , al bandito per l' emozione e' caduta la pistola dalle mani .
itwac	Sono molta contenta di sapere che non è l' [SEP] orso [SEP] che sembra .
itwac	Di [SEP] orsi [SEP] marsicani ce ne dovrebbero essere tra i 50 e gli 80 esemplari , con una forbice di numeri alta dal momento che non è mai stato fatto un censimento serio sullo stato di questa sottospecie più piccola di quella europea .
itwac	Uso consentito citando la fonte : LAV  Settore Circo 7 La LAV sostiene che se questi parametri fossero veramente rispettati , molti animali ( tra cui elefanti , felini , [SEP] orsi [SEP] , scimmie e parecchi rettili ) non potrebbe più essere detenuti dai circhi .
itwac	Appena vede l' orso greezly spara una sciabordata che incenerisce l' [SEP] orso [SEP] all' istante .
itwac	Indovinello di Marco Tocci IL CONDOMINO SCORBUTICO Da solo , abita al quarto , quel grand' [SEP] orso [SEP] Ha  l potere di zittir ogni discorso Al posto mostra , trionfio , il Citizen In inglese , sai dirmi what 's his name ?
itwac	La tecnica olandese potra' magari migliorare quella con cui i Cinesi drenano la bile degli [SEP] orsi [SEP] , per cui dai culi dei polli miliardi di tubicini porteranno milioni di barili di petrolio nei grandi depositi Shell .
itwac	Ho pure un [SEP] orso [SEP] che mi hanno regalato fatto con centinaia di conchiglie e uno fatto con ramoscelli .
itwac	In Abruzzo c' è Bisegna che vuole uscire dallo storico parco dell' [SEP] orso [SEP] e del lupo .
itwac	" State già perlustrando le agenzie di viaggio e non vi perdete una programma di Licia Colò , indecisi se arrostirvi al sole o andare a rubare i pesci agli [SEP] orsi [SEP] bianchi ?
itwac	Ho visto una tana , ma ospitava un piccolo [SEP] orso [SEP] e l' ho lasciato perdere .
itwac	dell' [SEP] Orso [SEP] Torino 1999 , pp. 27 - 64 .
itwac	L * autore di The hole , torna in concorso a Berlino , che gli regalò l * [SEP] Orso [SEP] d * Argento per The river , e la scandalizza La ballata hippie di Daniel Day Lewis | apri il link in una nuova finestra | " Racconto l * utopia hippie ma credo che un altro mondo sia possibile davvero " .
itwac	ORSO - L' oriente gli ha fatto scoppiare il cervello CROTALO - Il posto migliore è lo sterco in cui si razzola [SEP] ORSO [SEP] - La radura si riempie di fumo CAIMANO - Stiamo vicini CROTALO - Non è fumo .
itwac	I Mattei avrebbero richiesto per loro una replica a Caravaggio aiutato probabilmente da Prospero [SEP] Orsi [SEP] per il quale è documentato un pagamento proprio per un quadro di San Tommaso .
itwac	( recensione pubblicata per l' edizione del 1985 ) recensione di [SEP] Orsi [SEP] , M.T. , L' Indice 1986 , n. 8 Dopo essere stato tradotto in inglese , francese e tedesco ( oltre che in cinese e coreano ) , è comparso nelle librerie italiane " Musashi " ( titolo originale : " Miyamoto Musashi " ) , uno dei più famosi romanzi giapponesi moderni .
itwac	( ANSA ) ANIMALI : CIPRA , SLOVENIA VUOLE ABBATTERE 120 [SEP] ORSI [SEP] BRUNI ( NOTIZIARIO AMBIENTE ) ( ANSA ) - ROMA , 10 MAR - La Slovenia ha annunciato di voler aumentare la quota di abbattimento di orsi bruni a 120 capi .
itwac	Vincitore dell' [SEP] Orso [SEP] d' Oro al Festival di Berlino nel 1999 , nonostante fosse candidato a sette premi Oscar , e fosse superiore al film Salvate il Soldato Ryan , non è riuscito a vincerne neanche uno , preferendo premiare il film di Steven Spielberg .
itwac	Un altro giovanissimo interprete conquista il suo primo [SEP] Orso [SEP] , è lo statunitense Lou Taylor Pucci .
itwac	Molti degli ingredienti che agli occidentali sembrano assurdi ( carne di cane e di serpente , organi interni di [SEP] orso [SEP] ) di solito hanno funzioni terapeutiche e sono costosi , quindi non vengono serviti nelle normali situazioni quotidiane .
itwac	[SEP] ORSO [SEP] IN PIEDI , LAKOTA ( SIOUX ) La primavera è tornata , il sole ha abbracciato la terra .
itwac	La finalità del progetto , rifinanziato anche per la seconda fase dallâ  TMUnione Europea nel 2001 , è stata quella di reintrodurre artificialmente alcuni esemplari di [SEP] orso [SEP] bruno ( Ursus arctos ) per contrastare la contrazione numerica della popolazione originaria , ridotta allâ  TMinizio degli anni Novanta a non più di 2 - 3 esemplari in età avanzata e ormai privi di capacità riproduttiva .
itwac	Un confronto fra gli [SEP] orsi [SEP] polari delle isole Svalbard in Norvegia e quelli presenti in aree meno inquinate del Canada ha rilevato alte concentrazioni di PCB negli orsi maschi adulti ( 55 ) .
itwac	Lucido ed estremo , premiato a Berlino con l' [SEP] Orso [SEP] d' Oro , tratto da un racconto di Kureishi , è pieno di ' cinema del disastro' d' amore il nuovo film di Patrice Chéreau ( ...
itwac	Le prossime prove di sequenzializzazione del DNA saranno fatte sull' uomo di Neandertal che è vissuto nello stesso periodo degli [SEP] orsi [SEP] di caverna .
itwac	Studiando esemplari di orsi polari del Canada e delle isole Svalbard , in Norvegia , gli scienziati hanno fatto anche scoperto che piu' alto e' il livello di queste sostanze nel sangue degli [SEP] orsi [SEP] tanto , piu' sono bassi i livelli di anticorpi nel loro sangue .
itwac	Auto dichiaratosi fin dal primo giorno operativo , lo dimostrava quando durante la CAGSM si lanciava a peso morto dal muro di quattro metri atterrando a pelle d' [SEP] orso [SEP] e alzandosi barcollante e sanguinante rassicurava l' intero plotone con un eroico " ...
itwac	Ecco laggiù appunto una nave che forse viene dall' Isola degli [SEP] Orsi [SEP] .
itwac	Non essendo praticata la caccia a tali animali , i Carpazi si trovano attualmente a ospitare ben il 60 % degli [SEP] orsi [SEP] di tutta l' Europa .
itwac	LIDIA RAVERA A proposito del libro " Legami famigliari " curato dalla Ravera è istruttivo leggere la recensione del critico letterario Marino Sinibaldi , oggi direttore della terza rete radiofonica Rai : " Silvia Ballestra la più interessante scrittrice di questi anni ha prodotto con " Gli [SEP] orsi [SEP] " una raccolta di racconti incredibilmente diseguali , in alcuni casi vistosamente approssimativi : quasi l' esito di una generale ripulitura di cassetti personali finiti nelle mani di un grande editore ( Feltrinelli ) .
itwac	Di Tori e [SEP] Orsi [SEP] ce ne sono di due tipi , secolari e ciclici , ed individuarne l' esatta natura consente di sfruttare meglio i trend .
itwac	Magnolia ha vinto l' [SEP] Orso [SEP] d' Oro al Festival di Berlino 2000 e ha visto assegnare un Golden Globe e una nomination agli Oscar a Tom Cruise .
itwac	Michail Nemchovic Tal , cognome lettone , nome e patronimico russi ( nel 1948 , quando Tal ha dodici anni , il Paese è un pezzo dell' [SEP] orso [SEP] sovietico ) .
itwac	Purtroppo , l' eccessivo sfruttamento agricolo , l' inquinamento e l' urbanizzazione mettono a repentaglio le specie animali più fragili , come lo stambecco dei Pirenei , il cervo corso , l' [SEP] orso [SEP] bruno , il lupo e la lontra .
itwac	" [SEP] Orso [SEP] d' argento " per la regia a Berlino 2004 .
itwac	Sant' Apollonio fu vescovo di Brescia Il suo onomastico è il 9 febbraio ----------------------------------------------------------------------- Appio Nome dell' antica Roma Raro Dal latino Appius , usato dai romani come nome gentilizio Utilizzato soprattutto in epoca romana Il suo onomastico è il 22 novembre ----------------------------------------------------------------------- Arduino Nome storico Raro Dal tedesco Harduwin = " amico , compagno valoroso " Nome del re d' Italia , Arduino d' Ivrea , che regnò dal 1002 al 1015 Il suo onomastico è il 15 agosto ----------------------------------------------------------------------- Ares Nome mitologico Raro Dal greco Ares = " Marte " Nome del dio della guerra e dello sterminio Il suo onomastico è il 1 novembre ----------------------------------------------------------------------- Armando Nome medievale Abbastanza diffuso Dal tedesco Hermand = " guerriero " Nome di importanti personaggi storici come il maresciallo Armando Diaz , eroe della Prima Guerra Mondiale Il suo onomastico è il 23 dicembre ----------------------------------------------------------------------- Armido Nome medievale Raro Dal celtico Armis = " battagliero " Più famosa la versione femminile Armida , nome della maga della " Gerusalemme liberata " di Tasso Il suo onomastico è il 1 novembre ----------------------------------------------------------------------- Arnaldo Nome di santo Raro Dal tedesco Arnu = " aquila " e Wald = " comandare " quindi " che comanda come un' aquila " Sant' Arnaldo è il confessore alla corte di Carlo Magno Il suo onomastico è il 17 giugno ----------------------------------------------------------------------- Aroldo Nome storico Raro Dal tedesco Hariwald = " che domina e guida l' esercito " Divenuto famoso per l' opera di Verdi " Aroldo " Il suo onomastico è il 1 novembre ----------------------------------------------------------------------- Aronne Nome biblico Raro Dall' ebraico Aharon , di ignoto significato Nome del fratello di Mosè Il suo onomastico è il 1 luglio ----------------------------------------------------------------------- Arrigo Nome medievale Abbastanza diffuso Una variante del nome Enrico di origine germanica da Haimirich = " potente nella sua patria " Nome che entra in uso nel nord Italia nell' XI secolo come Arrigus Il suo onomastico è il 4 novembre ----------------------------------------------------------------------- Arturo Nome medievale Abbastanza diffuso Dall' etrusco Art = " pietra " Nome del famoso re Artù , fondatore dei cavalieri della Tavola Rotonda Il suo onomastico è il 15 novembre ----------------------------------------------------------------------- Ascanio Nome mitologico Raro Dal greco Askanio , di significato ignoto Figlio dell' eroe troiano Enea e fondatore della famiglia di Giulio Cesare Il suo onomastico è il 1 novembre ----------------------------------------------------------------------- Asdrubale Nome storico Raro Dal fenicio Hasdrubalen = " dato in aiuto dal dio Baal " Reso famoso dal celebre generale cartaginese , fratello di Annibale , che venne ucciso dai romani nel 207 Il suo onomastico è il 1 novembre ----------------------------------------------------------------------- Atanasio Nome di santo Raro Dal greco Athanasios = " immortale " Sant' Atanasio fu patriarca di Alessandria e lottò contro gli eretici ariani Il suo onomastico è il 3 maggio ----------------------------------------------------------------------- Attilio Nome dell' antica Roma Abbastanza diffuso Dal latino Atilius = " nonno , con i piedi storti " L' opera " Attilio Regolo " del poeta Metastasio ha contribuito alla sua Il suo onomastico è il 24 marzo ----------------------------------------------------------------------- Augusto Nome storico Poco diffuso Dal latino Augustus = " venerabile , consacrato dagli auguri " Appellativo del primo imperatore romano Gaio Giulio Cesare Ottaviano.In suo onore è stato chiamato l' ottavo mese dell' anno ( Agosto ) Il suo onomastico è il 7 maggio ----------------------------------------------------------------------- Aurelio Nome di santo Poco diffuso Dal latino Ausel = " splendente " Utilizzato soprattutto in epoca romana Il suo onomastico è il 12 novembre ----------------------------------------------------------------------- Alvise Nome medievale Raro Dal tedesco Hlodwig = " combattente valoroso " Adattamento italiano della forma Louis , ossia Luigi Il suo onomastico è il 1 novembre Torna all' indice ----------------------------------------------------------------------- ----------------------------------------------------------------------- Baldovino Nome medievale Raro Dal tedesco Baltha = " coraggioso " e Wini = " amico " quindi " amico coraggioso " Nome usato nella famiglia regnante del Belgio Il suo onomastico è il 21 agosto ----------------------------------------------------------------------- Bardo Nome di santo Raro Dal latino Bardus = " poeta " San Bardo è ricordato per la sua dedizione verso i poveri Il suo onomastico è il 10 giugno ----------------------------------------------------------------------- Bartolomeo Nome di santo Poco diffuso Dall' aramaico Bar Talmay = " Dio ha dato " San Bartolomeo è protettore dei pellicciai e dei macellai Il suo onomastico è il 24 agosto ----------------------------------------------------------------------- Battista Nome di santo Poco diffuso Dal greco Baptizein = " immergere nell' acqua " San Giovanni Battista è colui che battezzò Cristo nel Giordano Il suo onomastico è il 24 giugno ----------------------------------------------------------------------- Benedetto Nome di santo Diffuso Dal latino Benedictus = " benedetto " San Benedetto da Norcia è il fondatore dell' ordine religioso dei Benedettini e patrono dell' Europa Il suo onomastico è l' 11 luglio ----------------------------------------------------------------------- Beniamino Nome biblico Poco diffuso Dall' ebraico Binyamin = " figlio della fortuna " Nome del figlio prediletto di Giacobbe e Rachele , concepito in tarda età Il suo onomastico è il 31 marzo ----------------------------------------------------------------------- Benito Nome politico Poco diffuso Dal latino Benedictus = " benedetto " Nome del dittatore fascista Mussolini Il suo onomastico è il 23 agosto ----------------------------------------------------------------------- Berardo Nome di santo Poco diffuso Dal tedesco Bare Hart = " forte come un cinghiale " San Berardo fu un frate mandato da San Francesco per evangelizzare i territori del Marocco Il suo onomastico è il 16 gennaio ----------------------------------------------------------------------- Bernardo Nome di santo Poco diffuso Dal tedesco Beor = " [SEP] orso [SEP] " e da Hart = " coraggioso " quindi " coraggioso come un orso " San Bernardo è il fondatore dell' abbazia di Chiaravalle , nei pressi di Milano Il suo onomastico è il 20 agosto ----------------------------------------------------------------------- Biagio Nome di santo Poco diffuso Dal latino Blaesus = " balbuziente " San Biagio è il protettore della gola .
itwac	ORSO MARSICANO IN PERICOLO Un importante progetto per la salvaguardia dell' [SEP] Orso [SEP] bruno marsicano nel quale sono impegnati il Ministero dell' Ambiente , la Regione Abruzzo , i parchi e le riserve abruzzesi , il Corpo Forestale dello Stato , le associazioni ambientaliste , ricercatori ed esperti , vedrà partecipe e protagonista anche la Federparchi .
itwac	Il 30 agosto del 2003 anche Gasper , lâ  TMultimo orso ancora dotato del suo trasmettitore , si è liberato del collare , pertanto , da quasi un anno , il monitoraggio degli animali viene realizzato con tecniche naturalistiche mediante la ricerca e lâ  TManalisi genetica dei diversi indici di presenza lasciati dagli [SEP] orsi [SEP] lungo i loro spostamenti : peli , piste su neve , avvistamenti diretti , campioni fecali , ceppaie scavate e altro ancora .
