corpus	sentence
itwac	Martedì 31 Dicembre 2002 Monselice - Arriva il primo capodanno in piazza con il sindaco Monselice - Riccardo Ghidotti supervisore della San Paolo Domenica 29 Dicembre 2002 Monselice - Arrestata tossicodipendente ricercata Monselice - La Regione ci ripensa : niente soldi per l' elettrodotto Sabato 28 Dicembre 2002 Monselice - Veglione di fine anno in Piazza Mazzini Venerdì 27 Dicembre 2002 Monselice - Miracolo di Natale : un uomo si sente male a messa Monselice - Caso T.E. : il Tar da ragione al comune Giovedì 26 Dicembre 2002 Monselice - Grande commozione per il presepe subacqueo Mercoledì 25 Dicembre 2002 Monselice - Buon Natale dal Campidoglio di Satyriconweb.it Martedì 24 Dicembre 2002 Monselice - Natale a Monselice tra messe e presepi subacquei Monselice - Continua il calvario di Via Orti tra buche e crepe Lunedì 23 Dicembre 2002 Monselice - ' Il Mattino ' è il quotidiano preferito dei monselicensi Sabato 21 Dicembre 2002 Monselice - Oggi sciopero dei giornalisti Venerdì 20 Dicembre 2002 Monselice - Via Piave : gli occupanti rispondono a Fina Monselice - Bertazzo : Conte ci parli dei servizi segreti Giovedì 19 Dicembre 2002 Monselice - Casa delle Associazioni promuove nuove attività Monselice - Passa la mozione di Fina su Via Piave Monselice - Confesercenti allibita dalle dichiarazioni di Scanferla Monselice - Ghidotti querela il No Global Morando Mercoledì 18 Dicembre 2002 Monselice - E' in edicola ' ' L' [SEP] orso [SEP] ' ' di Este con le interviste di Satyriconweb.it Monselice - Spaccio di droga nei bar di Monselice Martedì 17 Dicembre 2002 Monselice - Lettera aperta del Comitato sull' elettrodotto Monselice - Capodanno in Piazza Mazzini Monselice - Scintille in consiglio comunale Venerdì 13 Dicembre 2002 Monselice - L' Ulivo : stasera dibattito aperto al pubblico Monselice - Zona industriale : delinquenti in azione Monselice - Dieci anni al nomade che sparò a Carturan Giovedì 12 Dicembre 2002 Monselice - Ospedale unico , parte una raccolta firme Monselice - Centro per alcolisti all' eremo del Montericco Monselice - Fina sospeso perchè ha parlato con Conte Mercoledì 11 Dicembre 2002 Monselice - Il Mago intrattiene i bimbi in Piazza Mazzini Monselice - Il Comitato Lasciateci respirare in TV alle 18 Martedì 10 Dicembre 2002 Monselice - Elettrodotto : forse si apre uno spiraglio Monselice - Traffico in centro storico : Baraldo applaude , Ds contrari Lunedì 9 Dicembre 2002 Monselice - Tabloid ?
itwac	Ricordi e pensieri di un ex deportato : IT 59022 presentazione di Bruno Vasari prefazione di Eridano Bazzarelli Edizioni dell' [SEP] Orso [SEP] , Alessandria 1992 , pagg. 109 Il libro è una raccolta di poesie di Quinto Osano .
itwac	Nel corso dell' anno 2002 il Centro Ricreativo organizzerà le seguenti gite e manifestazioni : Gite di 1 giorno Fiera di Sant' [SEP] Orso [SEP] ad Aosta in data 31 gennaio 2002 ; Torino Museo del Cinema presso la Mole Antonelliana in abbinamento con la visita di Palazzo Reale ; Milano / Torino / Cologno M.se per la registrazione di programmi televisivi RAI o MEDIASET ; Milano o Torino presso teatri per la partecipazione a spettacoli di musical ; Visita al " Vittoriale " casa-museo di Gabriele D' Annunzio a Gardone Riviera ( BS ) ; Gennaio 2003 Serravalle Scrivia c / o OutLet Mac Arthur Glen ; Gite di più giorni Cure termali ed / od estetiche c / o centri termali italiani nella 2 ^ metà di aprile 5 gg / 4 notti a Parigi con TGV o con pullman in maggio 2 gg / 1 notte in Val Vigezzo  Trenino delle Cento Valli nella 1 ^ quindicina di giugno 4 gg in Spagna in Settembre ( Agenzia ValVerde Bus ) Raduni e Incontri Cena sociale in data 22 marzo 2002 presso Villa Cosmera a Savigliano ; Raduno annuale in data 23 giugno 2002 a Boves Cascina Marquet ; 3 ° Raduno dei Pensionati in data 25/4/2002 o altra domenica di aprile o Maggio ; Corsi di formazione sportiva : Corso di sci di Fondo con inizio in data 12 gennaio 2002 a Festiona ; Corso di sci alpino con inizio in data 19 gennaio 2002 a Lurisia con gara finale e cena c / o HoTel .
itwac	Oggi alle 21.30 al campeggio Capo d' [SEP] Orso [SEP] di terrà il saggio finale .
itwac	Un orso innamorato , girovagando di notte per un bosco , stanco e mesto , si fermò , e volto lo sguardo al cielo , accompagnato da un liuto , intonò una melodiosa romanza alle stelle , le cui parole suonavano pressappoco così : " Io sono perdutamente , irrimediabilmente , passionalmente , fanciullescamente , meravigliosamente , spiritualmente , fisicamente , sentimentalmente , vulcanicamente innamorato di una gentil cerbiatta , dai grandi occhi a mandorla e dalla bellissima bocca di cerasaaaaaa !! " Le stelle , a quel canto appassionato , commosse , presero a sbattere le loro ciglia argentee , lanciando nello spazio siderale bagliori intensi , scintillando con maggior lucentezza più e più volte , in segno di partecipazione al sentimento dell' [SEP] orso [SEP] .
itwac	Un tale , che poi è morto , mi aveva detto che anche il cemento e il ferro si fondono , se l' incendio è potente [SEP] ORSO [SEP] - Io ci sono stato , in un incendio di quel tipo .
itwac	Il primo nucleo era costituito da 40 unità di personale e quattro laboratori : quello di malarialogia ( che sostituiva la Stazione sperimentale per la lotta antimalarica , nata nel 1925 e diretta da Lewis Hackett della Rockefeller Foundation e dall' italiano Alberto Missiroli ) , quello di batteriologia , di chimica e di fisica ( prima chiamato Ufficio del Radio e situato all' interno dell' Istituto di Fisica dell' Università " La Sapienza " in via Panisperna , diretto da [SEP] Orso [SEP] Maria Corbino .
itwac	In Europa cominciano a soffiare minacciosi venti di guerra [SEP] Orsi [SEP] va per i trentaquattro anni .
itwac	Ordine dei Primati : tutte le specie di : lemuri , scimmie [SEP] orso [SEP] , scimmie del nuovo e vecchio mondo , gibboni , orango , scimpanzè e gorilla .
itwac	----------------------------------------------------- gruppo : Palermo Emergency Palermo : appuntamenti di Febbraio I volontari del gruppo di Palermo saranno presenti con un banchetto informativo , coi gadgtes e con la raccolta delle firme per l' appello " Cessate il fuoco " : il 2 Febbraio alle 21 presso il teatro Metropolitan per lo spettacolo do Gabriele Cirilli il 5 e 6 Febbraio alle 21 presso il teatro metropolitan per lo spettacolo del " Flamenco Joaquin Ruiz il 10 Febbraio alle 21 presso il teatro Metropolitan per il concerto del Frank Gamble Trio I volontari di Palermo si riuniscono ogni venerdi' alle 18 presso la sede di Piazza S. Anna 17 ----------------------------------------------------- iniziative a Aosta il gruppo Emergency di Aosta sarà presente alla millenaria Fiera di S. [SEP] Orso [SEP] ad Aosta nei giorni : 30 gennaio dalle ore 10 alle ore 18 31 gennaio dalle ore 10 alle ore 18 con un banchetto per la raccolta fondi in Avenue Conseil des commis - angolo Piazza Chanoux --- 8 Febbraio Pont St Matin ORE 20,30 Palazzetto dello sport SPETTACOLO " Lavori in Corso " Organizzato dall' accademia di danza e spettacolo di Ivrea .
itwac	Questi animali però non si nutrono di carogne per cui la carcassa di pecora era destinata soltanto ai grifoni o eventualmente a sciacalli e [SEP] orsi [SEP] ( anche questi importati una decina di anni fa dai cacciatori ) .
itwac	Sono le principali misure previste dal ' ' Protocollo d' azione concernente la gestione degli [SEP] orsi [SEP] ' ' che la giunta provinciale di Trento ha adottato su proposta del presidente , Lorenzo Dellai .
itwac	Le Tredici Vite e Mezzo Del Capitano [SEP] Orso [SEP] Blu .
itwac	Spostandoci al linguaggio economico della Borsa , qui ' si balla con gli [SEP] orsi [SEP] ' ( in Borsa ' orso ' vuol dire ' ribassista ' ) .
itwac	Tutta questa storia viene raccontata ( bene ) da " Bloody Sunday " di Paul Greengrass ( al suo attivo " La teoria del volo " ) in uscita sugli schermi romani dopo la vittoria ex-aequo dell' [SEP] Orso [SEP] d' oro al Festival di Berlino .
itwac	Allora le spiagge che ricordo con maggior piacere sono : Costa Paradiso Rena Majore Rena Bianca ( uno spettacolo impagabile ) La Pelosa ( stintino ) Spiaggia di Santa Maria ( LA Maddalena ) Cala Corsara ( La Maddalena Isola di Spargi ) Capo d' [SEP] Orso [SEP] Spiaggia delle Saline ( Palau ) Isola dei Gabbiani Spero di esserti stata utile !
itwac	L' album è già in vendita dal 24 giugno presso lo stabilimento balneare della Duna degli [SEP] Orsi [SEP] , ma a partire dalla metà di luglio sarà distribuito nei migliori negozi di dischi di tutto il mondo , venduto in edizione special price al costo di un cd singolo .
itwac	Preso dall' ira segui le tracce di due scarponi sporchi di sangue e richiamò a se i suoi amici animali tra cui [SEP] orsi [SEP] , falchi , lupi e li portò con se fino a una distesa di erba dove vi era eretto un avamposto in rovina ...
itwac	ZANOTTI BIANCO , Paolo [SEP] Orsi [SEP] e la Società , p. 319 = p. 425 ( cit .
itwac	Tra gli animali endemici troviamo l' [SEP] orso [SEP] polare grigio , nero e bruno , il castoro , il bufalo , il lupo , il coyote , la lince , il coguaro , il cervo , il caribù , e due tipi di alce .
itwac	Che cos' è un [SEP] orso [SEP] polare ?
itwac	Orso d' argento per migliore musica : Majoly , Serge Fiori , Mamadou Diabate per il film " Madame Brouette " di Moussa Sene Absa Orso d' argento per miglior contributo artistico : Li Yang per il film " Mang Jing " Premio Der Blaue Engel ( Angelo Blu ) per migliore film europeo : " Good Bye , Lenin " di Wolfgang Becker [SEP] Orso [SEP] d' oro per miglior cortometraggio : " Torzija " di Stefan Arsenijevic ( Slovenia ) .
itwac	Titolo : Il bacio dell' [SEP] orso [SEP] Cast : Maurizio Donadoni , Silvio Orlando , Keith Allen Regia : Sergej Bodrov Lola ha tredici anni e fa la trapezista in un circo .
itwac	PIANETA TERRA Asfaltare il pianeta FIUMI D' ITALIA Uno su tre è malato Mediterraneo Mare sano nel 2010 CHI TAGLIA LE FORESTE Una lobby di legna BOYCOTT Per salvare le foreste  del grande [SEP] orso [SEP] POLITICA E AMBIENTE La querelle " elettrosmog " MARCHI ECOLOGICI Un vero eco-boom COMMISSIONE EUROPEA Punire i reati ambientali BICI ELETTRICHE E SCOOTER Due ruote elettriche SALVARE LE BARRIERE CORALLINE Interviene l' Unep Arte natura comunicazione Il Teatro Natura La verità sulla Agopuntura e omeopatia le alternative che piacciono ALIMENTAZIONE Il banco del pescivendolo Crescere genitori Il corpo e il comportamento  del bambino BENESSERE Un po' di iodio PIANTE OFFICINALI Il carciofo VIAGGI IN ITALIA E NEL MONDO Viaggiare Slow Food VIAGGI BIMBI Andare per castelli IL FUMETTO Little Eco in Smogland SVILUPPO SOSTENIBILE , CHE DIAMINE !
itwac	Un impegno che ha prodotto 300 numeri di UCT ( alle fine del 2000 ) , una mole di lavoro immenso , vitale , problematico e complesso se si pensa che sono stati prodotti , inoltre , anche 200 volumi di argomenti tematici divisi in dieci collane : Piramide ( narrativa ) Picchio Verde ( poesie ) / Il Graffio ( poesie ) Segantini ( arte contemporanea ) Dürer ( carte geografiche e piante prospettiche ) Musica viva ( musica ) Memoria delle radici ( cultura e società ) Teseo ( storia ) , Situla ( usi e costumi ) De Coquina ( cucina ) [SEP] Orso [SEP] ( natura e ambiente ) Un lavoro realizzato con la collaborazione di migliaia di persone e centinaia di ragazzi in servizio civile che hanno scritto e dato il proprio contributo di pensiero affinché il Trentino crescesse nella conoscenza e coscienza di sé , degli altri e dell' ambiente che lo circonda .
itwac	Anche gli [SEP] orsi [SEP] della Cina , dove vengono messi in gabbie e " torturati " finchè vivono , hanno dei paladini che si spendono per la loro causa , benchè il fenomeno sia circoscritto a poche realtà che sopravvivono nella totale ignoranza , e di folclore , spero .
itwac	Porprio come nelle ' mie ' valli si parla di lupi , di acquile e di [SEP] orsi [SEP] .
itwac	Miglior attrice è Julia Jentsch , che vince l' [SEP] Orso [SEP] d' Argento per la sua interpretazione di Sophie School - Gli ultimi giorni , del regista tedesco Marc Rothemund , che a sua volta ha vinto l' Orso d' Argento come miglior regista .
itwac	Non farei loro del male , se non in caso di battuta di caccia al cervo che si trasforma in aggressione dell' [SEP] orso [SEP] ...
itwac	                            " Sembra l' attacco di un [SEP] orso [SEP] !
itwac	La prima è Un giorno dopo l' altro di Luigi Tenco ( unico brano de " I piaceri dell' [SEP] orso [SEP] " di cui Mesolella non è autore ) , evocata nel racconto come sigla dell' indimenticata serie tv " Le avventure del commissario Maigret " , un omaggio al grande cantautore ligure e alla tv in bianco e nero .
itwac	Inseguiti da un [SEP] orso [SEP] assassino ( l' orso Bart protagonista anche del film omonimo di Jean Jacques Annaud ) i tre devono fronteggiare i rigori del freddo e i morsi della fame per tentare di sopravvivere .
itwac	' Gegen die Wand ' è il primo film tedesco a vincere dopo 19 anni l' [SEP] Orso [SEP] d' oro a Berlino .
itwac	Squadre di poliziotti fortemente armati insieme con esperti in medicina veterinaria pattugliano giorno e notte le aree boschive intorno alla citta' con l' ordine di sparare agli [SEP] orsi [SEP] che presentano sintomi visibili di rabbia .
itwac	Venne da solo e in forma d' [SEP] orso [SEP] ; e nella sua furia pareva che fosse diventato grande come un gigante .
itwac	Per le violazioni delle disposizioni , della presente legge e delle leggi regionali si applicano le seguenti sanzioni : a ) l' arresto da tre mesi ad un anno o l' ammenda da lire 1.800.000 a lire 5.000.000 per chi esercita la caccia in periodo di divieto generale , intercorrente tra la data di chiusura e la data di apertura fissata dall' articolo 18 ; b ) l' arresto da due a otto mesi o l' ammenda da lire 1.500.000 a lire 4.000.000 per chi abbatte , cattura o detiene mammiferi o uccelli compresi nell' elenco di cui all' articolo 2 ; c ) l' arresto da tre mesi ad un anno e l' ammenda da lire 2.000.000 a lire 12.000.000 per chi abbatte , cattura o detiene esemplari di [SEP] orso [SEP] , stambecco , camoscio d' Abruzzo , muflone sardo ; d ) l' arresto fino a sei mesi e l' ammenda da lire 900.000 a lire 3.000.000 per chi esercita la caccia nei parchi nazionali , nei parchi naturali regionali , nelle riserve naturali , nelle oasi di protezione , nelle zone di ripopolamento e cattura , nei parchi e giardini urbani , nei terreni adibiti ad attività sportive ; e ) l' arresto fino ad un anno o l' ammenda da lire 1.500.000 a lire 4.000.000 per chi esercita l' uccellagione ; f ) l' arresto fino a tre mesi o l' ammenda fino a lire 1.000.000 per chi esercita la caccia nei giorni di silenzio venatorio ; g ) l' ammenda fino a lire 6.000.000 per chi abbatte , cattura o detiene esemplari appartenenti alla tipica fauna stanziale alpina , non contemplati nella lettera b ) , della quale sia vietato l' abbattimento ; h ) l' ammenda fino a lire 3.000.000 per chi abbatte , cattura o detiene specie di mammiferi o uccelli nei cui confronti la caccia non è consentita o fringillidi in numero superiore a cinque o per chi esercita la caccia con mezzi vietati .
itwac	E questo signor Cavaliere , rustico come un [SEP] orso [SEP] , mi tratta sì bruscamente ?
itwac	L' [SEP] Orso [SEP] , che rappresenta anche il logo del Festival ed è simbolo della città di Berlino , è opera della scultrice Renée Sintesis ( 1888 - 1965 ) .
itwac	Senza fermarsi uno dei commerciali indicando con il pollice dietro urla ai colleghi delle altre squadre : - Noi l' [SEP] orso [SEP] lo abbiamo trovato ...
itwac	La vecchia facciata su Piazza dell' [SEP] Orso [SEP] fu demolita e fu aggiunto un nuovo corpo di fabbrica con logge angolari mentre su Via Zanardelli fu creato un ingresso monumentale ; l' edificio fu sopraelevato ed ebbe su Piazza di Ponte Umberto una nuova facciata .
itwac	In mezzo a questa abbondanza di daini , cervi , [SEP] orsi [SEP] bruni , stambecchi , cinghiali e persino degli yak di importazione l' Inquilina Non Pagante ad un certo punto mi ha guardato un po' spazientita e mi ha chiesto dove fossero le mucche .
itwac	/ Pier Luigi [SEP] Orsi [SEP] ( ( Commento a : D. Gagliani , Funerali di sovversivi , in : Rivista di storia contemporanea , 1984 , n. 1 .
itwac	Per le violazioni delle disposizioni , della presente legge e delle leggi regionali si applicano le seguenti sanzioni : a ) l' arresto da tre mesi ad un anno o l' ammenda da lire 1.800.000 a lire 5.000.000 per chi esercita la caccia in periodo di divieto generale , intercorrente tra la data di chiusura e la data di apertura fissata dall' articolo 18 ; b ) l' arresto da due a otto mesi o l' ammenda da lire 1.500.000 a lire 4.000.000 per chi abbatte , cattura o detiene mammiferi o uccelli compresi nell' elenco di cui all' articolo 2 ; c ) l' arresto da tre mesi ad un anno e l' ammenda da lire 2.000.000 a lire 12.000.000 per chi abbatte , cattura o detiene esemplari di [SEP] orso [SEP] , stambecco , camoscio d' Abruzzo , muflone sardo ; d ) l' arresto fino a sei mesi e l' ammenda da lire 900.000 a lire 3.000.000 per chi esercita la caccia nei parchi nazionali , nei parchi naturali regionali , nelle riserve naturali , nelle oasi di protezione , nelle zone di ripopolamento e cattura , nei parchi e giardini urbani , nei terreni adibiti ad attività sportive ; e ) l' arresto fino ad un anno o l' ammenda da lire 1.500.000 a lire 4.000.000 per chi esercita l' uccellagione ; f ) l' arresto fino a tre mesi o l' ammenda fino a lire 1.000.000 per chi esercita la caccia nei giorni di silenzio venatorio ; g ) l' ammenda fino a lire 6.000.000 per chi abbatte , cattura o detiene esemplari appartenenti alla tipica fauna stanziale alpina , non contemplati nella lettera b ) , della quale sia vietato l' abbattimento ; h ) l' ammenda fino a lire 3.000.000 per chi abbatte , cattura o detiene specie di mammiferi o uccelli nei cui confronti la caccia non è consentita o fringillidi in numero superiore a cinque o per chi esercita la caccia con mezzi vietati .
itwac	Se si pensa al tutto condito attraverso un' animalizzazione dell' universo ( l' [SEP] orso [SEP] , il turco , etc. ) che evidenzia come tutta quanta l' operazione abbia dietro di sé un sostrato teorico più che una volontà di dimostrazione , si arriva facilmente a capire come l' universo tratteggiato nel film argentino sia strutturalmente più vicino a quello di un fumetto che a quello di un pamphlet : nonostante ciò il racconto fila sereno fino alle fine , retto in maniera esemplare dal protagonista Julio Chavez , in grado anche soltanto attraverso un movimento delle sopracciglia o una camminata di spalle di far capire cosa significa vivere nella pelle di un orso .
itwac	Per Fez , struzzi e manganelli , [SEP] Orsi [SEP] ha chiesto a ventisei scrittori di oggi di ambientare le loro storie noir durante il ventennio fascista .
itwac	Impazzito di dolore , l' orso ruggì e si alzò sulle zampe posteriori , agitando le zampe anteriori a destra e a sinistra , e prima che Noonan potesse sparare di nuovo , l' animale aveva avvinghiato una trave di sostegno del soppalco e l' aveva sradicata , abbattendo con essa varie altre travi , finchè l' intera baracca cominciò a crollare intorno a Noonan e all' [SEP] orso [SEP] ferito .
itwac	Oltre cento specie di vertebrati popolano questa foresta dall' habitat ospitale : il daino dalla coda nera , il lupo grigio , le capre di montagna e ovviamente gli orsi : il grizzly , l' [SEP] orso [SEP] nero , e il Kermode o Spirit Bear , una specie particolare di orso bruno , dal mantello bianco .
itwac	Una cosa da nn perdere ad Helsinki , è il mercato nella zona porto , soprattutto quello coperto : una serie di negozietti con posti a sedere , con di tutto e di + x assaggiare le specialità del posto , salmone in tutte le versioni , alce e pure l' [SEP] orso [SEP] ...
itwac	Subito un vento caldo si avvolse attorno alle gambe dell' [SEP] orso [SEP] impedendogli di avanzare e pochi istanti dopo sotto le sue zampe pelose si aprì una pozza di sabbie mobili che lo trascinavano sempre più in basso man mano che si dimenava .
itwac	La fauna è composta da elefanti , rinoceronti , tigri , leopardi , tapiri , [SEP] orsi [SEP] malesi , orangutan e gibboni .
itwac	100 campioni , 15 genotipi diversi di orso bruno su un' area di 700 km 2 facente parte di una porzione dell' area di distribuzione in cui l' [SEP] orso [SEP] raggiunge tra le più alte densità .
itwac	Nel prossimo volume troverete degli [SEP] orsi [SEP] ...
itwac	" Visto che te ne intendi , sai cosa significa subire una morsa dell' [SEP] orso [SEP] .
itwac	Per primi si inoltrano nella foresta gli amministrativi , i quali dopo avere compilato montagne di documenti e controllato e ricontrollato che tutte le scartoffie necessarie per la caccia fossero in regola , aver mandato fax di avviso inizio e fine battuta , rientrano in poco tempo con un [SEP] orso [SEP] di discrete dimensioni .
itwac	Di sicuro non poteva trattarsi di un [SEP] orso [SEP] .
itwac	Nadia Sonika Utente Esperto 708 Posts Inviato - 13 Nov 2002 : 14:06:00 Il ballo dell' [SEP] orso [SEP] è dovuto a noia ...
itwac	Diario da Berlino 20 febbraio 19 febbraio 18 febbraio 17 febbraio 16 febbraio 15 febbraio 14 febbraio 13 febbraio 12 febbraio 11 febbraio 10 febbraio La Berlinale a Roma Conclusioni e premi Presentazione Prime notizie Recensioni Le passeggiate al Campo di Marte Provincia meccanica Hotel Rwanda Le avventure acquatiche di Steve Zissou www.berlinale.de tutti i premi Orso d' Oro : U-Carmen eKhayelitsha di Marc Dornford-May ( Sudafrica ) Orso d' Argento - Gran Premio della Giuria : Kong que ( Peacock ) ( Cina ) Orso d' Argento per la Miglior regia : Marc Rothemund per Sophie Scholl - Die letzten Tage ( Germania ) Orso d' Argento per la Migliore attrice : Julia Jentsch per Sophie Scholl - Die letzten Tage ( Germania ) Orso d' Argento per il Miglior attore : Lou Taylor Pucci per Thumbsucker ( USA ) Orso d' Argento per l' originale contributo artistico : Tian bian yi duo yun ( The Wayward Cloud ) ( Taiwan / Francia ) [SEP] Orso [SEP] d' Argento per la Migliore colonna sonora : Alexandre Desplat per De battre mon coeur s' est arrêté ( Francia ) Premio AGICOA Angelo Azzurro per il Miglior film europeo : Paradise Now di Hany Abu-Assad ( Paesi Bassi / Francia / Germania ) Premio Alfred Bauer per la Migliore opera di ' particolare innovazione ' : Tian bian yi duo yun ( The Wayward Cloud ) di Tsai Ming Liang ( Taiwan / Francia ) Premio della Giuria Ecumenica per il Miglior film in Competizione : Sophie Scholl - Die letzten Tage di Marc Rothemund ( Germania ) Premio della Giuria Ecumenica per il Miglior film della sezione Panorama : Va , vis et deviens ( Live and Become ) di Radu Mihaileanu ( Francia / Israele ) Premio della Giuria Ecumenica per il Miglior film della sezione Forum : Ratziti lihiyot gibor ( On the Objection Front ) di Shiri Tsur ( Israele ) Premio FIPRESCI per il Miglior film in Competizione : Tian bian yi duo yun ( The Wayward Cloud ) di Tsai Ming Liang ( Taiwan / Francia ) Premio FIPRESCI per il Miglior film della sezione Panorama : Liu Jiayin di Monika Borgmann , Lokman Slim , Hermann Theissen ( Germania / Libano / Svizzera ) Premio FIPRESCI per il Miglior film della sezione Forum : Niu pi ( Oxhide ) di Liu Jiayin ( Cina ) Premio della Gilde Deutscher Filmkunsttheater : Asylum di David MacKenzie ( USA / Irlanda ) Premio dei lettori del Berliner Morgenpost : Paradise Now di Hany Abu-Assad ( Paesi Bassi / Francia / Germania ) Premio del pubblico per il Miglior film della sezione Panorama : Va , vis et deviens ( Live and Become ) di Radu Mihaileanu ( Francia / Israele ) Teddy Award per il Miglior film : Un año sin amor ( A Year Without Love ) di Anahí Berneri ( Argentina ) Orso di Cristallo per il Miglior Film : Bluebird di Mijke de Jong ( Paesi Bassi ) Menzioni speciali : Italianetz ( L' italiano ) di Andrei Kravchuk ( Federazione Russa ) Ikke Naken ( The Color of Milk ) di Torun Lian ( Norvegia / Svezia ) Orso di Cristallo per il Miglior Film ( Kinderfilmfest / 14 plus ) : Voces inocentes ( Innocent Voices ) di Luis Mandoki ( Messico ) Menzione speciale ( Kinderfilmfest / 14 plus ) : Lakposhtha hâm parvaz mikonand ( Turtles Can Fly ) di Bahman Ghobadi ( Iran / Iraq ) Gran Premio del Deutsches Kinderhilfswerk : Italianetz ( L' italiano ) di Andrei Kravchuk ( Federazione Russa ) Menzione speciale : Ikke Naken ( The Color of Milk ) di Torun Lian ( Norvegia / Svezia )
itwac	I corsi previsti nell' anno scolastico 2004/05 sono sinteticamente riportati di seguito : Dolomiti , tesori di cristallo e di vita Le rocce raccontano : a scuola di geologia nelle Valli di Fiemme e Fassa Destinatari : Docenti di Scuola Elementare e Media delle Valli di Fiemme e Fassa Sede : Mostra Rettili Permiani Cavalese  sentiero del Butterloch - Bletterbach  Escursione Monzoni versante Sud  Museo Tridentino di Scienze Naturali ( laboratorio e Mostra ) Calendario : 2 - 3 - 4 - 8 settembre 2004 Relatori : Elisabetta Demattio e collaboratori del Museo Tridentino di Scienze Naturali Durata : 14 ore Iscrizioni : entro il 27 agosto 2004 Partecipanti : massimo 25 Quota iscrizione : 15,00  per ciascun docente I nuovi laboratori di matematica Destinatari : Docenti degli Istituti Superiori Sede : Museo Tridentino di Scienze Naturali Calendario : 20 - 27 settembre , 4 ottobre 2004 Relatori : Italo Tamanini , docente di Analisi Matematica presso la Facoltà di Scienze dell' Università di Trento  direttore del Laboratorio di Didattica e Comunicazione della Matematica del Dipartimento di Matematica della stessa Università Iscrizioni : entro il 16 settembre 2004 Partecipanti : massimo 20 Quota iscrizione : 20,00  per ciascun docente L' [SEP] orso [SEP] e gli altri grandi carnivori : è possibile la convivenza con l' uomo ?
itwac	" [SEP] ORSO [SEP] : L' orso rispetto agli altri animali ha il vantaggio che a Carnevale puo' restare vestito cosi' com' e' .
