corpus	sentence
itwac	Chocolat City of Angels Cliffhanger Colpevole d' innocenza Destini incrociati Die Hard Faccia a Faccia FBI-Protezione Testimoni Febbre da cavallo Fluke French Kiss Fuochi d' Artificio Galline in fuga Genitori in trappola Grizzly falls , la valle degli [SEP] orsi [SEP] Heartbreakers Il Ciclone Il Decameron Il destino ha 4 zampe Il Gobbo di Notre Dame Il grande Joe Il lungo cammino dopo la notte Il mandolino del capitano Corelli Il miglio verde Il mostro Il negoziatore Il padre della sposa Il padre della sposa 2 Zanna Bianca-un piccolo grande lupo Il pesce innamorato Il talento di Mr Ripley In fondo al cuore Insonnia d' amore Io no spik inglish Jack e Sarah John Q. Jonny Stecchino Kramer contro Kramer L' angolo rosso L' anno che verra' L' uomo che sussurrava ai cavalli La carica dei 101 La carica dei 102 La giovane Regina Vittoria La leggenda del pianista sull' Oceano La mano sulla culla La maschera di ferro La Principessa Sissi La stanza del figlio La strana coppia II Liberate i pesci Lo Squalo Maledetto il giorno che t' ho incontrato Matrimonio a 4 mani Mi chiamo Sam Mickey occhi blu Mission Impossible 2 Nella morsa del ragno Nemico Pubblico Notting Hill Pane e cioccolata Pearl Harbor Pretty Woman Qualcosa di personale Qualcosa è cambiato Rapimento e riscatto Ricette d' amore Sei giorni sette notti Sette anni in Tibet Apocalypse Now Redux Sissi la giovane imperatrice Ferie d' agosto Sissi , destino di un' imperatrice Grazie di tutto Il pranzo della Domenica Senso Il piú bel giorno della mia vita A spasso con Daisy Lunga vita alla signora Danni collaterali Il diario di Bridget Jones Harry Potter e la Pietra Filosofale Kate e Leopold Pretty Princess La vita é bella Sister Act Sister Act 2 Soluzione Estrema Sperduti a Manhattan Sposami papà - incontri proibiti Spy Kids Sweet November The Rock Un amore tutto suo Uno sbirro tuttofare Unico Testimone Uno strano scherzo del destino Vajont Viaggi di nozze Pane e tulipani Serendipity - Quando l' amore è magia Le quattro piume Il Pianista Il cuore altrove Al vertice della tensione Il Socio Un ciclone in convento I corti di mezzanotte A Civil Action Asterix e Obelix : missione Cleopatra Signs Rex cucciolo - Le avventure di un piccolo commissario 007 - la morte puó attendere Traccia pericolosa Il rapporto Pelican L' Ultimo Sogno I corti di mezzanotte Air Force One I corti di mezzanotte Il segno della libellula - Dragonfly Will Hunting-Genio Ribelle Bad Company Il mio cane Skip Le signore in giallo Matrimonio per papá I corti di mezzanotte
itwac	Sono come gli [SEP] orsi [SEP] : chiusi e riservati .
itwac	Una chicca : l' attrice francese Anouk Aimee riceverà un [SEP] Orso [SEP] d' Oro alla carriera il 13 febbraio .
itwac	Oppure una fiaba che avevo nel sussidiario delle elementari , un tipo che per scampare ad un [SEP] orso [SEP] si fingeva morto .
itwac	La città incantata , [SEP] Orso [SEP] d' Oro a Berlino nonché Oscar come miglior film d' animazione ...
itwac	io il suo vocione da [SEP] orso [SEP] @ @ MADAME @ @ a tutte le ore : mi sopporta da secoli senza lanciarmi i portacenere .
itwac	[SEP] orso [SEP] ( Rispondi ) ...
itwac	La Cina ha molte centinaia di altri esemplari del popolare [SEP] orso [SEP] bianconero in diversi zoo , ma per loro si è dimostrato molti difficile accoppiarsi .
itwac	Ieri gli [SEP] orsi [SEP] boccheggiavano nelle loro gabbie e i felini sono rimasti a secco .
itwac	Il triplo debutto del grande chitarrista degli Avion Travel - nelle nuove vesti di scrittore , performer e cantante - in una speciale opera prima : " I piaceri dell' orso " FAUSTO MESOLELLA - dal 1986 chitarrista degli Avion Travel , compositore e arrangiatore , che divide progetti e canzoni con grandi artisti italiani e stranieri - debutta nell' opera prima " I piaceri dell' [SEP] orso [SEP] " ( ZONA , 15 euro ) in tre nuove vesti : scrittore , performer e cantante .
itwac	Il film ha vinto il premio Oscar come miglior film d' animazione e l' [SEP] Orso [SEP] d' Oro al Festival di Berlino del 2002 7 Dicembre Peppe Rosso e il Re dell' Udito Ambaradan Teatro .
itwac	Cabala â   La Grande Assemblea Sacraâ   ) Gerald Massey , lâ  TMautore del â   Libro degli Iniziâ   e â   Genesi Naturaleâ   dice â   La prima forma del Sette mistico era stato raffigurato nel paradiso dalle Sette grandi stelle del grande [SEP] Orso [SEP] , la costellazione assegnata dagli Egiziani alla Madre del Tempo , e ai Sette Poteri Elementaliâ   ( spiriti ) È stato detto che gli Egiziani dividevano il cielo di notte in sette parti e che lâ  TMessere umano ha Sette Anime .
itwac	Tra i suoi lavori : Le Notti della Luna Piena , L' [SEP] Orso [SEP] , Nikita , 1492 : La Conquista del Paradiso e il recente Albergo Roma .
itwac	Gli [SEP] orsi [SEP] per la loro mole e i pericolosi artigli non sono animali facili da gestire .
itwac	[ 14 ] Art. 8 legge 890 del 20.11.1982 , applicata ad esempio in BARBIE.IT , 6/2/2002 , saggio Maria Luisa Buonpensiere , su http://www.crdd.it/decisioni/barbie.htm , INTENTIA.IT , 4/1/2002 , saggi Fabio Salvatori , Francesca D' [SEP] Orsi [SEP] e Edoardo Fano , su http://www.crdd.it/decisioni/intentia.it ; MONDOCONVENIENZA.IT , 8/11/2001 , saggio Alessandro Zampone , su http://www.crdd.it/decisioni/mondoconvenienza.htm [ 15 ] Decisione BIOTHERM.IT , 20/3/2001 , saggio Luca Peyron , su http://www.crdd.it/decisioni/biotherm.htm , nel quale è stata negata la possibilità di integrazione d' ufficio del petitum .
itwac	La famosa invasione degli [SEP] orsi [SEP] in Sicilia viene presentata col corredo di tavole a colori che l' autore disegnò per la prima edizione .
itwac	Verrebbero invece fatti evacuare dalla costa verso l' interno « solo a scopo precauzionale » , gli abitanti di Capo d' [SEP] Orso [SEP] » .
itwac	Molto probabilmente , anche in base agli avvistamenti effettuati nei luoghi delle incursioni , si tratta di [SEP] orsi [SEP] di taglia medio piccola , forse esemplari sub adulti non più accompagnati dalla madre , più inesperti e sprovveduti degli adulti .
itwac	Sono possibili visite anche durante il periodo estivo UN PIC NIC CON LUPI E LONTRE E [SEP] ORSO [SEP] MARSICANO ( PENNE - PESCARA ) L' Oasi WWF di Penne si trova in Abruzzo , sul fiume Tavo .
itwac	ore 18:30 Evelina Santangelo | Il giorno degli orsi volanti | info E quando gli [SEP] orsi [SEP] voleranno davvero tutto sarà di nuovo possibile , in questo libro che mescola buio e luce in un impasto nuovo .
itwac	Si tratta di un' antica osteria di mare condotta da Nino d' [SEP] Orso [SEP] e Giuseppina , alla base dei loro piatti il pescato giornaliero personale o quello dei pescatori locali .
itwac	Tra le specie presenti nel paese figurano giaguari , ocelot , pecari , tapiri , cervi , armadilli , numerose specie di scimmie e il raro [SEP] orso [SEP] con gli occhiali .
itwac	[SEP] Orso [SEP] d' Argento a Berlino .
itwac	Prodi alla Convention dell' Ulivo : " Alle europee non mi candido ma tornerò il primo novembre " Berlusconi : " Prodi si deve dimettere dalla presidenza della Commissione europea " Festival di Berlino : l' [SEP] Orso [SEP] d' oro per il miglior film a " Contro il muro " del regista turco-tedesco Fatih Akin 15/02/2004 Economia : Tremonti annuncia misure contro l' evasione e il carovita , priorità del programma economico 2004 Osservatorio UE : Allarme epatite C ; ne soffre la metà degli europei che fanno uso di stupefacenti Mosca : crolla il tetto del parco acquatico Trasvall Parkk .
itwac	" " Mi balzò il cuore in gola al pensiero che potesse trattarsi di un [SEP] orso [SEP] polare , e credo che anche Perrington fosse assalito dal medesimo timore .
itwac	3.6 Sostanze narcotiche L' immobilizzazione chimica degli orsi verrà effettuata usando come narcotico la miscela Medetomidina / Ketamina usata con successo dallo staff veterinario per le catture di [SEP] orsi [SEP] nel Parco Nazionale D' Abruzzo ( Gentile et al .
itwac	Al candore notturno , scivolanti sul ghiaccio , quasi gli [SEP] orsi [SEP] ed i lupi che l' inverno ha affamati questa danza li incalza verso l' ignoto oceano .
itwac	Appena portatosi il pallone sul destro operò un bellissimo diagonale dal basso verso l' alto , che si spense nell' angolo alto alla destra dell' incolpevole [SEP] Orsi [SEP] .
itwac	All' improvviso , scorse l' [SEP] Orso [SEP] Arancione .
itwac	Nel 1957 l' attrice ha la sua seconda candidatura al premio Oscar , grazie al film " Selvaggio è il vento " ( " Wild is the Wind " ) diretto da George Cukor , che gli vale anche un [SEP] Orso [SEP] d' argento al Festival di Berlino .
itwac	" ( WWF Brescia ) In questi giorni l' orso bruno è tornato anche nella Svizzera italiana , cento anni dopo l' uccisione dell' ultimo [SEP] orso [SEP] .
itwac	Un film sull' 11 settembre Roma , 23 aprile - Paul Greengrass , regista di Bloody Sunday ( [SEP] Orso [SEP] d' Oro a Berlino ) , in Italia per presentare il film , ha annunciato che sta scrivendo una sceneggiatura sugli attentati dell' 11 settembre .
itwac	i - la cicala e la formica ii - il corvo e la volpe iii - la rana e il bove iv - i due muli v - il lupo e il cane vi - la mucca , la capra e la pecora in societ col leone vii - la bisaccia viii - la rondine e gli uccellini ix - il topo di citt e il topo di campagna x - il lupo e l' agnello xiii - i ladri e l' asino xi - l' uomo e la sua immagine xiv - simonide salvato dagli dèi xv - la morte e il disgraziato xvi - la morte e il boscaiolo xvii - l' uomo stagionato e le due amanti xviii - la volpe e la cicogna xix - il ragazzo e il maestro di scuola xx - la gallina e la perla xxi - i calabroni e le api xxii - la canna e la quercia i - contro gl ' incontentabili ii - il consiglio dei topi iii - il lupo e la volpe davanti al tribunale della scimmia iv - i due tori e la rana v - il pipistrello e le due donnole vi - l' uccello ferito vii - la cagna e la sua compagna viii - l' aquila e lo scarabeo ix - il leone e il moscerino x - l' asino carico di spugne e l' asino carico di sale xi - il leone e il topo xii - la colomba e la formica xiii - l' astrologo che casca nel pozzo xiv - la lepre e le rane xv - il gallo e la volpe xvi - il corvo che vuole imitare l' aquila xvii - il pavone e giunone xviii - la gatta cambiata in donna xix - il leone e l' asino a caccia xx - il testamento interpretato da esopo i - il mugnaio , suo figlio e l' asino ii - le membra e lo stomaco iii - il lupo pastore iv - le rane vogliono un re v - la volpe e il becco vi - l' aquila , la scrofa e la gatta vii - l' ubriacone e la sua donna viii - la gotta e il ragno ix - il lupo e la cicogna x - il leone e il pittore xi - la volpe e l' uva xii - il cigno e il cuoco xiii - i lupi e le pecore xiv - il leone fatto vecchio xv - filomela e progne xvi - la donna annegata xvii - la donnola nel granaio xviii - il gatto e il vecchio topo i - il leone innamorato ii - il pastore e il mare iii - la mosca e la formica iv - il giardiniere e il signore vi - battaglia di topi e di donnole v - l' asino e il cagnolino vii - la scimia e il delfino viii - l' uomo e l' idolo di legno ix la gazza vestita colle penne del pavone x - il dromedario e i bastoni galleggianti xi - la rana e il topo xii - tributo che gli animali mandarono ad alessandro xiii - il cavallo che volle vendetta dal cervo xiv - la volpe e il busto xv - il lupo , la capra e la capretta xvi - il lupo , la madre e il bambino xvii - parole di socrate xviii - il vecchio e i suoi figliuoli xix - l' oracolo e l' empio xx - l ' avaro e il tesoro xxi - l' occhio del padrone xxii - l' allodola , i suoi figli e il padrone del campo i - il boscaiolo e mercurio ii - il vaso di terra e il vaso di ferro iii - il pesciolino e il pescatore iv - Le orecchie della lepre v - la volpe dalla coda mozza vi - la vecchia padrona e le due serve vii - il satiro e il passeggero viii - il cavallo e il lupo ix - il contadino e i suoi figli x - la montagna che partorisce xi - la fortuna e il ragazzo xii - i medici xiii - la gallina dalle uova d' oro xiv - il mulo che porta reliquie xv - il cervo e la vite xvi - il serpente e la lima xvii - la lepre e la pernice xviii - l' aquila e il gufo xix - il leone che va alla guerra xx - l' orso e i due compari xxi - l' asino vestito della pelle del leone i - il pastore e il leone ii - il leone e il cacciatore iii - il sole e il vento iv - giove e l' affittaiolo v - il galletto , il gatto e il topolino vi - la volpe , la scimmia e gli animali vii - il mulo orgoglioso della sua genealogia viii - il vecchio e l' asino ix - il cervo che si specchia nell' acqua x - la lepre e la testuggine xi - l' asino e i suoi padroni xii - il sole e le rane xiii - il contadino e il serpente xiv - il leone malato e la volpe xv - l' uccellatore , il falco e l' allodola xvi - il cavallo e l' asino xvii - il cane , la sua preda e l' ombra xviii - il barocciaio xix - il ciarlatano xx - la discordia xxi - la vedovella Epilogo Alla signora di montespan i - gli animali malati di peste ii - il mal maritato iii - il topo eremita iv - l' airone v - la ragazza vi - i desideri vii - la corte del leone viii - gli avvoltoi e i piccioni ix - la carrozza e la mosca x - pierina e il secchiolino del latte xi - il curato e il morto xii - chi corre dietro alla fortuna e chi l' aspetta in letto xiii - i due galli xiv - ingratitudine e ingiustizia degli uomini verso la fortuna xv - l' indovina xvi - il gatto , la donnola e il coniglio xvii - la testa e la coda del serpente xviii - un animale nella luna i - la morte e il moribondo ii - il ciabattino e il banchiere iii - il leone , il lupo e la volpe iv - la virt delle favole v - l' uomo e la pulce vi - la donna e il segreto vii - il cane che porta il pranzo al suo padrone viii - il buffone e i pesci ix - il topo e l' ostrica x - l' [SEP] orso [SEP] e il giardiniere xi - i due amici xii - il porco , la capra e il montone xiii - tirsi e amaranto xiv - esequie alla leonessa xv - il topo e l' elefante xvi - l' oroscopo xvii - l' asino e il cane xviii - il bascià e il mercante xix - i vantaggi del sapere xx - giove e i fulmini xxi - il falcone e il cappone xxii - il gatto e il topo xxiii - il torrente e il fiume xxiv - l' educazione xxv - i due cani e l' asino morto xxvi - democrito e gli abderiti xxvii - il cacciatore e il lupo i - il depositario infedele ii - i due piccioni iii - la scimmia e il leopardo iv - la ghianda e la zucca v - lo scolaro , il pedante e il padrone dell' orto vii - il topo cambiato in ragazza vi - lo scultore e la statua di giove viii - il matto che vende la sapienza ix - l' ostrica e i due litiganti x - il lupo e il cane magro xi - nulla di troppo xii - la candela xiii - giove e il navigante xiv - il gatto e la volpe xv - il marito , la moglie e il ladro xvi - il tesoro e i due uomini xvii - la scimmia e il gatto xviii - il nibbio e l' usignolo xix - il pastore e l' armento Al delfino di francia
itwac	Salento : Torre dell' [SEP] Orso [SEP] .
itwac	Chi vuole imparare a parlare con i delfini , a cantare come una balena , a fuggire dagli [SEP] orsi [SEP] polari non perda questa occasione irripetibile !
itwac	Preoccupa la situazione della Germania L' Fmi taglia le stime di crescita " Ma l' economia non deraglierà " Italia : crescita del pil all' 1,1 % nel 2003 Ancora [SEP] Orso [SEP] nelle Borse mondiali WASHINGTON - E' andata meglio che nel 2002 ma l' economia mondiale arranca .
itwac	L' eterozigosi ( il numero degli individui di una popolazione che hanno due o più varianti alleliche per lo stesso gene ) delle popolazioni di orso bruno dell' America settentrionale e della Scandinavia è maggiore rispetto a quella dell' [SEP] orso [SEP] bruno dell' Appennino : 0,49 - 0,78 contro 0,36 .
itwac	Nel corso della sua carriera ha diretto oltre cinquanta pellicole fra le quali " I mastini della guerra " ( 1980 ) , " Champions " ( 1983 , candidato all' [SEP] Orso [SEP] d' oro al Festival di Berlino 1994 ) , " Hambuerg Hill " ( 1987 ) , " Robin Hood - La leggenda " ( 1991 ) e " Tre vedove e un delitto " ( 1994 ) .
itwac	ah sì , era il nome che il personaggio aveva dato a un cucciolo d' [SEP] orso [SEP] bruno da bambino e poi è diventato il suo cognome Per l' avatar , dato che Shauku era un mago guerriero l' avatar tenta di riprenderlo                  Lo metto altrimenti lei mi picchia http://www.studiofenice.com/chy 79 Una discreta artista , principalmente pittrice ma anche abile gioielliera con l' argento , specializzata in gioielli fantasy ^ Top Arj 3 n Drago Registrato : 12 - 05 - 2005 20:01 Messaggi : 550 Località : Reate Inviato : Ven 22 Lug 2005 1:32 am Oggetto : e io che volevo aprirne uno simile , di thread ...
itwac	Fino a poco tempo fa si sterminavano gli orsi del paleartico , e lo si farebbe ancora se solo fossero più abbondanti , senza tener conto del fatto che l' [SEP] orso [SEP] è una piacevole e simpatica creatura , benché non brilli per quoziente intellettivo .
itwac	Non solo egli scrisse un necrologio di Paolo [SEP] Orsi [SEP] , certamente su suggerimento dell' amico ( J .
itwac	Tecnologici erano invece i Watchimal , orologi con un ingombrante cinturino di peluche ( davvero importabili ) e il " secchione " [SEP] orso [SEP] parlante Teddy Ruxpin .
itwac	Sono abruzzese , e mi sento tale , molto più di quanti scrivono " chieti merda " sui muri di pescara , e quando , qualche tempo fa , ho visto i cartelloni dell' assessorato al turismo che recitavano così : " E' estate , non fare l' orso " con tanto di foto di [SEP] orso [SEP] bruno marsicano , mi è uscito spontaneo , sussurrato a mezza voce , un grandioso " vaffanculo .
itwac	E Gherardin si levò prestamente , colla spada tagliente sanza fa · resta : e inver dell' [SEP] orso [SEP] , nequitosamente [ 27 ] , uno colpo gli dié sopra la testa che l' ebbe fesso [ 28 ] infino al bianco dente ; e Marco Bello ne facea gran festa .
itwac	L' [SEP] Orso [SEP] , per esser goffo e destro , senza pensare il suo fine , prese il consiglio della Volpe .
itwac	I grandi mammiferi sono più longevi dei piccoli : si ha notizia di [SEP] orsi [SEP] bruni vissuti 34 anni , cavalli e leoni di 30 , giraffe di 28 e cammelli di 26 anni , foche di 20 , cervi di 19 .
itwac	Allegoria e quarta trasmutazione de Calisto ed Arcade convertiti in [SEP] orsi [SEP] ed in stelle .
itwac	« Emilia Romagna Festival » Anche per « Emilia Romagna Festival » sono in programma due appuntamenti , entrambi a Forlì : venerdì alle 21.15 , nel cortile di Palazzo [SEP] Orsi [SEP] Mangelli Pierre Hommage , violino e Sandro De Palma , pianoforte eseguiranno musiche di Mozart , Brahms e Franck ; domenica alle 21.15 nella Chiesa del Carmine per « Progetti musicali sul territorio » l' « Orchestra Bruno Maderna » , con Federico Mondelci al sassofono e diretta da Anton Nanut eseguirà musiche di Haydn , Glazunov , Rota , Grieg .
itwac	BASILI ora è diventata un sito più ricco e complesso : da una parte , la Banca dei dati si è ampliata in maniera cospicua ; essa ora permette di fare ricerche su cinque piste : scrittori e loro opere , critici e loro opere , tesi universitarie ; dall' altra parte , alla banca si è affiancata una rivista , kúmá , che contiene e presenta testi letterari inediti , saggi critici , bibliografie , notizie sulle arti e le culture della migrazione ecc. Kúmá , nella lingua bámbara dell' Africa occidentale subsahariana , vuol dire Parola ( in italiano rimanda a una famosa Sibilla , in giapponese vuol dire [SEP] orso [SEP] , in wolof e in altre lingue altro ancora ) .
itwac	Commento di giuseppe secondo me il napoli vincera con difficoltà 2 a 1 Commento di franesco è un napoli che secondo me salirà in serie b senza peoblemi Commento di peppe de simone Dico a ventura ke se nn vinciamo contro i " lupi " a salerno gia hanno ammazzato l' [SEP] orso [SEP] !
itwac	Or gli [SEP] orsi [SEP] affronta sugli alpini sassi , ora i cingiali in valle ima e palustre : or s' un gianetto par che ' l vento passi , seguendo o caprio o cerva multilustre , che giunta par che bipartita cada in parti uguali a un sol colpo di spada .
itwac	I bambini hanno visto dal vivo uno scheletro di mammuth e uno di [SEP] orso [SEP] bruno .
itwac	Loro non si accontentavano di dirla nella loro lingua oppure di spiegarla con i gesti , loro la disegnavano anche , questo serviva per intendersi meglio , infatti i disegni che si trovano nelle caverne non rappresentano solo la caccia all' animale ma la caccia al Dio [SEP] Orso [SEP] , al Dio Lupo , al Dio Cinghiale e cosi via .
itwac	" Abbiamo - sono le parole dell' Assessore alla Pubblica Istruzione di Massa Marittima Luciano Fedeli - puntato sulla qualità anche nei minimi dettagli per offrire ai bambini che animeranno " L' [SEP] Orso [SEP] Bruno " un ambiente gradevole e sicuro da tutti i punti di vista " .
itwac	Jürg Paul Müller / Rico Stecher - L' orso speléo nelle Alpi - Museo scienze naturali Alto Adige , Bolzano Le scoperte sull' orso speléo , un probabile antenato dell' [SEP] orso [SEP] bruno , vissuto anche in Alto Adige fino a 20.000 anni fa .
itwac	Da un' analisi più attenta risulta che l' episodio dei Pronipoti è quello meglio conservato , mentre gli episodi dei Flintstones e dell' [SEP] orso [SEP] Yogi sentono un po' di più il peso degli anni , ma in definitiva le differenze visibili sono veramente poche .
itwac	È certamente il migliore tra i contemporanei , tanto è vero che ha vinto prestigiosi premi nel 1998 : [SEP] Orso [SEP] d' Oro per il miglior film al Festival di Berlino , nomination a due premi Oscar , Golden Globe per il miglior film straniero , Orso d' Argento a Berlino per la migliore interpretazione femminile .
itwac	Poiché la Cina non è mai vicina , per andarla a scovare bisogna prendere un aereo da Seul alla remota isoletta di Seogwipo , dove i coreani vanno in luna di miele , o a visitare il museo dell' [SEP] orso [SEP] di peluche .
itwac	E per gli [SEP] orsi [SEP] reduci da anni di schiavitù e sfruttamento , i volontari di Wildlife hanno aperto veri e propri centri di recupero .
itwac	PROGRAMMA Sabato 6 marzo 2004 ( Sala Consiglio Comunale di Sarzana ) Ore 9,30 - Saluti e apertura dei lavori Renzo Guccinelli ( Sindaco di Sarzana ) Sandro Biasotti ( Presidente della Regione Liguria ) Ore 9,45 - Sessione del mattino Relazione introduttiva Massimo Caleo ( Coordinatore Aree Protette della Liguria ) Relazioni tematiche Coordina Franco Lorenzani ( Direttore Generale Dipartimento Pianificazione Territoriale Paesistica e Ambientale della Regione Liguria ) La costruzione del sistema regionale delle aree protette Federico Beltrami ( Dirigente Ufficio Parchi e Aree Protette della Regione Liguria ) Dal Piano del Parco al Piano Pluriennale Socio-Economico : esperienze e buone pratiche di programmazione , concertazione e gestione dei progetti per lo sviluppo sostenibile Dario Franchello ( Presidente Parco naturale regionale del Beigua ) Il ruolo dell' informazione , della formazione e dell' educazione ambientale nelle strategie dei parchi liguri Renato Dirodi ( Presidente Parco naturale regionale di Portofino ) La sfida del mare protetto in Liguria Franco Bonanini ( Presidente Parco nazionale delle Cinque Terre ) Biodiversita' e tutela del territorio : strategie ed azioni Walter Baruzzo ( Presidente Parco naturale regionale di Montemarcello - Magra ) La tutela del patrimonio rurale ed architettonico nelle aree protette della Liguria Roberto Costa ( Presidente Parco naturale regionale dell' Antola ) Turismo sostenibile : la nuova sfida per i parchi liguri Giuseppino Maschio ( Presidente Parco naturale regionale dell' Aveto ) Il ruolo delle amministrazioni locali nella gestione diretta delle aree protette Gianfranco Della Croce ( Sindaco del Comune di Portovenere - gestore del Parco naturale regionale di Portovenere ) Luigi Sormano ( Sindaco del Comune di Piana Crixia - gestore del Parco naturale regionale di Piana Crixia ) Ore 12.15 Interventi di chiusura della sessione del mattino Franco [SEP] Orsi [SEP] ( Assessore Territorio e Ambiente della Regione Liguria ) Matteo Fusilli ( Presidente Federazione Italiana Parchi e Riserve Naturali ) Aldo Cosentino ( Direttore Generale DPN Ministero dell' Ambiente ) ore 13,00 - Pausa pranzo ore 14.30 - Sessione del pomeriggio Tavola rotonda moderata da Renzo Moschini ( Federparchi ) Le aree protette della Liguria : il consolidamento del ruolo di tutela e di valorizzazione ambientale contestuale alla costruzione di uno strumento innovativo per il rilancio sociale , economico e turistico del territorio regionale Intervengono : rappresentanti di UPI , UNCEM , ANCI , Corpo Forestale dello Stato Sono stati invitati a partecipare i rappresentanti di Associazioni ambientaliste , Ambiti Territoriali di Caccia e Associazioni Venatorie , APT e Organizzazioni che operano nel campo del turismo , Mondo della scuola , Universita' e ricerca scientifica , Organizzazioni agricole , Artigianato , G.A.L. , Operatori economici , Operatori degli Enti Parco , Mondo della cooperazione , ecc. Ore 17.30 : Relazione conclusiva - Coordinatore Aree Protette della Liguria Ore 18.00 : Chiusura dei lavori Domenica 7 marzo 2004 Escursione programmata nel Parco di Montemarcello - Magra Per ulteriori informazioni : segreteria organizzativa c / o Ente Parco di Montemarcello-Magra Via A. Paci 2 , 19038 Sarzana ( SP ) tel. 0187.691071 - fax 0187.606738
itwac	Carlo Sirtori Prev by Date : Corriere della Sera 19.10.04 Next by Date : Svezia , un [SEP] orso [SEP] uccide un cacciatore : non accadeva dal 1902 Previous by thread : Corriere della Sera 19.10.04 Next by thread : Svezia , un orso uccide un cacciatore : non accadeva dal 1902
itwac	of Ab 3 rrante 16/07/2005 12:32 Ma grazie ;-) Quella dell' [SEP] orso [SEP] è meravigliosa :-) of Gino 16/07/2005 17:51 l' erba voglio A me piace quella che hai regalato a Marco ( quell' altro ) ...
itwac	Gira la ruota e corre un gran orso , l' [SEP] orso [SEP] polare spaventa ogni compare .
