corpus	sentence
itwac	Abito a Roma , scrivetemi a questo indirizzo di posta lillo7000@libero.it Sono un leccatore di [SEP] passere [SEP] professionista !! Ciao Vi aspetto .
itwac	Nei congelatori sono state trovate alcune decine di uccelli di specie protette : pispole , pettirossi , [SEP] passere [SEP] scopatole .
itwac	Il direttore è un giovane simpatico , un tipo concreto ed efficiente , uno che è in Posta da vent' anni , ha iniziato dal basso e parla ancora con aria sognante della gestione [SEP] Passera [SEP] .
itwac	P.S. Ma igrillocanterino è tifoso Viola o della [SEP] passera [SEP] ?! [ Michele  46 07/08/2004 23:34:00 ] Forza stasera convinti !!!
itwac	Le barche appartenenti alla categoria [SEP] passere [SEP] e gozzi possono derogare dalle prescrizioni sopraindicate , riguardanti le sistemazioni di sicurezza quali pulpiti , candelieri , pozzetti autovuotanti , ecc. ma dovranno essere in regola con le dotazioni di sicurezza stabilite dall' Autorità Marittima .
itwac	( Fonte : rivista " Le Chef " - ADARC ) Pesci magri Pesci intermedi Pesci grassi Merluzzo Eglefino Limanda Razza Branzino Orata Triglia Siluro [SEP] Passera [SEP] Sogliola Rombo Sardina Aringa Salmone Sgombro Composizione chimica della carne del Silurus glanis ( Fonte : rivista " Le Chef " - ADARC ) Sostanza secca 22 % 100 % Sostanze azotate totali 18 % 81,6 % Sostanze grasse 3 % 13,5 % Minerali totali 0,8 % 3,8 % Sostanze non azotate 0,2 % 1,1 % Valore energetico 100 Kcal / 100 gr 418 Kj / 100 gr Tabella comparativa del valore calorico del siluro con altri alimenti ( Kcal / 100 gr ) ( Fonte : rivista " Le Chef " - ADARC ) Rendimento del siluro in percentuale di peso vivo , media tra valori di pesci da 1,5 - 2,5 kg di peso vivo .
itwac	Col [SEP] passere [SEP] dle tempo ci siamo perfezionati , sia negli abiti sia nei combattimenti .
itwac	Mia Inviato da : Glow il Jun 27 2005 , 11:34 PM in effetti a scuola quando si è in intimità cn tt i miei amici m chiamano [SEP] passera [SEP] pas è corto ed efficace per eprimere il mio carattere Inviato da : Pimpi il Jun 27 2005 , 11:40 PM Benvenuto !!!
itwac	Se vi aspettate di trovare la [SEP] Passera [SEP] sarda sarete delusi : qui vive abbondante la Passera oltremontana .
itwac	Mi ha messo il becco nella [SEP] passera [SEP] !! " E la seconda paperella : " Beh , e cosa vuoi di più dalla vita ?
itwac	[ ] PER QUELLI DA ROMA IN GIU' | 18/12/2002 - 16:34 | un anonimo andate a zappare la terra invece di stare su internet terroni minkioni del cazzo !!!!!!!!!!!!!!!!!!!!!!!!!!!!!!!! siete tutti dei grandissimi figli di puttana !!!!!!!!!!!!!!!!!!! terroni e albanesi , due razze una unica merda !!!!!!!!!!!!! siete addirittura peggio dei livornesi !!!!!!!!!!!!!!!!! forza magico pisa neroazzurro !!!!!!!!!!!!!!!!!!!!!!! e poi pensate anche un po' alla [SEP] passera [SEP] ragazzi !!!!!!!!
itwac	Pellican , diglielo tu a Monaco , che troppo [SEP] Passere [SEP] pianuzze fan male ...
itwac	Tra i luoghi visitabili , tutti allestiti con adeguate schede informative sull' architettura , sulla storia e sulle curiosita' connesse al luogo : la Palazzina del Peso , il convento e la Chiesa della Trinita' , il Palazzo Comunale , l' Oratorio di Sant' Andrea , la Chiesa della Misericordia , il Palazzo Valperga Barone e la Chiesa di Santa Marta , la Chiesa Parrocchiale , il Palazzo Valperga Masino con il parco , le Purtasse ( antiche porte medievali ) la Chiesa di San Calogero e l' antico Castellazzo ( i resti del castello calusiese , mirabilmente liberato dai rovi e dal selvatico ed ora visitabile dopo tantissimi anni ) , la Chiesa di San Rocco e Palazzo [SEP] Passera [SEP] .
itwac	Purtroppo o per fortuna siamo entrati a far parte di quella categoria di utenti affezionati a questo nuovo mezzo di comunicazione , attraverso il quale facciamo [SEP] passere [SEP] notizie che ci riguardano direttamente dal nostro sito , www.violle.it , realizzato dalla MiG Graphics ( sviluppo in grafica del progetto Made in Globe ) .
itwac	Abito a Roma , scrivetemi a questo indirizzo di posta lillo7000@libero.it Sono un leccatore di [SEP] passere [SEP] professionista !! Ciao Vi aspetto .
itwac	bhe [SEP] passera [SEP] anke perke nn vedo l' ora di andarmene in vacanza ...
itwac	Ritengo ottima la relazione del dottor [SEP] Passera [SEP] .
itwac	Ovviamente se dalla detenzione il soggetto [SEP] passere [SEP] ad altri usi ( dirigere il traffico , fermare altri veicoli ecc. ) allora sarà perseguibile per i singoli reati comessi e si potra sequestrare la paletta come corpo di reato .
itwac	ciao Rispondi Leggi le risposte a questo intervento : 26/05/2005 - [ uno ] RE : vergogna pipi almeno avevi la [SEP] passera [SEP] fresca senza mutandine ...
itwac	Ghiandaia Storno Rigogolo Passera oltremontana [SEP] Passera [SEP] sarda , alcune a Kerkini , una coppia nel nido di cicogna sul pilone sospeso sull' acqua 2 km a Sud di Kerkini .
itwac	Una [SEP] Passera [SEP] sarda Passer hispaniolensis è stata osservata nell' estate 2001 nel Delta del Po , non molto lontano da Porto Barricata ( RO ) , dove era osservato il Gabbiano di Sabine .
itwac	Un cast di primo livello che avrà il compito di mantenere alto l' interesse e l' affetto del pubblico mantenendo fede ad una tradizione che ha visto questa serie televisiva [SEP] passere [SEP] in tre anni dal 22,4 % di share al 31,6 dello scorso anno con una media di 8.514.000 telespettatori .
itwac	ed una [SEP] Passera [SEP] sarda Passer hispaniolensis .
itwac	e sordo stropicciar di mossi scanni , e cigolio di tavole spiegate odo vagar fra le sonanti risa di giovani festivi e fra le acute voci di dame cicalanti a un tempo , come intorno a selvaggio antico moro sull' imbrunir del dì garrulo stormo di frascheggianti [SEP] passere [SEP] novelle ?
itwac	Qualora , a insindacabile giudizio del Comitato Organizzatore e del Comitato di Regata , le condizioni meteomarine fossero tali da poter creare situazioni di pericolo , gli stessi avranno la facoltà di escludere dalla partenza la categoria [SEP] passere [SEP] e gozzi .
itwac	Nei giorni scorsi il Nucleo antibracconaggio ha liberato ad Almese ( Piemonte ) 300 uccelli protetti sequestrati ai bracconieri : pettirossi , capinere , usignoli , [SEP] passere [SEP] scopatole , crocieri , frosoni , ciuffolotti , cardellini , lucherini , mentre un centinaio di uccelli , mutilati dai bracconieri , sono stati portati in un centro recupero LIPU della Regione .
itwac	SSA [SEP] PASSERA [SEP] Ginecologa ad Orvieto QUI CHIAVI SUBITO Duplicazione chiavi in un attimo a Loano FILETTO E FILOTTO Macelleria con annessa sala biliardo a Luino LA CASA DEL MICROCHIP Vendita uccelli di piccola taglia a Genova SE NELLA VITA PENSI SOLO ALLA PATATINA ...
itwac	( commenti : 0 ) LA [SEP] PASSERA [SEP] SOLITARIA postato da Roby poeta [ mercoledi 27 luglio 2005 ore 15:35:16 ] L' aria è immobile , l' attimo magico in sospeso .
itwac	( commenti : 0 ) LA [SEP] PASSERA [SEP] SOLITARIA postato da Roby poeta [ mercoledi 27 luglio 2005 ore 15:35:16 ] L' aria è immobile , l' attimo magico in sospeso .
itwac	amministratore delegato di Banca Intesa , dott. [SEP] Passera [SEP] .
itwac	Mi ha messo il becco nella [SEP] passera [SEP] !! " E la seconda paperella : " Beh , e cosa vuoi di più dalla vita ?
itwac	Non deve rispondere , dottor [SEP] Passera [SEP] .
itwac	Doveva essere un incontro risolutivo , per mettere la parola fine alla telenovela Peri [SEP] Passera [SEP] .
