corpus	sentence
itwac	Il momento della cerebralizzazione ha rappresentato per l' uomo un salto decisivo nella " scala della natura " e , dunque , umanità e grandi [SEP] scimmie [SEP] nulla avrebbero a che fare l' una con le altre .
itwac	La donna e la [SEP] scimmia [SEP] di Peter Høeg Titolo originale dell' opera : Kvinden og Aben Traduzione di Bruno Berni pag. 238 , Lit .
itwac	Tante case farmacèutiche - cosmetiche multinazionali non sempre si comportano bene verso noi [SEP] scimmie [SEP] , e in generale verso noi animali .
itwac	Recensioni e articoli Altri libri sull' argomento : Giuseppe Arcidiacono , L' uomo , la vita e il cosmo Jacob D. Bekenstein , Buchi neri , comunicazione energia John Gribbin , Dalla [SEP] scimmia [SEP] all' universo Dennis William Sciama , Questo bizzarro universo
itwac	( 16 Novembre 2004 ) La nemisi dell primo Il primo film venne fatto nell 1968 quando l' america passava una crisi morale ed era ormai incastrata in quell massacro chiamato guerra dell vietnam , quindi questo film come altri della sua generazione rifletteva questo disagio dell america e cosi uscirono capolavori come il primo pianeta delle [SEP] scimmie [SEP] , che tolta la storia fantascientifica e le scimmie non era altro che una denuncia sulla umanita , e questo lo si capisce dall finale dove charls heaston dice chiaramente che la terra è stata distrutta da una guerra nucleare .
itwac	E che dire , invece , della ripugnanza che un soggetto potrebbe provare se un giorno gli venisse impiantato l' artiglio di una [SEP] scimmia [SEP] ?
itwac	delle mucche lo sapevo , anche delle [SEP] scimmie [SEP] me ne avevano parlato , ma trovare gente a cavallo ( !?! ) dei ciuchi in mezzo al traffico ...
itwac	Ebbene , solo qualche [SEP] scimmia [SEP] superiore comprende che l' immagine al di là dello specchio non è " altro " ma è " sé " .
itwac	L' ordine dei Primati comprende alcune famiglie di Proscimmie e alcune di [SEP] Scimmie [SEP] , e la specie umana appartiene ad una di queste ultime .
itwac	Questo grave effetto collaterale fu possibile poiché i virus vaccinici utilizzati erano stati cresciuti su cellule di rene di [SEP] scimmia [SEP] , risultate in seguito infettate da SV 40 .
itwac	Lei , che fece scandalo , perché una " [SEP] scimmia [SEP] " non poteva sporcare la purezza ricca dei campi verdi , fino a far inorridire le signore lorde di make-up , di rossetti , di ventagli e quegli occhiali scuri ben aldilà del sole .
itwac	Per ogni [SEP] scimmia [SEP] devono essere archiviate in un registro informazioni dettagliate riguardanti la provenienza ( allevamento , luogo di cattura e quarantena ) , la data di arrivo , la data di nascita , l' età ( reale o presunta ) , il sesso , e la data di rimozione o di morte .
itwac	" Allora Khalifa lasciò cadere la frusta e si avvicinò alla seconda [SEP] scimmia [SEP] che gli disse : " Ascoltami bene , Khalifa , se tu mi ubbidirai in tutto ciò che io ti dirò , avrai per mezzo mio la ricchezza .
itwac	Gli uomini più antichi a quanto risulta sono gli AUSTRALOPITECHI , individui che non appartengono al genere homo , ma che non erano più [SEP] scimmie [SEP] , in quanto avevano un' andatura eretta e il cervello più grosso delle scimmie .
itwac	( A. 3 , n. 41 , 1924 ) L' impresario , l' asino e la [SEP] scimmia [SEP] .
itwac	Si scorgeva negli Usa la vera pubblicità comparativa , c' era uno spot della Pepsi così concepito : a una [SEP] scimmia [SEP] veniva data da bere Coca Cola , a un' altra la Pepsi .
itwac	Il rettile ha una frequenza più lenta della [SEP] scimmia [SEP] , la quale ha una frequenza più lenta dell' uomo .
itwac	Ant : formica Baer : orso Camel : cammello Dolphin : delfino Elephant : elefante Fox : volpe Goat : capra Horse : cavallo Lion : leone Monkey : [SEP] scimmia [SEP] Ostrich : struzzo Pig : maiale Rabbit : coniglio Snake : serpente Tiger : tigre Wolf : lupo Zebra : zebra
itwac	Si osserva lo stesso fenomeno in una serie di studi su animali che spesso rispondono al maltrattamento del loro padrone mostrando un attaccamento uguale o persino rafforzato ( vedi ad esempio Fisher , 1955 , per il maltrattamento di cani ; Harlow & Harlow , 1971 , per il maltrattamento di [SEP] scimmie [SEP] ; Ratner , 1976 , per il maltrattamento di uccelli ) .
itwac	Nella giungla le [SEP] scimmie [SEP] sono numerose : vivono nude , mangiano i frutti e si accoppiano con le compagne della stessa specie .
itwac	" Meno del 10 % del restante habitat delle grandi [SEP] scimmie [SEP] d' Africa sarà lasciato relativamente inalterato entro il 2030 se la costruzione di strade , i campi minerari e gli altri sviluppi di infrastrutture continueranno ai livelli attuali " , afferma il documento .
itwac	Ciò nonostante i due demoni sono alquanto coriacei e , preso alla sprovvista dopo aver compito un giro della morte , [SEP] Scimmia [SEP] viene centrata da un diretto nello stomaco e sbalzato lontano dalla nuvola d' oro .
itwac	Le aree valutate furono la corteccia cerebrale frontale ed occipitale , il caudato-putamen e la substantia nigra di [SEP] scimmie [SEP] trattate con MPTP .
itwac	I neurologi hanno misurato l' attivita' cerebrale nell' ippocampo mentre le [SEP] scimmie [SEP] erano ' impegnate ' in un videogame realizzato per valutare la memoria .
itwac	° Nel 1982 , venne ritirato dal commercio ( per la constatazione di 3500 casi di tossicità nell' uomo , con 61 morti ) l' Opren , un antiartritico che non dava effetti tossici nelle [SEP] scimmie [SEP] .
itwac	I prati mutavano colore con le stagioni , le aie si riempivano e si vuotavano e tornavano a riempirsi e , al giungere dell' inverno , i " langurs " riprendevano a giocare fra i rami spruzzati di neve , finché in primavera le [SEP] scimmie [SEP] madri riportavano su dalle calde vallate i loro piccoli dagli occhi tristi .
itwac	Se non avete visto il PIANETA DELLE [SEP] SCIMMIE [SEP] datato 1968 correte ai ripari !
itwac	Nel laboratorio ci sono circa 70.000 animali , tra cui conigli , gatti , criceti , cani , porcellini d' India , uccelli e [SEP] scimmie [SEP] .
itwac	A parte il fatto d' aver introdotto [SEP] scimmie [SEP] , topi e altri animali , i Portoghesi non hanno fatto molto per Mauritius , al contrario invece dei successivi conquistatori , gli Olandesi .
itwac	Discussione : Niente cibo alle scimmie Iniziato da jack il 24 Mag 05 , 13:14 Numero messaggi : 12 - Numero letture : 828 Questa discussione & # xE 8 ; relativa all' articolo : Niente cibo alle scimmie & # xA 0 ; jack [ 24 Mag 05 , 13:14 ] Niente cibo alle [SEP] scimmie [SEP] & # xA 0 ; Mi viene in mente un fatto , di cui avevo letto molti anni fa .
itwac	Billy era diventato predicatore nel periodo a ridosso del famoso " processo delle [SEP] scimmie [SEP] " del 1925 in cui un insegnante di liceo di biologia fu accusato nel Tennessee d' insegnare illegalmente la teoria darwiniana delle specie e non quella creazionista fedele alla Bibbia .
itwac	E il Film convince , facendo dimenticare il passo falso de " Il Pianeta delle [SEP] scimmie [SEP] " , e catapultando lo spettatore in una costruzione raffinata quanto affascinante nella sua " infantile " semplicità , che sfrutta le moderne tecnologie per creare un giocattolo d' altri tempi : un simpatico pinocchio di legno dai colori vivaci .
itwac	Da dieci anni a questa parte molti dei raccolti delle fattorie locali sono stati fortemente danneggiati dalle [SEP] scimmie [SEP] che mangiano i raccolti ; i danni nel 1996 hanno raggiunto i 96 milioni di yen .
itwac	Uncaged Campaigns e Dan Lyons dovranno difendersi in una causa intentata dalla Imutran , una sussidiaria della multinazionale farmaceutica Novartis , che sta tentando di impedire la diffusione di documenti confidenziali trapelati e che descrivono in dettaglio gli esperimenti di trapianto di organi da [SEP] scimmie [SEP] a primati ( xenotrapianto ) condotti dalla Compagnia .
itwac	Cani , gatti , [SEP] scimmie [SEP] , topi , capre , cavalli , galline , pulcini , tortore , ogni cosa che vive e vuole vivere viene sezionata e torturata dai cosidetti ricercatori .
itwac	Piu' che incoraggianti , i risultati ottenuti sulle [SEP] scimmie [SEP] puntano nella direzione di un' ' ' incredibile efficacia ' ' , secondo la responsabile del reparto di microbiologia del Centro primati Yerkes di Atlanta Harriet Robinson .
itwac	La [SEP] scimmia [SEP] e' un tipo alquanto intellettuale ed e' dotata di una gran memoria , con tutte queste doti non bisogna stupirsi quindi del fatto che che in genere i nati sotto questo particolare segno sono persone destinate ad avere successo in qualsiasi genere di professione .
itwac	IMG 1 IMG 2 IMG 3 IMG 4 IMG 5 IMG 6 19 Dicembre : Le [SEP] scimmie [SEP] tornano su Gamecube .
itwac	Nella " Lex Pompeia " si stabilisce che il parricida venga percosso con virgae sanguineae e poi cucito in un sacco con un cane , un gallo cappone , una vipera ( animali immondi ) e una [SEP] scimmia [SEP] , quindi il sacco sia scagliato nel mare profondo .
itwac	E' vero che la teoria secondo la quale l' uomo discende dalle [SEP] scimmie [SEP] e' molto offensiva ?
itwac	Qualche giorno fa si è potuto vedere in rete che cosa accade realmente dietro alle porte dei laboratori , in questo caso si tratta di un' inchiesta segreta condotta nei Laboratori della multinazionale Covance , proprietaria dell' allevamento di [SEP] scimmie [SEP] di Camarales .
itwac	I duetti delle [SEP] scimmie [SEP] urlatrici sudamericane e dei gibboni del sud-est asiatico hanno per esempio una chiara funzione territoriale .
itwac	Pagpoe Mi sembra uno scenario apocalittico tratto dal film " Il pianeta delle [SEP] scimmie [SEP] " .
itwac	L' obiezione per la quale è inutile parlare di diritti per esseri che non possono difenderli davanti alla comunità nè partecipare alla vita politica viene respinta portando avanti l' analogia con i disabili mentali e i bambini : i loro diritti vengono infatti protetti dalla legge sebbene anch' essi ó così come le [SEP] scimmie [SEP] - siano incapaci di farli valere .
itwac	Nella categoria miglior film di fantascienza , il film di Jackson dovrà vedersela con A.I. , Jurassic Park III , Vanilla Sky , The One , Lara Croft : Tomb Raider e Il pianeta delle [SEP] scimmie [SEP] .
itwac	Alla sera la [SEP] Scimmia [SEP] era ancora calma , ma iniziava a dar segni ...
itwac	La stazione di Victoria Terminus , il più esuberante edificio in stile gotico della città , assomiglia più a una cattedrale o a un palazzo sontuosamente decorato che a un banale scalo ferroviario : sculture di pavoni , doccioni , [SEP] scimmie [SEP] , elefanti e leoni inglesi si mescolano agli archi rampanti , alle cupole , alle torrette , alle guglie e alle vetrate decorate .
itwac	Questi sono i Quattro che non sono mai contenti , che non sono mai sazi da quando sono cominciate le Rugiade : la bocca di Jacala , il gozzo del Nibbio , le mani della [SEP] Scimmia [SEP] e gli occhi dell' Uomo .
itwac	C.D.B. 21.12.2004 * Notizie dalla Tribù delle [SEP] scimmie [SEP] I - Un' altra moda ci attraversa , quella della sciarpa aggiustata a nodo scorsoio .
itwac	Io stesso oltre a vedere il via vai dei lucertoloni e delle [SEP] scimmie [SEP] ho visto delle specie di grosse carpe nere nelle pozze fangose attaccate a delle carcasse .
itwac	" utilizzando tre [SEP] scimmie [SEP] Rhesus  ha spiegato John Donoghue , del Dipartimento di Neuroscienze della Brown  siamo riusciti a ricostruire il segnale che comanda il movimento degli arti grazie a una schiera di sottili elettrodi .
itwac	" Gli studi sulla [SEP] scimmia [SEP] utilizzando cellule fetali dovrebbero concludersi entro la fine del 2004 e solo in quel momento , hanno detto i ricercatori , se avremo successo , potremo fare un' ipotesi del tempo necessario per passare alla sperimentazione sull' uomo e ancora successivamente passare alla eventuale applicazione clinica .
itwac	Come disse un grande linguista americano , Noam Chomsky : " Non cercate d' insegnare alle [SEP] scimmie [SEP] il nostro linguaggio .
itwac	Quando un veterinario ha richiesto la soppressione della [SEP] scimmia [SEP] , il professore ha dichiarato che era una sua " proprieta' " e ha quindi rifiutato di porre fine alla sofferenza dell' animale - sofferenza che non avrebbe mai dovuto essere inflitta .
itwac	In una celebre poesia di Trilussa , la [SEP] scimmia [SEP] dice all' uomo : " Sfido che ti faccio ridere , ti assomiglio tanto " .
itwac	Processi di socializzazione e i rapporti parentali delle [SEP] scimmie [SEP] ( sviluppo psicologico umano e dei primati ) , legami affettivi ( surrogati materni ) ( separazioni precoci ) Chicken Wire Mother Un esperimento di Harlow del 1966 Harry Harlow 1905 - 1981 Informazioni generali sulle sue ricerche e i suoi esperimenti Maternal deprivation Una critica agli esperimenti di deprivazione materna effettuati con i primati Not really a monkey ...
itwac	" " Lo sapevo io che il compare valeva meglio di una [SEP] scimmia [SEP] " mormorò Carmaux .
itwac	Se la distribuzione di variazioni molecolari nelle [SEP] scimmie [SEP] e nei rospi è virtualmente identica , è probabile che anche altre specie a Sulawesi condividano lo stesso schema .
itwac	Guardando s' impara Le due [SEP] scimmie [SEP] Horatio e Oberon potrebbero aver contribuito a risolvere il mistero dell' arte imitativa dei primati .
itwac	Hominidae la famiglia che comprende i fossili di uomini antichi e moderni , insieme ai fossili di " uomini scimmia " Hominoidea la superfamiglia che comprende i fossili di scimmie e ominidi , oltre alle [SEP] scimmie [SEP] antropomorfe e gli uomini moderni .
itwac	Infatti , anzitutto determinerà un cambiamento anche nella storia dell' uomo , spostando la data in cui umani e [SEP] scimmie [SEP] si sono divisi lungo linee evolutive diverse , tra i cinque e gli otto milioni di anni fa .
itwac	' / La [SEP] scimmia [SEP] disse : ' Sfido / t' assomiglio tanto !
itwac	INCONTRO FRA CREAZIONISMO ED EVOLUZIONISMO CON ESCLUSIONE ASSOLUTA DELLA DISCENDENZA DALLE [SEP] SCIMMIE [SEP] E PROBLEMATICA INTORNO ALLA PRESENZA DI REPERTI DI UOMINI APPARTENENTI AD UNA FASE PRECEDENTE RISPETTO A QUELLA ATTUALE , QUELLA DELL' HOMO SAPIENS .
itwac	Attraverso alcuni studi scientifici condotti molti anni fa negli Stati Uniti è stato visto che un piccolo di [SEP] scimmia [SEP] , in assenza delle cure genitoriali adeguate , da grande avrà un atteggiamento deviato , al punto che a sua volta non sarà in grado di allevare dei figli » .
itwac	I Primati ( ordine a cui appartiene anche la nostra specie ) si sono differenziati dai mammiferi primitivi circa 65 milioni di anni fa ( non ci sono dubbi ) , adattandosi ai diversi ambienti e dando origine a specie molto diverse ; alcuni primati attuali ( le [SEP] scimmie [SEP] dette ' antropomorfe ' , come il gorilla , lo scimpanzé e l' orango ) presentano con la nostra specie sconcertanti somiglianze , non solo biologiche ( che riguardano quindi l' anatomia , la fisiologia , la genetica ) ma anche per aspetti che si ritiene siano meno determinati dalla biologia , come il comportamento , la socialità e le modalità di comunicazione , di solito frutto di apprendimento .
itwac	SuperRuby Jun 14 2005 , 04:15 PM QUOTE ( mde @ Jun 14 2005 , 10:08 AM ) esistono dei videogames che ti mandano talmente in [SEP] scimmia [SEP] che arrivi a sognarli , a me è capitato col tetris sai lo fa anche a me il tetris ?? mde Jun 14 2005 , 04:30 PM QUOTE ( SuperRuby @ Jun 14 2005 , 04:15 PM ) QUOTE ( mde @ Jun 14 2005 , 10:08 AM ) esistono dei videogames che ti mandano talmente in scimmia che arrivi a sognarli , a me è capitato col tetris sai lo fa anche a me il tetris ?? sisi capita soprattutto con i giochini con struttura di base più semplice ma impegnativi ...
itwac	Rai e Mediaset proseguono nella loro riservatissima gara al " ribasso " , arricchendo gli straripanti fiumi di critiche e polemiche , offrendo così , prodotti a livelli da " Pianeta delle [SEP] Scimmie [SEP] " ; con rispetto parlando per le Scimmie del film di Franklin Schaffner del  68 .
itwac	Sulla stessa audiocassetta : Volta la pagina e buonanotte / Ninna nanna delle fiabe / Zitta la bocca , zitta la bocca / Il principino di Castelbirbante / Ninna nanna dei nomi / Pioggia , vento , ninna nanna / Ninna nanna al bambino / Sai come fa la [SEP] scimmia [SEP] sul banano / Come chiudere gli occhi / E ninna , e nanna / C' è un bambino ancora sveglio / C' era una volta un sonno lontano / Ninna nanna del pirata / Ninna nanna gatto miao / Ninna nanna pazza / Dormi , che c' è silenzio e tutto tace / Quella dritta , quella storta / C' era una volta una certa sera / Treno treno sui binari / La canzone del sonno lento / C' era un pesce Tonno / Ninna nanna aeiou / Ninna nanna dell' arrabbiato / Ninna nanna della frutta / Ninna nanna della luna / Ninna nanna del mal di pancia / Ninna nanna della voce / Uno , dorme qualcuno / Siccome ho molto sonno / Rana ridola saltava / Dormi giallo sogna rosso / Gatto del sonno piano piano vieni / Chi ha visto il mio sonno / Fa' come ha fatto il sole / Ninna nanna bianca panna
itwac	Films molto piu' vecchi sono riusciti enormemente meglio in DVD ( es. il primo Pianeta delle [SEP] Scimmie [SEP] , 1968 ) .
itwac	Macaia [ 1 ] , [SEP] scimmia [SEP] di luce e di follia , foschia , pesci , Africa , sonno , nausea , fantasia .
itwac	L' uomo si stacca nettamente dalle [SEP] scimmie [SEP] , sul piano biologico e per il comportamento culturale .
itwac	Che differenza c' e' fra un atleta e un domatore sadico di [SEP] scimmie [SEP] ?
itwac	  Ambrogino , il sole e la luna La storia di un piccolo pulcino di fattoria che un giorno cominciò a parlare con la luna ed il sole   La figlia del dottore Susi era stufa di giocare con strumenti giocattolo e con finti pazienti , lei voleva essere medico vero   L' orangutango prepotente La più piccola delle [SEP] scimmie [SEP] escogita un piano per fermare i dispetti di un peloso abitante della giungla
itwac	) delle [SEP] scimmie [SEP] antropomorfe ( apes ) in incredibili " api " ( pp. 111 e 137 ) !!!! A ciò si somma il danno causato dalla stupida eliminazione da parte dell' editore dei preziosi rimandi bibliografici presenti nel testo inglese e in calce , cosa che compromette il valore scientifico di quest' opera .
itwac	« Potremmo scegliere di iniettare delle [SEP] scimmie [SEP] e aspettare 30 anni per vedere cosa succede , ma sono convinto che le cose non andranno così .
itwac	I navigatori portoghesi si imbatterono nell' isola sull' onda delle esplorazioni successive al viaggio di Vasco da Gama intorno al Capo di Buona Speranza nel 1498 ma , oltre a introdurre [SEP] scimmie [SEP] fastidiose e topi , non vi lasciarono molte altre tracce .
itwac	Ma il limite è la capacità di porsi domandeDa Kubrick ad Asimov , scrittori e registi hanno sondato la frontiera dell' I.A. , intendendola quasi come la nuova pietra filosofale degli alchimisti Di Gianni Santamaria Dalla [SEP] scimmia [SEP] che lancia un osso di 2001 : Odissea nello spazio a Deep blue il computer scacchista che nel 1997 ha battuto il campione Gary Kasparov la parabola dell' umanità verso forme di intelligenza superiori , che dall' umano travalicano nell' artificiale , continua a riservarci sorprese .
itwac	Da sempre presente nelle colonie di [SEP] scimmie [SEP] Cercopithecus aethhiops che popolano le foreste dell' Africa equatoriale e in alcune tribù umane lì confinate , il virus HIV è riuscito a dilagare sul nostro pianeta a seguito della costruzione di una strada camionabile che attraversava queste foreste .
itwac	Ma mentre ci siete , aguzzate la vista per non perdervi la possibilità di vedere antilopi , cinghiali selvatici , elefanti delle foreste , di tanto in tanto qualche grosso felino , alcune specie di [SEP] scimmie [SEP] e interessanti varietà di uccelli .
itwac	C' è stata anche l' offensiva proposta del responsabile dell' economia , Gordon Brown , che sempre nel 2000 propose di rivalutare le pensioni con l' inflazione e non con l' andamento dei redditi salariali , il che ammontava a una rivalutazione di 75 pence ( 1 euro ) al mese , scatenando la furia popolare : poiché 75 pence bastano appena a comprare una bustina di noccioline americane , il paese inondò Downing street ( la residenza del premier inglese ) con bustine di noccioline : " Ci tratti come [SEP] scimmie [SEP] " .
itwac	Delfini , cani e [SEP] scimmie [SEP] addestrati per combattere il nemico .
itwac	AUTRICE Non sarà che tutto questo lo fanno perché una [SEP] scimmia [SEP] costa tanto ed è difficile stabularla , cioè tenerla in gabbia ?
itwac	Dopo la vecchia porsche con cui scorazzava l' allora giovane Kelly McGillis in " Top Gun " ( per rivederla ai giorni nostri c' è un bel film australiano " La maschera di [SEP] scimmia [SEP] " di S .
itwac	Orbene , al fine di evitare equivoci , e per rendersi conto di ciò che può dar luogo a certe illusioni , occorre fin dall' inizio sottolineare che , in virtù della legge di analogia , il punto più basso è come un riflesso oscuro o un' immagine invertita del punto più alto ; ne deriva la conseguenza , paradossale solo in apparenza , che l' assenza più completa di qualsiasi principio implica una specie di " contraffazione " del principio stesso , espressa da taluni in forma teologica con l' affermazione : " Satana è la [SEP] scimmia [SEP] di Dio " .
itwac	Naturali " Città e foresta : ragioni e conseguenze di un doppio habitat nel comportamento di una popolazione di Macaca mulatta a Simla ( India ) " di Andrea Camperio Ciani 1981 - 82 Tesi di laurea in Antropologia " Gli esperimenti di comunicazione eterospecifica e interindividuale condotti su alcune [SEP] scimmie [SEP] antropomorfe ( pongidae ) " di Roberta Pieraccioli 1982 - 83 Tesi di laurea in Antropologia " Lineamenti di Demografia Storica a guardia piemontese nella prima metà dell' 800 " di Grazietta Ferraro 1982 - 83 Tesi di laurea in Sc .
itwac	Si tratta di Scimpa la [SEP] Scimmia [SEP] ( 12  ) e di Hyppo l' Ippopotamo ( 12  ) ...
itwac	Le [SEP] scimmie [SEP] di Chaplin .
itwac	Si potrebbe infatti obiettare che , se l' uomo deriva dalla scimmia o dalla materia , « qualcuno » ha pur creato la prima [SEP] scimmia [SEP] o la materia originaria .
itwac	( 3573 bytes free ) L' uomo discende dalla [SEP] scimmia [SEP] .
itwac	Il parco nazionale di Abuko e quello del fiume Gambia sono le riserve ideali da visitare per vedere [SEP] scimmie [SEP] e scimpanzè .
itwac	ri-assemblo , elaboro , ri-concepisco , discerno dalla vociante arena del mondo la musicalità delle parole e sento come Raimond Queneau che " la [SEP] scimmia [SEP] senza sforzo diventò l' uomo , che un pò più tardi disgregò l' atomo ...
itwac	T 4 { } Titolo : Niente cibo alle scimmie Autore : Gordon L. Smith Traduzione : Gagan Daniele Pietrini Revisione : Argomenti : Tecniche Parole chiave : Immagine associata : [SEP] scimmia [SEP] dita orecchie.jpg Immagini interne : Riassunto : La mente scimmia , che espressione adatta !
itwac	HOME - BASE Cinque - Appunti di Matematica ricreativa ] La [SEP] scimmia [SEP] e le noci di cocco Soluzione completa del famoso problema di Ben Ames Williams pubblicato in The Saturday Evening Post nel 1926 Ricordo che il problema è stato proposto a BASE Cinque da Alessandro 89 Cinque marinai naufragano su un' isola semideserta ( semi - , perché c' è una scimmia ) .
itwac	Ma non può da solo , l' astinenza da alcool è devastante , suda freddo e vomita Piotr , l' angoscia gli serra il fiato : questa è la " [SEP] scimmia [SEP] " degli alcolisti .
itwac	E neppure Sophie Marceau ci riesce , obbligata a saltare da una parete all' altra del manicomio dov' è rinchiusa , dimenticandosi di essere " posseduta " da un fantasma egizio e non da una [SEP] scimmia [SEP] .
itwac	Trattasi di [SEP] scimmie [SEP] catarrine cinocefale che tirano a campare come possono nelle boscaglie dell' Africa Occidentale , sono alte più o meno come San Paolo ovvero circa un metro e mezzo e si distinguono facilmente per la simmetrica distribuzione dei colori - il rosso , il rosa e il blu - nel viso e nei genitali .
itwac	Lo sostiene uno studio di due ricercatori neozelandesi apparso su Nature Galileo Iter , candidatura francese Scelta dai ministri della Ue , Cadarache aspira a diventare la sede del reattore termonucleare Grandi [SEP] scimmie [SEP] a un passo dall' estinzione L' Unesco : sono urgenti almeno 25 milioni di dollari per potenziare i metodi di salvaguardia già in atto Lotta all' AIDS un vaccino , due novità Rifiuti nucleari nuovo sito cercasi Dopo le polemiche il Governo ha cancellato il nome di Scanzano Jonico dal decreto .
itwac	Le [SEP] Scimmie [SEP] , a differenza delle Proscimmie , hanno la percezione visiva della profondita' e vedono il mondo a colori .
itwac	Per esempio , quando si è scoperto che alcune scimmie potevano imparare il linguaggio simbolico dei sordomuti americani e interloquire con l' istruttore , quando si è scoperto che alcune [SEP] scimmie [SEP] potevano scrivere su una lavagna con degli oggetti che erano delle parole sintetiche , e quindi si impadronivano di un linguaggio simbolico , molti scienziati , semiologi soprattutto lo hanno negato affermando che gli animali sì potevano avere un loro pensiero ma non potevano attingere al pensiero simbolico .
itwac	UNA SCOPERTA CHE NON STUPISCE GLI ESPERTI « Milioni di specie sono ancora sconosciute » L' etologo Celli : l' uomo non conosce neppure un centesimo degli esseri viventi 11 ottobre 2004 Una nuova specie di [SEP] scimmia [SEP] che finora è sfuggita a tutti i ricercatori nascondendosi nella giungla africana del Congo .
itwac	se tu crei l' illusione di un' uscita , la [SEP] scimmia [SEP] si placa .
itwac	Dal confronto tra il cervello della donna con quello di una femmina di Homo erectus , di una [SEP] scimmia [SEP] e di un microcefalo , è emersa una struttura cerebrale complessa nelle regioni frontali che regolano le funzioni cognitive più alte .
