corpus	sentence
itwac	anticipazione da Jeffrey Moore Una catena di rose su D n. 299 a p. 131 - 8 Enzo Siciliano scrive di Paolo Volponi Opere su La Repubblica del 30 - 4 - 2002 a p. 39 Claudio Magris scrive " L' ultimo sguardo prima dell' addio " su Corriere della sera del 30 - 4 - 2002 a p. 29 Salman Rushdie scrive " La democrazia dei Candide " su La Repubblica del 30 - 4 - 2002 a p. 1 e 12 Nadia Fusini scrive di Joseph Conrad La linea d' ombra su La Repubblica del 30 - 4 - 2002 a p. 42 Mariarosa Mancuso intervista Wu Ming 54 su Corriere della sera del 30 - 4 - 2002 a p. 31 Sergio Frau scrive " Europa " ( viaggio inchiesta nei luoghi degli antichi ) su La Repubblica del 30 - 4 - 2002 a p. 41 Elisabetta Rasy scrive di Annie Proulx Cartoline su Corriere della sera del 30 - 4 - 2002 a p. 29 Gaetano Afeltra scrive " Il preside burbero e la lezione su Omero " su Corriere della sera del 30 - 4 - 2002 a p. 31 Sylvie Coyaud recensisce Oliver Sacks Zio Tungsteno su D n. 299 a p. 236 Laura Lilli intervista Pat Baker Labili confini su La Repubblica del 29 - 4 - 2002 a p. 27 Ernesto Assante scrive del film " Un ragazzo " , tratto dal libro omonimo di Nick Hornby su La Repubblica del 29 - 4 - 2002 a p. 31 Corrado Stajano recensisce Gianni Barbaceto Campioni d' Italia su Corriere della sera del 29 - 4 - 2002 a p. 23 Corrado Augias recensisce Franz Hellens Occhio di Dio su La Repubblica del 29 - 4 - 2002 a p. 30 Giuseppe Leonelli recensisce Margherita d' Amico L' Aquila delle [SEP] Scimmie [SEP] su La Repubblica del 29 - 4 - 2002 a p. 30 Barbara Briganti recensisce Kinta Beevor Un' infanzia toscana su La Repubblica del 29 - 4 - 2002 a p. 30 Giulio Busi scrive " E io mi sciolgo i capelli " ( narrativa ebraica e araba al femminile ) su Il Sole - 24 Ore del 28 - 4 - 2002 a p. 33 Carlo Ossola scrive di Stendhal Romanzi e racconti ( vol. II ) su Il Sole - 24 Ore del 28 - 4 - 2002 a p. 37 Luigi Sampietro recensisce Alan Bennett La cerimonia del massaggio su Il Sole - 24 Ore del 28 - 4 - 2002 a p. 36 Francesco M. Cataluccio recensisce Antoni Libera Madame su Il Sole - 24 Ore del 28 - 4 - 2002 a p. 37 Benedetta Bini recensisce Laurence Sterne Viaggio sentimentale su Il Sole - 24 Ore del 28 - 4 - 2002 a p. 37 Antonio Calabrò recensisce Demetrio Vittorini Un padre e un figlio su Il Sole - 24 Ore del 28 - 4 - 2002 a p. 36 Francesco Erbani recensisce Lisa Ginzburg Desiderava la bufera su La Repubblica del 28 - 4 - 2002 a p. 28 - 9 Giovanni Pacchiano recensisce Margaret Mazzantini Non ti muovere su Il Sole - 24 Ore del 28 - 4 - 2002 a p. 36 Paolo Di Stefano recensisce Lagorio-Pavoni Il cocomero rubato su Corriere della sera del 28 - 4 - 2002 a p. 27 Mauro Covacich recensisce Salman Rushdie Furia su Corriere della sera del 28 - 4 - 2002 a p. 31 Giulio Nascimbeni recensisce Camilla Baresani Sbadatamente ho fatto l' amore su Corriere della sera del 28 - 4 - 2002 a p. 31 Ermanno Paccagnini recensisce Lisa Ginzburg Desiderava la bufera su Corriere della sera del 28 - 4 - 2002 a p. 29 Sara Honegger recensisce Patricia Elem Lascia scorrere il tempo su Il Sole - 24 Ore del 28 - 4 - 2002 a p. 36 Cristina Acquati recensisce Andreas Eschbach Miliardi di tappeti di capelli su Il Sole - 24 Ore del 28 - 4 - 2002 a p. 36 [ !
itwac	Per milioni di anni l' Africa si presentava come un' unica immensa foresta pluviale vasta quasi quanto l' Amazzonia , e qui vivevano tanti tipi di grandi [SEP] scimmie [SEP] .
itwac	Uomini dal volto di [SEP] scimmia [SEP] e donne dalle sembianze feline , pesci e lucertole dall' espressione umana : sono i « Manimals » , le « chimere » digitali create da Daniel Lee mettendo insieme fotografie di uomini e di animali .
itwac	Dopo la trovata , davvero esotica , di realizzare uno Zoo Safari in cima all' Aspromonte , con leoni , [SEP] scimmie [SEP] ed elefanti ( purtroppo , morti tutti assiderati ) , la Calabria , " regione sempre all' avanguardia in merito alle innovazioni " , ci riprova con un' altra idea ( in apparenza ) estremamente democratica : far decidere direttamente ai cittadini di Reggio Calabria se sia giusto o meno , clonare i famosi , Guerrieri di Riace , che in questa città risiedono , presso il bellissimo Museo Archeologico Nazionale della Magna Grecia .
itwac	La [SEP] scimmia [SEP] sulla schiena è un libro che si legge in un pomeriggio .
itwac	Alla base della decisione c' è probabilmente la scoperta che le [SEP] scimmie [SEP] possono essere infettate da un virus simile .
itwac	Rimase ad aspettare per circa un' ora , riflettendo sui suoi casi disgraziati , quindi cominciò a tirare la rete ed ecco sentì che era molto pesante allora , rendendo grazie ad Allàh per quel giorno fortunato , si mise a tirare ancor più alacremente , ma quando la rete fu tutta uscita dall' acqua si accorse che conteneva soltanto una [SEP] scimmia [SEP] guercia e zoppa .
itwac	Secondo i chiromanti non sarà disastroso come quello della [SEP] scimmia [SEP] , ma alcuni temono un aumento delle epidemie , dei terremoti e degli scandali a sfondo sessuale " , scrive il quotidiano The Malaysia Star .
itwac	La cosa mi contraria un po' pur ricordando che il nome della [SEP] scimmia [SEP] viene da qui , dove orang , vuol dire uomo ed utan , foresta .
itwac	ETOLOGIA : USA ; A YALE SCIMMIE A SCUOLA DI CAPITALISMO / ANSA ( di Alessandra Baldini ) ( ANSA ) - NEW YORK , 5 GIU - [SEP] Scimmie [SEP] a Yale a scuola di capitalismo : in uno spazioso laboratorio della celebre universita' della lega dell' Edera un economista americano ha insegnato a un gruppo di sette primati il valore del denaro .
itwac	Queste parole , come una sorta di avvertimento , si trovano in calce sulla quarta di copertina de " La maschera di [SEP] scimmia [SEP] " romanzo della scrittrice australiana Dorothy Porter , edito dalla casa editrice romana Fandango .
itwac	Roland Emmerich replica l' operazione pop di ' Independence Day ' , dove esercitava la sua ironia iconoclasta contro la Casa Bianca , congelando la Statua della Libertà ( con inquadrature che citano ' Il pianeta delle [SEP] scimmie [SEP] ' ) e la bandiera a stelle e strisce .
itwac	Ritornò nella cabina della [SEP] scimmia [SEP] e prese metà delle noci rimanenti più mezza noce .
itwac	Di Leonardo scrittore invece , troviamo una curiosa testimonianza nelle sue " Favole " , una raccolta di brevi componimenti che , mescolando arguzia e dottrina , nascondono un serio ammonimento : la farfalla che attratta dallo splendore del lume si brucia , la [SEP] scimmia [SEP] che si innamora dell' uccellino e lo soffoca di baci , l' asino che addormentandosi sul ghiaccio lo fonde e annega , sembrano tutte ricordare la tragedia dell' ignoranza dell' uomo sulle leggi naturali .
itwac	La giornata trascorre tra bagni e sbraco sulla spiaggia ed ogni tanto l' ambiente viene ravvivato dagli assalti delle [SEP] scimmie [SEP] alle provviste del turista di turno .
itwac	Un gruppo di animalisti durante un' azione contro uno dei vari laboratori-lager libera delle [SEP] scimmie [SEP] infettate da un virus sconosciuto che si dimostrerà ben più pericoloso di quanto pensassero .
itwac	Se ne incontrano alcuni intorno alla Ape 's Den ( Tana delle [SEP] Scimmie [SEP] ) , accanto alla stazione intermedia della funivia ; se ne vedono altri vicino alla stazione superiore , in cima alla rocca .
itwac	Al secondo posto della classifica troviamo il remake di Gus Van Sant del capolavoro di Alfred Hitchcock " Psycho " ; al terzo la versione per il grande schermo della serie Tv Thunderbirds ; al quarto , " Nome in codice : Nina " , remake mal riuscito di " Nikita " ; al quinto , la versione cinematografica di Charlie 's Angels ; al settimo , " Il pianeta delle [SEP] scimmie [SEP] " di Tim Burton ispirato all' omonimo titolo del 1968 ; all' ottavo , il remake per il grande schermo di " Starsky e Hutch " ; al nono , " Cape Fear " , rifacimento firmato Martin Scorsese de " Il Promontorio della Paura " e al decimo , Ocean 's Eleven , ispirato alla pellicola culto del 1960 , " Colpo Grosso " .
itwac	Seguito di " Il pianeta delle [SEP] scimmie [SEP] " 1968 .
itwac	A presentare gli spettacoli tratti dai due più importanti poemi epici indiani , ovvero il MahaBharata e il Ramayana , che raccontano il primo la saga di una famiglia reale spezzata da un conflitto circa il potere sul regno che si risolverà soltanto con una terribile guerra fratricida vinta dai fratelli " buoni " i Pandavas guidati dal Dio incarnato Krishna , il secondo le mitiche imprese del principe Rama che per salvare dal malvagio demone Ravana la sua promessa sposa da questi rapita dovrà affrontare un lungo cammino spirituale costellato di maghi , demoni , santi , superando prove difficilissime , fintantoché non otterrà i poteri necessari a compiere l' impresa aiutato dal capo dell' esercito delle [SEP] scimmie [SEP] , il potente Hanuman .
itwac	" Farfalle " - un gruppo di farfalle esce dalla scarpa blu / bainca / verdina , si depositano dapprima sulla scarpa e poi sotto di essa sollevandola e portandola via Christopher Tin jingle originale per Puma brano non in commercio Puma News Stuff 1 dic 2004 " [SEP] Scimmia [SEP] " - una scimma che esamina la scarpa blu / nera / argento verificandone la resistenza , la morbidezza dopo di che se la porta via Christopher Tin jingle originale per Puma brano non in commercio Puma News Stuff 1 dic 2004 " Formiche " - una formica che vede le scarpe verdi / veridine / nere e richiama altre formiche che sollevano la scarpa e la portano via Christopher Tin jingle originale per Puma brano non in commercio Puma Ouninpohja 1 set 2004 La macchina da rally che schizza di fango la famigliola accostata a guardare la gara X-Ray Burn Baby Burn jingle originale per Puma non in commercio Puma Olimpiadi 2004 13 ago 2004 Una donna bussa ad una porta con una staffetta in mano ; esce un uomo , con una bistecca in mano , la donna gli porge la staffetta .
itwac	sonne [ Sabato 4 Giugno 2005 ore 11:12:07 ] Mi domando ancora una volta cosa vi ha fatto ammalare così il cuore e soprattutto come vi escano le parole , si citano spartani , nazisti , ebrei ( che per inciso ritengono che un individuo sia tale solo alla nascita ) , campi di concentramento , la Fallacci così inacidita dalla vita che credo che per lei un embrione di un musulmano valga sicuramente meno di un embrione di una [SEP] scimmia [SEP] .
itwac	Se in principio fu la pecora scozzese , poi i topini hawaiani , i vitelli americani , le [SEP] scimmie [SEP] , oggi il traguardo è molto meno vistoso , ma anche molto più essenziale .
itwac	Giuseppe Mazza | 28.05.04 14:08 Mi inserisco in questa dotta discussione per notificarvi che godo come una [SEP] scimmia [SEP] per l' arrivo di Capello alla Juve .
itwac	Topten settimana dal 26 Novembre al 2 Dicembre 1 Il patto dei lupi 3.577.598.000 2 Bandits 1.340.699.000 3 Il diario di Bridget Jones 1.051.521.000 4 Training Day 705.694.000 5 Original Sin 660.341.000 6 Santa Maradona 589.219.000 7 L' apparenza inganna 564.768.000 8 Il destino di un Cavaliere 501.661.000 9 Apocalypse Now Redux 474.822.000 10 Compagnie Pericolose 461.684.000 Top Ten stagione 01/02 1 Il diario di Bridget Jones 24.976.996.000 2 The Others 12.755.333.000 3 American Pie 2 10.775.398.000 4 Save the last dance 10.690.200.000 5 Nella Morsa del Ragno 10.414.766.000 6 Il Pianeta delle [SEP] Scimmie [SEP] 10.402.160.000 7 Jurassic Park III 10.363.060.000 8 Scary Movie 2 9.154.964.000 9 Moulin Rouge 8.433.858.000 10 Blow 8.111.889.000 Box Office nel mondo : Per il terzo weekend consecutivo si conferma primo in america Harry Potter sono 24 milioni i dollari incassati che portano il maghetto ad un totale di 220 milioni di dollari in 17 giorni di programmazione ( perso quindi il record dei 200 milioni di dollari in 13 giorni ancora detenuto da Star Wars Episodio I ) .
itwac	Ancora oggi , in Germania , ricordando questa storia , i bambini cantano una filastrocca che si intitola proprio : " Le [SEP] scimmie [SEP] corrono e corrono nella foresta .
itwac	Il salto ascensionale , dall' Osso all' astronave , dalla protesi operativa all' Intelligenza Artificiale , il passaggio dalla [SEP] scimmia [SEP] all' uomo si sono rivelati inesatti .
itwac	Anya Una [SEP] scimmia [SEP] che gioca ad hockey ?
itwac	Ilia Scritto da : vitocalmonti il 07 - 12 - 04 alle 22:14 Dici bene , amico mio , le [SEP] scimmie [SEP] giapponesi non sanno come vive lo scimpanzè napoletano , se no farebbero la revoluciòn ...
itwac	Il Klebsiella è un batterio normalmente innocuo , che si rivela virulento nei pazienti malati di Aids , soprattutto in Africa , e nelle scimmie e nei primati che soffrono di Aids delle [SEP] scimmie [SEP] .
itwac	Sempre più determinato iniettò un liquido contenente parti del cervello di persone decedute per kuru , attraverso dei fori trapanati nel cranio , direttamente nel cervello delle [SEP] scimmie [SEP] vive .
itwac	proviene dal fatto che è arrapato e peloso come una [SEP] scimmia [SEP] ...
itwac	La cosa più " nobile " per un essere umano è parlare , usare la mente , non agire come una [SEP] scimmia [SEP] .
itwac	La [SEP] scimmia [SEP] le dice : " Sto fumando una canna , sali e fumane un po' !
itwac	-- attenzione S P O I L E R E se il finale non è dei più rosei , in parte è lo spirito apocalittico di Gilliam ( l' Esercito delle 12 [SEP] Scimmie [SEP] per es ) e in parte è realismo .
itwac	Di conseguenza , non darò da mangiare alle formiche , alle [SEP] scimmie [SEP] o ai cani .
itwac	Longanesi ( 2002 ) L' autore sostiene che il salto di qualità fra il proto-linguaggio ( in qialche modo presente anche in alcune [SEP] scimmie [SEP] antropomorfe ) e il linguaggio dotato di sintassi è il vero " gradino " che rende l' uomo unico .
itwac	Si tratta di un comportamento osservato prima solo negli scimpanzé , ossia in una specie di [SEP] scimmia [SEP] antropomorfa .
itwac	Accanto al cantiere del nuovo centro di ricerca sta sorgendo uno zoo , costruito sul modello di Disneyland , con i cavalli - quello di don Verzé ha il nome non esattamente francescano di Imperator - , i canguri , le [SEP] scimmie [SEP] , gli uccelli esotici : « Perché chi soffre ha diritto alla bellezza , e anche al lusso » .
itwac	Il primo era un tipo tarchiato , spalle larghe , lunghissime braccia da [SEP] scimmia [SEP] , l' altro era alto e proporzionato , con gli occhi azzurri e una zazzera di capelli corvini .
itwac	Inviato da : SuperRuby il Jun 14 2005 , 04:15 PM QUOTE ( mde @ Jun 14 2005 , 10:08 AM ) esistono dei videogames che ti mandano talmente in [SEP] scimmia [SEP] che arrivi a sognarli , a me è capitato col tetris sai lo fa anche a me il tetris ?? Inviato da : mde il Jun 14 2005 , 04:30 PM QUOTE ( SuperRuby @ Jun 14 2005 , 04:15 PM ) QUOTE ( mde @ Jun 14 2005 , 10:08 AM ) esistono dei videogames che ti mandano talmente in scimmia che arrivi a sognarli , a me è capitato col tetris sai lo fa anche a me il tetris ?? sisi capita soprattutto con i giochini con struttura di base più semplice ma impegnativi ...
itwac	Oppure cercano nelle bande teppistiche degli stadi l' eredita' genetica del branco di [SEP] scimmie [SEP] ( il che non significa ovviamente che ne apprezzino i risultati o si precludano la possibilita' di azioni correttive ) .
itwac	Prosegui » Recensione 07/03/2004 Big Fish La vita secondo Tim Burton Dopo averci lasciato con un finale cupo ne Il Pianeta Delle [SEP] Scimmie [SEP] , Tim Burton ritorna sul grande schermo con una pellicola agli antipodi rispetto alla precedente , in cui apre una fine ...
itwac	Il primo tema affrontato da questo saggio è : che cosa significa la somiglianza genetica tra umani e grandi [SEP] scimmie [SEP] ?
itwac	Per Walter ( 3 ) : La cultura moderna confonde molto i ruoli uomo-donna , e ci propone una donna [SEP] scimmia [SEP] dell' uomo , questo è il concetto di parità odierno .
itwac	Alla fine , lo scimpanzè chiede al capo degli umani perchè la razza delle [SEP] scimmie [SEP] non sia stata trattata come quella dei cani e dei gatti , con amore e affetto .
itwac	essendo un animale di cattura dovrà liberarsi di tutto quello che ha mangiato da libero , [SEP] scimmie [SEP] , targhe automobilistiche , barattoli di pomodori , telecamere , turisti inesperti , ganci telescopici insomma un purpurì di cose che mi riempirà il terrario .
itwac	Eâ  TM facile fare casino con le chitarre , lo sanno fare anche le [SEP] scimmie [SEP] ...
itwac	ME - 6540 , Sistema per moti rotazionali ScienceWorkshop ME - 6551 , Sistema per moti rotazionali PasPort ME - 6694 , Accessori per lo studio del pendolo di torsione ME - 6800 , Lanciaproiettili ME - 6801 , Lanciaproiettili a lunga gittata ME - 6805 , Corredo ME - 6800 e ME - 6801 , per " esperimento del cacciatore e della [SEP] scimmia [SEP] " ME - 6814 , Ricettore di proiettili per ME - 6825 ME - 6815 , Ricettore di proiettili per ME - 6800 e ME - 6801 ME - 6821 , Supporto per assemblaggio di fototraguardi ai lancia proiettili ME - 6825 , Mini lancia proiettili a corta gittata ME - 6826 , Corredo per ME - 6825 , proiettili per " esperimento del cacciatore e della scimmia " ME - 6827 , Accessori per lancia proiettili : lancio e caduta libera simultanei ME - 6830 , Pendolo balistico con lancia proiettili ME - 6831 , Pendolo balistico ME - 6833 , Giroscopio a ruota di bicicletta ME - 6834 , Piattaforma rotante cinestetica ME - 6959 , Accessorio di collegamento tra piattaforma rotante e rotaia meccanica ME - 8088 , Apparato per lo studio della forza centripeta ME - 8089 , Accessori per lo studio computerizzato della forza centripeta ME - 8091 , Pendolo di Wilberforce ME - 8745 , Accessori per pendolo a g-variabile ME - 8752 , Corredo di masse per pendolo ME - 8950 A , Apparato completo per i moti rotatori ME - 8951 , Piattaforma rotante ME - 8952 , Corredo di accessori per la forza centripeta ME - 8953 , Corredo di accessori per i momenti d' inerzia ME - 8957 , Serbatoio per dimostrazione della forza centrifuga ME - 8960 , Giroscopio ME - 8963 , Staffa per il fissaggio di un sensore di rotazione al giroscopio ME - 9299 , Apparato per esperimenti introduttivi alla meccanica ME - 9341 , Apparato per lo studio dei moti rotatori ME - 9426 , Corredo " fisica al Luna-Park " ME - 9774 , Corredo per lo studio dei momenti d' inerzia ME - 9821 , Pendolo per lo studio della forza centripeta ME - 9837 , Corredo per osservazioni sulla forza centripeta ME - 9845 , Pendolo balistico per ME - 9812 ME - 9858 , Pendolo fisico per ME - 9812 ME - 9859 , Accessorio per lancia proiettili per esperimento di lancio e caduta libera simultaneo .
itwac	Malgrado ciò , il successo dei test condotti sulle [SEP] scimmie [SEP] apre la strada a nuove possibilità di contraccezione maschile .
itwac	Come il nome suggerisce , le Proscimmie hanno dato vita a tutte le specie di [SEP] Scimmie [SEP] , che compaiono infatti sulla terra a partire da circa 35 milioni di anni fa .
itwac	Tenta d' impiccarsi , poi si getta nel vuoto La forza del pensiero fa muovere un robot L' immaginazione si sta avvicinando sempre di più alla realtà , grazie agli esperimenti della Duke University che hanno consentito davvero ad una [SEP] scimmia [SEP] di muovere il braccio meccanico di un automa con la sola forza del pensiero .
itwac	beh , molti nostri cantautori del resto non e' che cantano , diciamo che urlano o gorgheggiano come delle [SEP] scimmie [SEP] ...
itwac	In molte scimmie non antropomorfe che si muovono per " salti " o su quattro zampe è piuttosto allungata , mentre nelle [SEP] scimmie [SEP] antropomorfe è più corta e disposta in senso medio laterale , anche l' ala iliaca aumenta la sua superficie e si dispone ventralmente .
itwac	ha detto di non mettersi al pari di quelle [SEP] scimmie [SEP] che son sempre a Messa e poi al lunedì non si ricordano più niente del Vangelo e con disinvoltura ti fregano l' Iva ...
itwac	Dart dichiarò che il cranio era a metà strada tra gli esseri umani e le [SEP] scimmie [SEP] , un' affermazione confermata solo decenni più tardi .
itwac	Cosi' la [SEP] scimmia [SEP] del prologo scopre l' osso-utensile e lo trasforma immediatamente in un' arma mortale per la sua stessa specie , stabilendo in tal modo il proprio primato .
itwac	Quasi tutte le [SEP] scimmie [SEP] si alzano in piedi e a volte percorrono dei tratti in posizione eretta .
itwac	( segue ) ( Sal / Pe / Adnkronos ) 01 - DIC - 00 17:05 NNNN ZCZC AGI 0358 3 CRO 0 R 01 / + VQZ CR 06 EBOLA : SCOPERTO NUOVO VACCINO , FUNZIONA CON LE [SEP] SCIMMIE [SEP] = ( AGI ) - Roma , 1 dic .
itwac	Quella conoscenza una volta diffusasi a tutte le scimmie dell' isola si è poi trasmessa anche alle [SEP] scimmie [SEP] delle isole vicine , senza che queste ultime avessero avuto un contatto diretto con le altre .
itwac	Frammenti della medesima meteora caduti in altri luoghi ebbero effetto anche su altri personaggi : Hector Hammond avversario di Lanterna Verde II , Rex the Wonder Dog & Bobo la [SEP] Scimmia [SEP] Detective dell' agenzia B.A.A. ( Bureau Animali Avanzati ) .
itwac	, Il Nome Della [SEP] Scimmia [SEP] E' Jack , Altra Mosca Sul Set , Pirati Intorno Al Mondo , Lo Spirito Dell' Inspirazione , Attacchi Computerizzati , della featurette Dead Men Tell No Tales e di alcuni Easter Eggs .
itwac	Data inizio evento ; 30/04/2005 Data fine evento ; 15/05/2005 Età minima consigliata 4 Orario feriale : feriali ore 10 Orario festivo : sabato e domenica ore 15.30 Indirizzo : Teatro della Quattrordicesima - via Oglio 18 Telefono : 02 - 55211300 Titolo : Lo scimmiottino color rosa Abstract : Nel famosissimo bosco di Vattelapesca  che dovrebbe trovarsi in Africa o giù di lì  abita una simpatica famiglia di [SEP] scimmie [SEP] composta da papà , mamma e alcuni scimmiottini .
itwac	Gli attori che hanno rivestito i ruoli delle [SEP] scimmie [SEP] si sono immedesimati nella parte con un apposito corso comportamentale ( li vediamo spesso ciondolare o muoversi a quattro zampe nei momenti di tensione ) .
itwac	Per rispondere alle tue interessanti domande : Onestamente essendo di Teramo , che non è proprio dietro l' angolo , sono stato solo una volta in Arcadia ed ho visto il Pianeta delle [SEP] Scimmie [SEP] di Tim Burton ; avendo visto solo un film li' , non ho termini di paragone con altre pellicole ( magari qualcuna avrebbe potuto mostrarsi non all' altezza se non stampata perfettamente , su uno schermo cosi' grande tutti i difetti vengono esaltati ) , pero' rispetto ad altri cinema certificati THX che ho visto in Italia , soprattutto a Roma ed in Abruzzo , ti assicuro che non c' è paragone .
itwac	È la conferma sperimentale della verità del racconto biblico e dunque della falsità della malaugurata dottrina dello Scimmione primigenio : in barba di chi vorrebbe far credere alle frottole sul Dna , secondo cui l' Uomo e gli altri Primati condividirebbero tutte le proprietà strutturali , tranne alcune secondarie : il pelo , la coda , il numero delle mani e dei piedi , e l' osso ioide : il che spiegherebbe perché le [SEP] scimmie [SEP] non riescono ad articolare parola .
itwac	È sporchissimo , sembra un immondezzaio , le [SEP] scimmie [SEP] onnipresenti ci assalirono per cercare cibo e più volte abbiamo rischiato di venire morsicati .
itwac	: - D scritto il 05  12  2003 alle ore 23:41 da Lord Ragnarock - - # 2 O  o scritto il 05  12  2003 alle ore 23:07 da Veronica - - http://Fatina84.blog.excite.it # 1 Tengo a precisare , per dovere di cronaca , che c' è scimmia e [SEP] scimmia [SEP] ...
itwac	- Ci ha chiamato [SEP] scimmie [SEP] rosse .
itwac	La storia di " Tarzan " è nota a tutti : un neonato rimasto orfano di entrambi i genitori nella giungla africana viene trovato da un branco di [SEP] scimmie [SEP] che lo alleva .
itwac	Nel 1917 Kitayama realizzò saru kani kassen ( il granchio si vendica della [SEP] scimmia [SEP] ) , il gatto e i topi , la cassetta birichina delle lettere ; ma il vero successo venne l' anno successivo con momotaro , che segnò l' esordio del cartoon nipponico in occidente , raggiungendo i cinema francesi .
itwac	" No !! sono una [SEP] scimmia [SEP] ammaestrata a rispondere al suo cellulare !! " lei ride ...
itwac	In questo balletto nero di genuflessioni , di gesti esagerati , di maledizioni continuamente ripetute , la [SEP] scimmia [SEP] , interpretata con forte plasticità nella sua totale nudità e nei suoi borborigmi da Gaetano Bruno , è una sorta di essere infimo , quasi sacrificale nel suo essere fatalmente « peccatore » secondo gli schemi di un mondo ossessivamente perbenista .
itwac	La pianta non ha alcun meccanismo spontaneo per aprire i frutti e quindi per disperdere i semi , ma per fortuna , nel passato , ci ha pensato la natura : le [SEP] scimmie [SEP] , assai ghiotte della polpa , la separavano dai semi amari che venivano , in tal modo , dispersi nell' ambiente .
itwac	Il " capitano " non si è risparmiato ed il dolore al piede è ormai una sorta di " [SEP] scimmia [SEP] sulla spalla " , uno sgradito inquilino con cui fare costantemente i conti .
itwac	fIlmZ Intervista col vampiro The butterfly effect La leggenda del pianista sull' oceano Canone inverso come te nessuno mai The crow Edward mani di forbice Donnie darko Mare dentro Trainspotting nightmare befor christmas Paura e delirio a Las Vegas Blow l' esercito delle 12 [SEP] scimmie [SEP] MY tatoo I lOVe ...
itwac	Nel 1996 è stato scoperto qui a Parma un sistema neurale , i cosiddetti neuroni specchio , che si trova nella [SEP] scimmia [SEP] in un' area filogeneticamente omologa all' area di Broca , quella che nell' uomo sovrintende ad alcune funzioni linguistiche .
itwac	Del resto , in termini evoluzionistici l' uomo discende dalla [SEP] scimmia [SEP] , è un primate .
itwac	Per me sonom un branco di [SEP] scimmie [SEP] .
