corpus	sentence
itwac	Per la creazione della stessa pecora Dolly , occorsero 277 tentativi , per il gatto Carbon Copy 86 , e per creare 33 embrioni di [SEP] scimmie [SEP] ci vollero 738 esperimenti , nessuno dei quali si concluse con la nascita .
itwac	Fino a diventare addirittura un pretesto per guardare l' uomo dall' esterno , un punto di vista insolito e spiazzante , come in due romanzi francesi di questi anni : Parole de Singe ( Parola di [SEP] Scimmia [SEP] , 1990 ) fortunato romanzo d' esordio di Patrick Cahuzac , in cui una scimmia racconta le avventure del suo padrone , e Le gros secret ( Il grosso segreto , 1996 ) , in cui la cagna labrador Baltique è nientemeno che l' autrice delle memorie di Mitterrand .
itwac	" Il pianeta delle [SEP] scimmie [SEP] " mantiene il primo posto ( circa 8 miliardi di incasso totale ) ; cresce anche " The others " che passa dal terzo al secondo posto .
itwac	[SEP] scimmie [SEP] urlatrici ci dicono ma a noi tutto sembrano fuorchè scimmie !
itwac	Causa del vaiolo delle [SEP] scimmie [SEP] Questa malattia è causata dal Monkeypox virus che appartiene al gruppo degli orthopoxvirus .
itwac	2 ) Cinque uomini e una [SEP] scimmia [SEP] sono naufragati su di un \ ' isola deserta .
itwac	Altra novità del palinsesto Disney Channel è la serie ispirata al film Tarzan , trentanovesimo lungometraggio animato di casa Disney , quello che per primo si avvale della rivoluzionaria tecnica computerizzata del " Deep Canavas " che imprime profondità e dinamicità alle evoluzioni acrobatiche del signore delle [SEP] scimmie [SEP] ( " L' ispirazione mi è venuta guardando mio figlio che andava su e giù con lo skate " ha confessato il regista Kevin Lima , che dirige il film con Chris Bukc ) .
itwac	e così il termine operativo per descrivere le tue attività era brachiazione , ovvero il ciondolare delle [SEP] scimmie [SEP] alternando le braccia da un ramo all' altro ; e a un certo punto avresti mancato la presa e saresti caduto perché San Francisco era l' unico albero della giungla che conoscevi -- no , tasformarti in altri animali non ti sarebbe venuto in soccorso ; avresti potuto essere un lemure dalla coda arrotolata e dondolarti proprio con quell' appendice a strisce bianche e nere che ti dava il nome , ma a lungo andare non ti sarebbe stato di alcun aiuto ; saresti potuto diventare un uccello con la testa arancione , un uccello la cui testa era incoronata da piume verdi come bacche acerbe ; ma persino il più brillante e vivace di tutti i pappagalli alla fine avrebbe rinfoderato il ventaglio della coda , esausto , e se la sarebbe trascinata dietro nell' erba terrosa e bagnata ; no , non c' era nulla che poteva aiutarti , non una preghiera a Gesù nella cattedrale con le sue tre cupole dorate , ognuna con la sua croce ( non eri abbastanza puro di spirito perché la tua angoscia si levasse più in alto della torre campanaria ) ; né la ricetta per dei sonniferi , compilata alla farmacia del garage in cui avevi parcheggiato ( fundada en 1950 ) , ti sarebbe stata di alcuna utilità nemmeno se inalavi l' odore del pane appena cotto che si levava verso la tua macchina dalle finestre dei seminterrati -- e no , nemmeno la tua macchina poteva aiutarti , perché non ti era concesso di guidare in altra direzione che non fosse il sud -- ricordi ?
itwac	Una volta che una [SEP] scimmia [SEP] ha imparato a lavare il suo cibo , le scimmie dappertutto cominciano a fare la stessa cosa .
itwac	[SEP] scimmia [SEP] !
itwac	è una specie di [SEP] scimmia [SEP] rossiccia e spelacchiata , con nove braccia e grandi occhi amaranto , un solo capello sul cranio , avviluppato in crocchia .
itwac	" La [SEP] Scimmia [SEP] si convince e si mette a correre con tutti gli altri animali .
itwac	Karl Malone , 32 anni di cui 16 passati sul grande lago salato , ha sempre la famosa [SEP] scimmia [SEP] nella spalla ( se gli americani volevano il premio di " modo di dire più brutto " hanno vinto a mani basse ) dell' anello mancante .
itwac	Ma l' uomo come tutto non può diventare nel corso della storia [SEP] scimmia [SEP] o formica , né attualmente macchina di riflessi , tranne nelle orrende circostanze che lo portano a questi limiti , da cui egli ritorna a se stesso se non muore come individuo .
itwac	Ovunque statue , dipinti , mosaici che raffigurano [SEP] scimmie [SEP] in atteggiamenti sbarazzini , quasi beneauguranti .
itwac	All' anno cruciale 1940 ( intercorso tra la separazione e le nuove nozze con Rivera ) , rimanda Autoritratto con collana di spine , in cui la presenza degli animali alle sue spalle , il gatto e la [SEP] scimmia [SEP] ( che compaiono in molti altri dipinti ) , sembra confortare il dolore derivato dall' irto intreccio di rami annodati attorno al collo , mentre Autoritratto coi capelli tagliati , con l' abbigliamento maschile e le ciocche nere dei lunghi capelli appena recisi , sparse sul pavimento della stanza spoglia , proferisce una " rinuncia " simbolica , rinforzata dalle sovrastanti note di una popolare canzone del tempo , ai suoi attributi femminili di seduzione .
itwac	Se nuovi studi accerteranno che il processo riscontrato nelle [SEP] scimmie [SEP] si verifica anche nell' uomo anziano , potrebbero aprirsi interessanti prospettive farmacologiche .
itwac	Dammi i 30 anni che l' asino ha rifiutato , i 15 che il cane non ha voluto e i 10 che la [SEP] scimmia [SEP] ha respinto .
itwac	Gli altri due fanno già le [SEP] scimmie [SEP] sul divano e si tirano addosso pop-corn e pistacchi , di cui non conosco le origini .
itwac	Io stesso oltre a vedere il via vai dei lucertoloni e delle [SEP] scimmie [SEP] ho visto delle specie di grosse carpe nere nelle pozze fangose attaccate a delle carcasse .
itwac	" , disse la [SEP] scimmia [SEP] .
itwac	Ecco il calendario : il 9 novembre i grandissimi Good Fellas , il 16 novembre l' emergente Alessandro Ristori , il 23 novembre i demenziali Gem Boy e il 30 novembre di nuovo Filippo Malatesta E per i sabati comici a Le [SEP] Scimmie [SEP] di Faenza .
itwac	La terza parte del sogno parla di una " piccola [SEP] scimmia [SEP] " sappiamo tutti che la " scimmia " nello zen e' riferita alla mente comune , alla razionalita' egoica che si oppone alla Mente , al Tao ...
itwac	Lei indossava un boa piumato e tu , il selvaggio e altissimo Raul , perdevi tutte le tue qualità sotto un abito dal taglio elegante e un bastone da passeggio sul quale poggiavi le lunghissime gambe  Sei un borghese  ti sussurrai all' orecchio fingendomi agitato come una [SEP] scimmia [SEP] - un vero borghese - continuai a ripetere saltellandoti intorno .
itwac	Possiamo spaventare e allontanare la [SEP] scimmia [SEP] ( temporaneamente ) , ma ci rimane la sensazione frustrante e deprimente che questo approccio non ci stia portando davvero nella direzione voluta .
itwac	Cominciarono gli americani a chiamare , nello slang , monkey [SEP] scimmia [SEP] , la condizione del drogato .
itwac	Nel Luglio 1997 è stato pubblicato in Italia il libro La rivolta della ragione , filosofia marxista e scienza moderna di Alan Woods e Ted Grant che nel capitolo dodicesimo riprende il testo di Engels parte avuta dal lavoro nel processo di umanizzazione della [SEP] scimmia [SEP] .
itwac	come [SEP] scimmie [SEP] col grembiule " ( sic !
itwac	( ANSA ) - LONDRA , 12 MAG - Tre quadri dipinti da uno scimpanze' , un tempo definito il ' Cezanne delle [SEP] scimmie [SEP] ' , saranno messi all' asta il mese prossimo a Londra .
itwac	[SEP] scimmie [SEP] ...
itwac	Non un animale umanizzato , ma un uomo animalizzato : allevato dalle [SEP] scimmie [SEP] come uno di loro , recupera da solo la propria natura umana , imparando a leggere sui libri trovati nella capanna dei genitori .
itwac	Ai nostri cretinetti non sfiorerà mai la mente che anche l' elettore americano più ostile a Bush - un certo cantante , mi pare Sting , arrivava a paragonarlo a una [SEP] scimmia [SEP]  non si sognerebbe mai di riconoscersi in simile giudizio .
itwac	Proprio come nella " Teoria della centesima [SEP] scimmia [SEP] " , può essere trovata in ogni tipo di persona ed il suo numero sta aumentando rapidamente .
itwac	Vi salì sopra per prendere dai travicelli un recipiente pieno di burro con cui nutrì le [SEP] scimmie [SEP] che erano lì .
itwac	Sei milioni di anni fa uomini e [SEP] scimmie [SEP] appartenevano alla stessa specie .
itwac	Langur di Delacour ( Trachypithecus delacouri ) è una [SEP] scimmia [SEP] bianca e nera , con una lunga coda cespugliosa , che si nutre di foglie .
itwac	Ad ogni modo , in breve : si citava una scena , in cui una [SEP] scimmia [SEP]  un ominide , un nostro progenitore  abbranca un osso , cominciandolo ad utilizzare come uno strumento ( non senza un' estrema , grottesca contentezza , nei suoi tratti pre-umani !
itwac	Dovette destare minor interesse lo spettacolo con cani e [SEP] scimmie [SEP] svoltosi nello stesso anno al teatro delle marionette sotto la guida di Antonio Chiesa , che incassò soltanto 516 lire , 103 delle quali andarono alla Società dei cavalieri .
itwac	L' associazione Conservation International ha annunciato in una conferenza stampa la scoperta di due nuove specie di [SEP] scimmie [SEP] nella Foresta Amazzonica .
itwac	Inoltre si fa tanta fatica a concentrarsi , proprio perché il carattere del vijnana è di essere come una [SEP] scimmia [SEP] che salta di ramo in ramo Il quinto anello della catena è chiamato sadayatana , o le " sei sfere sensoriali " , di cui cinque corrispondono ai cinque sensi che conosciamo e la sesta alla conoscenza mentale , manas o citta .
itwac	Si limita ad osservare che i difetti dello sviluppo sono finora stati osservati soprattutto nei suini e nei bovini , mentre cloni animali piu' geneticamente vicini all' uomo , come le [SEP] scimmie [SEP] sono , ha detto , " in condizioni perfette .
itwac	Si' , per le [SEP] scimmie [SEP] .
itwac	LA SCOPERTA DELLA DOPPIA ELICA Una grande scoperta , un debutto silenzioso Una struttura , mille funzioni Da una molecola di DNA a due molecole di DNAâ  ¦ Il dogma centrale : dal DNA alle proteine Il DNA : prima e dopo , le tappe salienti Rosalind Franklin : lâ  TMeroina mancata della scoperta del DNA Le implicazioni al giorno dâ  TMoggi degli studi sul DNA DNA e malattie Il destino nel DNA Geni e ambiente Il DNA e la rivoluzione in medicina La medicina predittiva l genoma : il puzzle dellâ  TMevoluzione Uomo e [SEP] scimmia [SEP] : una manciata di basi nucleotiche Lâ  TMorigine dellâ  TMuomo nel suo DNA Non esistono razze umane Il DNA e lâ  TMarte Il DNA e lâ  TMarte : mostre in programma per il 2003 Bibliografia scarica il PDF Dossier : Cinquantâ  TManni di DNA â  " Parte I Uomo e scimmia : una manciata di basi nucleotiche La comprensione della storia evolutiva attraverso lâ  TManalisi del DNA si basa sullâ  TMinvenzione di alcune tecniche di analisi inventate durante gli anni â  TM 80 , e dalla scoperta della presenza nel genoma di tratti caratteristici che variano da un individuo allâ  TMaltro , chiamati polimorfismi .
itwac	Macaco : rappresentante sindacato [SEP] scimmie [SEP] medie , ladro di Tequila e Jack Daniels , di origine irachena .
itwac	Ma come disse il mio Maestro , prendiamo , quando occorre , la [SEP] scimmia [SEP] per la coda , ovvero fermiamo il nostro pensiero i nostri sogni per salire a bordo e viverli con reale intensità , qui ed ora .
itwac	Ma anche la scimmia ha un ritmo suo proprio , l' eguaglianza delle membra , la concordanza delle parti , ecc. La bellezza della [SEP] scimmia [SEP] diminuirebbe se il suo corpo fosse alterato .
itwac	Naturalmente non è possibile verificare con assoluta certezza la validità della fonte , ma per ora questa è l' unica immagine che possa dare qualche indizio sulla fisionomia della [SEP] scimmia [SEP] .
itwac	Non fu il primo , bensì il quarantesimo virus ad essere scoperto soltanto nelle [SEP] scimmie [SEP] .
itwac	Abbiamo scoperto che , anticamente , in Tibet il calendario era basato su un ciclo di dodici anni e ogni anno prendeva il nome da un animale : topo , bue , tigre , lepre , dragone , serpente , cavallo , pecora , [SEP] scimmia [SEP] , cane e maiale .
itwac	Beh , a parte che i costi sono assolutamente improponibili , il costo su una singola [SEP] scimmia [SEP] è enorme .
itwac	La minaccia di una scimmia dominante è ovviamente molto più efficace di quella di una [SEP] scimmia [SEP] sottomessa .
itwac	Studiando il comportamento intelligente delle [SEP] scimmie [SEP] antropoidi , ha potuto riscontrare in esse il fenomeno dell' insight .
itwac	In questo caso si tratta di [SEP] scimmie [SEP] ( l' interlocutore si dichiara « amante de estos animales » ) : il pezzo forte è un saimiri , la scimmia scoiattolo , fra i primati a più alto rischio di estinzione del Centro America .
itwac	Infine , siccome per rallegrare la scena mancava la [SEP] scimmia [SEP] , con lo stesso colore ho tinto la faccia di Pietrino che appunto stava berciando e sgambettando come una bertuccia , e servendomi d' uno straccio strettamente legato gli ho anche fabbricato una splendida coda che ho assicurata alla cintola del marmocchio , sotto la sottanina .
itwac	In un articolo pubblicato oggi sulla rivista Nature Medicine , ricercatori americani e canadesi coordinati da Steven Jones della Public Health Agency of Canada spiegano di aver ottenuto importanti risultati sulle [SEP] scimmie [SEP] .
itwac	mi hanno aperto una ferita a colpi di ago e bisturi senza anestesia ( " e' un lavoro di routine , in genere non usiamo anestetici per cose di questo tipo , se fa male basta che me lo dice " ) : [ silenzio ] AAAAAAAAAAAAAAAA MALE MALE BASTA BA * AAAAAAAA SMETTILA BRUTTO C * TI STACCO LA TESTA A GINOCCHIATE VAI VIAAAAAA TESTA DI C * dopo 2 anni di cure di questo tipo la mia soglia del dolore e' grande abbastanza da farvi soffrire tutti di invidia del pene , ma nonostante cio' ho urlato come una [SEP] scimmia [SEP] anche stavolta .
itwac	Scrollati di dosso la [SEP] scimmia [SEP] dell' indifferenza .
itwac	Si muoveva con l' agilità di un' enorme [SEP] scimmia [SEP] , eppure aveva qualcosa di umano nella sua postura .
itwac	Così si trasformarono in [SEP] scimmie [SEP] .
itwac	E ora ti saluta anche la [SEP] scimmia [SEP] indispettita che saltella sulla mia spalla ansiosa di scrivere un pò lei , ma ora no , dobbiamo spegnere , dobbiamo andare , non ricordi ...
itwac	- Il London Daily Mail riporta che Jackson è così patito di King Kong che una volta tagliuzzò la pelliccia di sua madre e vi confezionò un modello di una grande [SEP] scimmia [SEP] .
itwac	Concludo quindi con qualche perle di saggezze , ma non quelle di Zoitberg perchè mi fanno cagare : - non posso mettermi con te perchè i miei nemici possono soprirci e non potrei proteggerti ; - quando il libro è finito chiudilo ; - se pensi di essere un pilastro dell' universo , non lo sei perchè siamo già al completo ; - cerca di conquistare il mondo mettendo tasse sulla musica e sul cielo ; questa mail è stata ideata , interpretata , e scritta da MS Cacati Ad DOS s , il nuovo bug con qualche pezzo di sistema operativo ; il pulstante " invia " lo ha premuto la [SEP] scimmia [SEP] ingeniere austronautico sorella della scimmia che ha battuto la mail di max peso scritto da Xam alle ore 23:32:21 commenta leggi commenti ( 0 ) 11.11.2004 Xam 15/09/2004 L' estate sta finendo ...
itwac	Così , all' inizio degli anni Ottanta , dopo il fallimento di The Envoy , sembrò che Zevon stesse per abbandonare la scena ; era stanco , a corto di idee , con la [SEP] scimmia [SEP] sulla spalla .
itwac	Grazie ai dati del Progetto Genoma , sembra delinearsi una vera rivoluzione nell' « albero evolutivo » dell' umanità « L' uomo e la [SEP] scimmia [SEP] ?
itwac	Il Klebsiella è un batterio normalmente innocuo , che si rivela virulento nei pazienti malati di Aids , soprattutto in Africa , e nelle scimmie e nei primati che soffrono di Aids delle [SEP] scimmie [SEP] .
itwac	È vero quello che Oriana Fallaci ha scritto sul Corriere pochi giorni fa , quando ha raccontato di una [SEP] scimmia [SEP] che ha sviluppato un cancro fulminante , dopo l' impianto di staminali embrionali nel cervello .
itwac	Andate affanculo siete solo delle teste di cazzo che si divertono ad andare in giro a cagare in testa ai passanti e poi a sputargli in faccia inoltre voi vi mettete a tirare la merda alle auto e poi la situazione degenera e diventate dei pazzoidi scatenati poi quando arrivano i corpi speciali gli saltate addosso come delle [SEP] scimmie [SEP] mongoloidi e imprevedibili e iniziate a cagargli in testa poi il carminati vi dice che quando sarete vecchi andrete in giro con delle scimmiette del congo a farle ballare per avere l' elemosina e c' ha ragione lui il carminati perchè è un fottuto maestro di vita del cazzo oltre che di musica voi invece dovete andare in giro a farvi stuprare per comprarvi un po' di droga teste di cazzo puttane ripiene di letame che non siete altro partecipate alle orge e vi fate sempre fottere dal primo sfigato che passa gli mangiate pure la merda e siete dei froci del cazzo supertransessuali andate affanculo !!!
itwac	HONG KONG - CINA L' Anno della Scimmia : fatti e notizie fra il serio e il semi-serio ( scheda ) Dedicato a Giovanni Paolo II , nato sotto il segno cinese della Scimmia , con l' augurio di incrementare i rapporti con la Cina Hong Kong ( AsiaNews / SE ) - L' Anno della [SEP] Scimmia [SEP] cade nel 2004 secondo il calendario Gregoriano e nel 4701 secondo il calendario tradizionale cinese , in cui ogni anno è rappresentato da un animale , per un ciclo di 12 anni .
itwac	le povere scimmie e gli intelligenti di turno From : " Agreen " annamay at tin.it Date : Sat , 10 Jul 2004 05:19:14 + 0200 CERVELLO : USA , CON ELETTRODI PREVISTE AZIONI SCIMMIE / ANSA ( ANSA ) - ROMA , 9 LUG - Leggere nel pensiero , il traguardo e' piu' vicino : ricercatori guidati da Richard Andersen presso il California Institute of Technology a Pasadena , ci sono riusciti per la prima volta nelle [SEP] scimmie [SEP] prevedendo le loro intenzioni .
itwac	) Il pianeta delle [SEP] scimmie [SEP] , e quello che mi ha trasmesso più emozioni in assoluto è sicuramente quella splendida fiaba che è EDWARD MANI DI FORBICE , piango ogni volta che lo rivedo ...
itwac	entra nel template , e scrivendo due tre righe di PHP che anche una [SEP] scimmia [SEP] saprebbe scrivere può : ...
itwac	Il successo del film " Il pianeta delle [SEP] scimmie [SEP] " diede origine ad una vera e propria saga , composta da quattro sequel cinematografici , una serie per la televisione , una serie a cartoni animati , romanzi e racconti a fumetti .
itwac	Ma in mezzo agli sciacalli , le pantere , le cagne , le [SEP] scimmie [SEP] , gli scorpioni , gli avvoltoi , i serpenti , fra i mostri che guaiscono , urlano , grugniscono entro il serraglio infame dei nostri vizi , uno ve n' è , più laido , più cattivo , più immondo .
itwac	Ad ogni modo , in breve : si citava una scena , in cui una [SEP] scimmia [SEP]  un ominide , un nostro progenitore  abbranca un osso , cominciandolo ad utilizzare come uno strumento ( non senza un' estrema , grottesca contentezza , nei suoi tratti pre-umani !
itwac	Questo problema è quasi identico al a quello della [SEP] scimmia [SEP] e delle noci di cocco ma è un po' più sconcertante per il fatto delle mezze uova .
itwac	MY DVD COLLECTION 1 ) 007 : MISSIONE GOLDFINGER 2 ) 007 : MAI DIRE MAI 3 ) 007 : DIE ANOTHER DAY 4 ) AKIRA 5 ) ALDO , GIOVANNI E GIACOMO  NON SOLO I CORTI 6 ) ALIAS : STAGIONE 1 7 ) ALIENS : SCONTRO FINALE 8 ) BABIL JUNIOR : LA LEGGENDA 9 ) BASIC 10 ) BATMAN 11 ) LE BIZZARRE AVVENTURE DI JOJO  DISCO 1 12 ) BLADE 13 ) BLADE II 14 ) BRAVEHEART 15 ) THE BLUES BROTHERS 16 ) THE CELL 17 ) I CIELI DI ESCAFLOWNE  DISCO 1 18 ) IL COLLEZIONISTA DI OSSA 19 ) COLOMBO  STAGIONE 1 20 ) COLPO GROSSO AL DRAGO ROSSO ( RUSH HOUR II ) 21 ) THE CROW 22 ) CUBE 23 ) DALTANIOUS  DISCO 2 24 ) DAREDEVIL 25 ) DIE HARD 26 ) DIE HARD II : DIE HARDER 27 ) DIE HARD III : DIE HARD WITH A VENGEANCE 28 ) DRAGONHEART 29 ) DUE MAFIOSI CONTRO AL CAPONE 30 ) DUNE 31 ) DUNE  THE TV SERIES 32 ) ENIGMA 33 ) L' ERA GLACIALE 34 ) L' ESERCITO DELLE 12 [SEP] SCIMMIE [SEP] 35 ) EXCALIBUR 36 ) FORREST GUMP 37 ) FROM HELL  LA VERA STORIA DI JACK LO SQUARTATORE 38 ) FREQUENCY 39 ) GHOSTBUSTERS 40 ) IL GIGANTE DI FERRO 41 ) IL GLADIATORE 42 ) INDIANA JONES COLLECTION : I PREDATORI DELL' ARCA PERDUTA 43 ) INDIANA JONES COLLECTION : INDIANA JONES E IL TEMPIO MALEDETTO 44 ) INDIANA JONES COLLECTION : INDIANA JONES E L' ULTIMA CROCIATA 45 ) HULK 46 ) HURRICANE POLYMAR  DISCO 1 47 ) HURRICANE POLYMAR  DISCO 2 48 ) HURRICANE POLYMAR  DISCO 3 49 ) LA LEGGENDA DEGLI UOMINI STRAORDINARI 50 ) LOST IN SPACE 51 ) LA MALEDIZIONE DELLA PRIMA LUNA 52 ) MAN ON THE MOON 53 ) THE MAJESTIC 54 ) MATRIX : THE ULTIMATE COLLECTION  ANIMATRIX 55 ) MATRIX : THE ULTIMATE COLLECTION  MATRIX 56 ) MATRIX : THE ULTIMATE COLLECTION  MATRIX RELOADED 57 ) MATRIX : THE ULTIMATE COLLECTION  MATRIX REVOLUTION 58 ) THE MEDALLION 59 ) IL MIGLIO VERDE 60 ) MINORITY REPORT 61 ) IL MISTERO DI SLEEPY HOLLOW 62 ) MISTERY MEN 63 ) L' OMBRA DEL VAMPIRO 64 ) THE ONE 65 ) IL PATRIOTA 66 ) PSYCHO 67 ) IL QUINTO ELEMENTO 68 ) RECORD OF LODOSS WAR : THE TV SERIES  DISCO 1 69 ) ROBOCOP TRILOGY  ROBOCOP 70 ) ROBOCOP TRILOGY  ROBOCOP II 71 ) ROBOCOP TRILOGY  ROBOCOP III 72 ) SCREAM 73 ) I SETTE SAMURAI 74 ) SKY CAPTAIN AND THE WORLD OF TOMORROW 75 ) IL SIGNORE DEGLI ANELLI  LA COMPAGNIA DELL' ANELLO SEE 76 ) IL SIGNORE DEGLI ANELLI  LE DUE TORRI SEE 77 ) IL SIGNORE DEGLI ANELLI  IL RITORNO DEL RE SEE 78 ) I SOLITI SOSPETTI 79 ) SPIDER-MAN  Limited Ed. 3 DVD 80 ) SPIDER-MAN  New Special Edition 81 ) SPIDER-MAN 2  Limited Edition 82 ) STARGATE SG 1 : STAGIONE 1  DISCO 1 83 ) STARGATE SG 1 : STAGIONE 1  DISCO 2 84 ) STAR TREK II : L' IRA DI KHAN 85 ) STAR TREK IV : ROTTA VERSO LA TERRA 86 ) STAR TREK VI : ROTTA VERSO L' IGNOTO 87 ) STAR TREK VIII : PRIMO CONTATTO 88 ) STAR TREK IX : L' INSURREZIONE 89 ) STAR TREK X : LA NEMESI 90 ) STAR TREK  THE ORIGINAL SERIES : STAGIONE 1 91 ) STAR TREK  THE ORIGINAL SERIES : STAGIONE 2 92 ) STAR TREK  THE NEXT GENERATION : STAGIONE 1  DISCO 1 93 ) STAR TREK  THE NEXT GENERATION : STAGIONE 3 94 ) STAR TREK  THE NEXT GENERATION : STAGIONE 4 95 ) STAR TREK  THE NEXT GENERATION : STAGIONE 5 96 ) STAR TREK  THE NEXT GENERATION : STAGIONE 7 97 ) STAR TREK  DEEP SPACE NINE : STAGIONE 4 98 ) STAR TREK  DEEP SPACE NINE : STAGIONE 5 99 ) STAR TREK  DEEP SPACE NINE : STAGIONE 6 100 ) STAR TREK  DEEP SPACE NINE : STAGIONE 7 101 ) STAR WARS  EPISODIO II : L' ATTACCO DEI CLONI 102 ) STAR WARS  EPISODIO IV : UNA NUOVA SPERANZA 103 ) STAR WARS  EPISODIO V : L' IMPERO COLPISCE ANCORA 104 ) STAR WARS  EPISODIO VI : IL RITORNO DELLO JEDI 105 ) SUPERMAN 106 ) SUPERMAN II 107 ) SUPERMAN  THE FIRST ANIMATED SERIES VOL. I 108 ) SUPERMAN  THE FIRST ANIMATED SERIES VOL. II 109 ) LA TIGRE E IL DRAGONE 110 ) TERMINATOR II 111 ) THUNDERBIRDS ARE GO !
itwac	Se proprio vogliamo , sarebbe un anello mancante fra le antropomorfe e le altre [SEP] scimmie [SEP] .
itwac	I motivi ufficiali della visita sono l' inaugurazione del nuovo anno lunare della [SEP] scimmia [SEP] e la coincidenza con il quarantesimo anniversario del riconoscimento della Repubblica popolare cinese da parte del generale de Gaulle .
itwac	Un gruppo di 8 [SEP] scimmie [SEP] di 25 anni nelle quali la patologia , pur non avendo ancora compromesso l' integrità cellulare aveva bloccato o almeno ridotto la produzione di dopamina , dopo un trattamento di tre mesi con iniezioni intracerebrali di lenti-GDNF , ha sviluppato una ripresa molto consistente della produzione del neurotrasmettitore , fino a livelli simili a quelli riscontrabili nel cervello di soggetti giovani .
itwac	Rengger insegnò molto facilmente ad una [SEP] scimmia [SEP] americana a spaccare così le noci di cocco , e in seguito l' animale adoperò quel sistema per rompere ogni sorta di noci , come pure le scatole ; essa toglieva anche la pellicola del frutto , dal sapore sgradevole .
itwac	Una parte del gruppo ha avuto la fortuna di incappare nelle fantomatiche [SEP] scimmie [SEP] dei cedri , offrendo loro una banana .
itwac	Certo che no e , allora , tanto vale che cerchiate di dissuaderli e non turarvi occhi , orecchie e bocche , come le famose tre [SEP] scimmie [SEP] .
itwac	Oltre a dare indicazioni precise sull' arrivo di Homo erectus nella regione indonesiana e australiana , la scoperta suggerisce un nuovo modo di guardare questo nostro progenitore : non più una semplice [SEP] scimmia [SEP] un po' più evoluta , ma un ominide dotato di capacità cognitive finora solo vagamente sospettate .
itwac	scritto il 21/04/04 alle 15:26 ( + Forum book ) - Scritto da : Anonimo Per un pugno di byte sono disposti a farsi guardare , misurare , controllare e " nutrire " di cose " sicuramente interesanti " , proprio come una [SEP] scimmia [SEP] allo zoo .
itwac	Continente Asiatico Entello ( Presbytis entellus ) L' Entello o Langur è chiamato anche " [SEP] scimmia [SEP] sacra indiana " poiché rappresenta , nella mitologia indù , il dio Hanumam , re delle scimmie .
itwac	Rosella Redaelli L' INIZIATIVA Elio e le [SEP] scimmie [SEP] di Kafka al « Darwin Day » Il naturalista inglese Charles Robert Darwin pubblica nel 1871 « La discendenza dell' uomo » in cui affronta l' origine umana proveniente da specie inferiori , e l' Inghilterra conservatrice gli si scaglia contro .
itwac	Il volume del traffico internazionale di animali , piante e loro derivati è , ogni anno , di 350 milioni di esemplari , tra cui : 5 milioni di uccelli , 37 mila [SEP] scimmie [SEP] , decine di migliaia di rettili , 12 milioni di orchidee e 11 milioni di cactus .
